docs/results/fp8-config-space-pack.json
{
  "generated_at_utc": "2026-05-07T17:43:44.567450+00:00",
  "matmul": {
    "count": 324,
    "configs": [
      {
        "BLOCK_M": 64,
        "BLOCK_N": 64,
        "BLOCK_K": 32,
        "num_warps": 4,
        "num_stages": 2,
        "SPLIT_K": 1
      },
      {
        "BLOCK_M": 64,
        "BLOCK_N": 64,
        "BLOCK_K": 32,
        "num_warps": 4,
        "num_stages": 2,
        "SPLIT_K": 2
      },
      {
        "BLOCK_M": 64,
        "BLOCK_N": 64,
        "BLOCK_K": 32,
        "num_warps": 4,
        "num_stages": 2,
        "SPLIT_K": 4
      },
      {
        "BLOCK_M": 64,
        "BLOCK_N": 64,
        "BLOCK_K": 32,
        "num_warps": 4,
        "num_stages": 3,
        "SPLIT_K": 1
      },
      {
        "BLOCK_M": 64,
        "BLOCK_N": 64,
        "BLOCK_K": 32,
        "num_warps": 4,
        "num_stages": 3,
        "SPLIT_K": 2
      },
      {
        "BLOCK_M": 64,
        "BLOCK_N": 64,
        "BLOCK_K": 32,
        "num_warps": 4,
        "num_stages": 3,
        "SPLIT_K": 4
      },
      {
        "BLOCK_M": 64,
        "BLOCK_N": 64,
        "BLOCK_K": 32,
        "num_warps": 4,
        "num_stages": 4,
        "SPLIT_K": 1
      },
      {
        "BLOCK_M": 64,
        "BLOCK_N": 64,
        "BLOCK_K": 32,
        "num_warps": 4,
        "num_stages": 4,
        "SPLIT_K": 2
      },
      {
        "BLOCK_M": 64,
        "BLOCK_N": 64,
        "BLOCK_K": 32,
        "num_warps": 4,
        "num_stages": 4,
        "SPLIT_K": 4
      },
      {
        "BLOCK_M": 64,
        "BLOCK_N": 64,
        "BLOCK_K": 32,
        "num_warps": 8,
        "num_stages": 2,
        "SPLIT_K": 1
      },
      {
        "BLOCK_M": 64,
        "BLOCK_N": 64,
        "BLOCK_K": 32,
        "num_warps": 8,
        "num_stages": 2,
        "SPLIT_K": 2
      },
      {
        "BLOCK_M": 64,
        "BLOCK_N": 64,
        "BLOCK_K": 32,
        "num_warps": 8,
        "num_stages": 2,
        "SPLIT_K": 4
      },
      {
        "BLOCK_M": 64,
        "BLOCK_N": 64,
        "BLOCK_K": 32,
        "num_warps": 8,
        "num_stages": 3,
        "SPLIT_K": 1
      },
      {
        "BLOCK_M": 64,
        "BLOCK_N": 64,
        "BLOCK_K": 32,
        "num_warps": 8,
        "num_stages": 3,
        "SPLIT_K": 2
      },
      {
        "BLOCK_M": 64,
        "BLOCK_N": 64,
        "BLOCK_K": 32,
        "num_warps": 8,
        "num_stages": 3,
        "SPLIT_K": 4
      },
      {
        "BLOCK_M": 64,
        "BLOCK_N": 64,
        "BLOCK_K": 32,
        "num_warps": 8,
        "num_stages": 4,
        "SPLIT_K": 1
      },
      {
        "BLOCK_M": 64,
        "BLOCK_N": 64,
        "BLOCK_K": 32,
        "num_warps": 8,
        "num_stages": 4,
        "SPLIT_K": 2
      },
      {
        "BLOCK_M": 64,
        "BLOCK_N": 64,
        "BLOCK_K": 32,
        "num_warps": 8,
        "num_stages": 4,
        "SPLIT_K": 4
      },
      {
        "BLOCK_M": 64,
        "BLOCK_N": 64,
        "BLOCK_K": 64,
        "num_warps": 4,
        "num_stages": 2,
        "SPLIT_K": 1
      },
      {
        "BLOCK_M": 64,
        "BLOCK_N": 64,
        "BLOCK_K": 64,
        "num_warps": 4,
        "num_stages": 2,
        "SPLIT_K": 2
      },
      {
        "BLOCK_M": 64,
        "BLOCK_N": 64,
        "BLOCK_K": 64,
        "num_warps": 4,
        "num_stages": 2,
        "SPLIT_K": 4
      },
      {
        "BLOCK_M": 64,
        "BLOCK_N": 64,
        "BLOCK_K": 64,
        "num_warps": 4,
        "num_stages": 3,
        "SPLIT_K": 1
      },
      {
        "BLOCK_M": 64,
        "BLOCK_N": 64,
        "BLOCK_K": 64,
        "num_warps": 4,
        "num_stages": 3,
        "SPLIT_K": 2
      },
      {
        "BLOCK_M": 64,
        "BLOCK_N": 64,
        "BLOCK_K": 64,
        "num_warps": 4,
        "num_stages": 3,
        "SPLIT_K": 4
      },
      {
        "BLOCK_M": 64,
        "BLOCK_N": 64,
        "BLOCK_K": 64,
        "num_warps": 4,
        "num_stages": 4,
        "SPLIT_K": 1
      },
      {
        "BLOCK_M": 64,
        "BLOCK_N": 64,
        "BLOCK_K": 64,
        "num_warps": 4,
        "num_stages": 4,
        "SPLIT_K": 2
      },
      {
        "BLOCK_M": 64,
        "BLOCK_N": 64,
        "BLOCK_K": 64,
        "num_warps": 4,
        "num_stages": 4,
        "SPLIT_K": 4
      },
      {
        "BLOCK_M": 64,
        "BLOCK_N": 64,
        "BLOCK_K": 64,
        "num_warps": 8,
        "num_stages": 2,
        "SPLIT_K": 1
      },
      {
        "BLOCK_M": 64,
        "BLOCK_N": 64,
        "BLOCK_K": 64,
        "num_warps": 8,
        "num_stages": 2,
        "SPLIT_K": 2
      },
      {
        "BLOCK_M": 64,
        "BLOCK_N": 64,
        "BLOCK_K": 64,
        "num_warps": 8,
        "num_stages": 2,
        "SPLIT_K": 4
      },
      {
        "BLOCK_M": 64,
        "BLOCK_N": 64,
        "BLOCK_K": 64,
        "num_warps": 8,
        "num_stages": 3,
        "SPLIT_K": 1
      },
      {
        "BLOCK_M": 64,
        "BLOCK_N": 64,
        "BLOCK_K": 64,
        "num_warps": 8,
        "num_stages": 3,
        "SPLIT_K": 2
      },
      {
        "BLOCK_M": 64,
        "BLOCK_N": 64,
        "BLOCK_K": 64,
        "num_warps": 8,
        "num_stages": 3,
        "SPLIT_K": 4
      },
      {
        "BLOCK_M": 64,
        "BLOCK_N": 64,
        "BLOCK_K": 64,
        "num_warps": 8,
        "num_stages": 4,
        "SPLIT_K": 1
      },
      {
        "BLOCK_M": 64,
        "BLOCK_N": 64,
        "BLOCK_K": 64,
        "num_warps": 8,
        "num_stages": 4,
        "SPLIT_K": 2
      },
      {
        "BLOCK_M": 64,
        "BLOCK_N": 64,
        "BLOCK_K": 64,
        "num_warps": 8,
        "num_stages": 4,
        "SPLIT_K": 4
      },
      {
        "BLOCK_M": 64,
        "BLOCK_N": 64,
        "BLOCK_K": 128,
        "num_warps": 4,
        "num_stages": 2,
        "SPLIT_K": 1
      },
      {
        "BLOCK_M": 64,
        "BLOCK_N": 64,
        "BLOCK_K": 128,
        "num_warps": 4,
        "num_stages": 2,
        "SPLIT_K": 2
      },
      {
        "BLOCK_M": 64,
        "BLOCK_N": 64,
        "BLOCK_K": 128,
        "num_warps": 4,
        "num_stages": 2,
        "SPLIT_K": 4
      },
      {
        "BLOCK_M": 64,
        "BLOCK_N": 64,
        "BLOCK_K": 128,
        "num_warps": 4,
        "num_stages": 3,
        "SPLIT_K": 1
      },
      {
        "BLOCK_M": 64,
        "BLOCK_N": 64,
        "BLOCK_K": 128,
        "num_warps": 4,
        "num_stages": 3,
        "SPLIT_K": 2
      },
      {
        "BLOCK_M": 64,
        "BLOCK_N": 64,
        "BLOCK_K": 128,
        "num_warps": 4,
        "num_stages": 3,
        "SPLIT_K": 4
      },
      {
        "BLOCK_M": 64,
        "BLOCK_N": 64,
        "BLOCK_K": 128,
        "num_warps": 4,
        "num_stages": 4,
        "SPLIT_K": 1
      },
      {
        "BLOCK_M": 64,
        "BLOCK_N": 64,
        "BLOCK_K": 128,
        "num_warps": 4,
        "num_stages": 4,
        "SPLIT_K": 2
      },
      {
        "BLOCK_M": 64,
        "BLOCK_N": 64,
        "BLOCK_K": 128,
        "num_warps": 4,
        "num_stages": 4,
        "SPLIT_K": 4
      },
      {
        "BLOCK_M": 64,
        "BLOCK_N": 64,
        "BLOCK_K": 128,
        "num_warps": 8,
        "num_stages": 2,
        "SPLIT_K": 1
      },
      {
        "BLOCK_M": 64,
        "BLOCK_N": 64,
        "BLOCK_K": 128,
        "num_warps": 8,
        "num_stages": 2,
        "SPLIT_K": 2
      },
      {
        "BLOCK_M": 64,
        "BLOCK_N": 64,
        "BLOCK_K": 128,
        "num_warps": 8,
        "num_stages": 2,
        "SPLIT_K": 4
      },
      {
        "BLOCK_M": 64,
        "BLOCK_N": 64,
        "BLOCK_K": 128,
        "num_warps": 8,
        "num_stages": 3,
        "SPLIT_K": 1
      },
      {
        "BLOCK_M": 64,
        "BLOCK_N": 64,
        "BLOCK_K": 128,
        "num_warps": 8,
        "num_stages": 3,
        "SPLIT_K": 2
      },
      {
        "BLOCK_M": 64,
        "BLOCK_N": 64,
        "BLOCK_K": 128,
        "num_warps": 8,
        "num_stages": 3,
        "SPLIT_K": 4
      },
      {
        "BLOCK_M": 64,
        "BLOCK_N": 64,
        "BLOCK_K": 128,
        "num_warps": 8,
        "num_stages": 4,
        "SPLIT_K": 1
      },
      {
        "BLOCK_M": 64,
        "BLOCK_N": 64,
        "BLOCK_K": 128,
        "num_warps": 8,
        "num_stages": 4,
        "SPLIT_K": 2
      },
      {
        "BLOCK_M": 64,
        "BLOCK_N": 64,
        "BLOCK_K": 128,
        "num_warps": 8,
        "num_stages": 4,
        "SPLIT_K": 4
      },
      {
        "BLOCK_M": 64,
        "BLOCK_N": 128,
        "BLOCK_K": 32,
        "num_warps": 4,
        "num_stages": 2,
        "SPLIT_K": 1
      },
      {
        "BLOCK_M": 64,
        "BLOCK_N": 128,
        "BLOCK_K": 32,
        "num_warps": 4,
        "num_stages": 2,
        "SPLIT_K": 2
      },
      {
        "BLOCK_M": 64,
        "BLOCK_N": 128,
        "BLOCK_K": 32,
        "num_warps": 4,
        "num_stages": 2,
        "SPLIT_K": 4
      },
      {
        "BLOCK_M": 64,
        "BLOCK_N": 128,
        "BLOCK_K": 32,
        "num_warps": 4,
        "num_stages": 3,
        "SPLIT_K": 1
      },
      {
        "BLOCK_M": 64,
        "BLOCK_N": 128,
        "BLOCK_K": 32,
        "num_warps": 4,
        "num_stages": 3,
        "SPLIT_K": 2
      },
      {
        "BLOCK_M": 64,
        "BLOCK_N": 128,
        "BLOCK_K": 32,
        "num_warps": 4,
        "num_stages": 3,
        "SPLIT_K": 4
      },
      {
        "BLOCK_M": 64,
        "BLOCK_N": 128,
        "BLOCK_K": 32,
        "num_warps": 4,
        "num_stages": 4,
        "SPLIT_K": 1
      },
      {
        "BLOCK_M": 64,
        "BLOCK_N": 128,
        "BLOCK_K": 32,
        "num_warps": 4,
        "num_stages": 4,
        "SPLIT_K": 2
      },
      {
        "BLOCK_M": 64,
        "BLOCK_N": 128,
        "BLOCK_K": 32,
        "num_warps": 4,
        "num_stages": 4,
        "SPLIT_K": 4
      },
      {
        "BLOCK_M": 64,
        "BLOCK_N": 128,
        "BLOCK_K": 32,
        "num_warps": 8,
        "num_stages": 2,
        "SPLIT_K": 1
      },
      {
        "BLOCK_M": 64,
        "BLOCK_N": 128,
        "BLOCK_K": 32,
        "num_warps": 8,
        "num_stages": 2,
        "SPLIT_K": 2
      },
      {
        "BLOCK_M": 64,
        "BLOCK_N": 128,
        "BLOCK_K": 32,
        "num_warps": 8,
        "num_stages": 2,
        "SPLIT_K": 4
      },
      {
        "BLOCK_M": 64,
        "BLOCK_N": 128,
        "BLOCK_K": 32,
        "num_warps": 8,
        "num_stages": 3,
        "SPLIT_K": 1
      },
      {
        "BLOCK_M": 64,
        "BLOCK_N": 128,
        "BLOCK_K": 32,
        "num_warps": 8,
        "num_stages": 3,
        "SPLIT_K": 2
      },
      {
        "BLOCK_M": 64,
        "BLOCK_N": 128,
        "BLOCK_K": 32,
        "num_warps": 8,
        "num_stages": 3,
        "SPLIT_K": 4
      },
      {
        "BLOCK_M": 64,
        "BLOCK_N": 128,
        "BLOCK_K": 32,
        "num_warps": 8,
        "num_stages": 4,
        "SPLIT_K": 1
      },
      {
        "BLOCK_M": 64,
        "BLOCK_N": 128,
        "BLOCK_K": 32,
        "num_warps": 8,
        "num_stages": 4,
        "SPLIT_K": 2
      },
      {
        "BLOCK_M": 64,
        "BLOCK_N": 128,
        "BLOCK_K": 32,
        "num_warps": 8,
        "num_stages": 4,
        "SPLIT_K": 4
      },
      {
        "BLOCK_M": 64,
        "BLOCK_N": 128,
        "BLOCK_K": 64,
        "num_warps": 4,
        "num_stages": 2,
        "SPLIT_K": 1
      },
      {
        "BLOCK_M": 64,
        "BLOCK_N": 128,
        "BLOCK_K": 64,
        "num_warps": 4,
        "num_stages": 2,
        "SPLIT_K": 2
      },
      {
        "BLOCK_M": 64,
        "BLOCK_N": 128,
        "BLOCK_K": 64,
        "num_warps": 4,
        "num_stages": 2,
        "SPLIT_K": 4
      },
      {
        "BLOCK_M": 64,
        "BLOCK_N": 128,
        "BLOCK_K": 64,
        "num_warps": 4,
        "num_stages": 3,
        "SPLIT_K": 1
      },
      {
        "BLOCK_M": 64,
        "BLOCK_N": 128,
        "BLOCK_K": 64,
        "num_warps": 4,
        "num_stages": 3,
        "SPLIT_K": 2
      },
      {
        "BLOCK_M": 64,
        "BLOCK_N": 128,
        "BLOCK_K": 64,
        "num_warps": 4,
        "num_stages": 3,
        "SPLIT_K": 4
      },
      {
        "BLOCK_M": 64,
        "BLOCK_N": 128,
        "BLOCK_K": 64,
        "num_warps": 4,
        "num_stages": 4,
        "SPLIT_K": 1
      },
      {
        "BLOCK_M": 64,
        "BLOCK_N": 128,
        "BLOCK_K": 64,
        "num_warps": 4,
        "num_stages": 4,
        "SPLIT_K": 2
      },
      {
        "BLOCK_M": 64,
        "BLOCK_N": 128,
        "BLOCK_K": 64,
        "num_warps": 4,
        "num_stages": 4,
        "SPLIT_K": 4
      },
      {
        "BLOCK_M": 64,
        "BLOCK_N": 128,
        "BLOCK_K": 64,
        "num_warps": 8,
        "num_stages": 2,
        "SPLIT_K": 1
      },
      {
        "BLOCK_M": 64,
        "BLOCK_N": 128,
        "BLOCK_K": 64,
        "num_warps": 8,
        "num_stages": 2,
        "SPLIT_K": 2
      },
      {
        "BLOCK_M": 64,
        "BLOCK_N": 128,
        "BLOCK_K": 64,
        "num_warps": 8,
        "num_stages": 2,
        "SPLIT_K": 4
      },
      {
        "BLOCK_M": 64,
        "BLOCK_N": 128,
        "BLOCK_K": 64,
        "num_warps": 8,
        "num_stages": 3,
        "SPLIT_K": 1
      },
      {
        "BLOCK_M": 64,
        "BLOCK_N": 128,
        "BLOCK_K": 64,
        "num_warps": 8,
        "num_stages": 3,
        "SPLIT_K": 2
      },
      {
        "BLOCK_M": 64,
        "BLOCK_N": 128,
        "BLOCK_K": 64,
        "num_warps": 8,
        "num_stages": 3,
        "SPLIT_K": 4
      },
      {
        "BLOCK_M": 64,
        "BLOCK_N": 128,
        "BLOCK_K": 64,
        "num_warps": 8,
        "num_stages": 4,
        "SPLIT_K": 1
      },
      {
        "BLOCK_M": 64,
        "BLOCK_N": 128,
        "BLOCK_K": 64,
        "num_warps": 8,
        "num_stages": 4,
        "SPLIT_K": 2
      },
      {
        "BLOCK_M": 64,
        "BLOCK_N": 128,
        "BLOCK_K": 64,
        "num_warps": 8,
        "num_stages": 4,
        "SPLIT_K": 4
      },
      {
        "BLOCK_M": 64,
        "BLOCK_N": 128,
        "BLOCK_K": 128,
        "num_warps": 4,
        "num_stages": 2,
        "SPLIT_K": 1
      },
      {
        "BLOCK_M": 64,
        "BLOCK_N": 128,
        "BLOCK_K": 128,
        "num_warps": 4,
        "num_stages": 2,
        "SPLIT_K": 2
      },
      {
        "BLOCK_M": 64,
        "BLOCK_N": 128,
        "BLOCK_K": 128,
        "num_warps": 4,
        "num_stages": 2,
        "SPLIT_K": 4
      },
      {
        "BLOCK_M": 64,
        "BLOCK_N": 128,
        "BLOCK_K": 128,
        "num_warps": 4,
        "num_stages": 3,
        "SPLIT_K": 1
      },
      {
        "BLOCK_M": 64,
        "BLOCK_N": 128,
        "BLOCK_K": 128,
        "num_warps": 4,
        "num_stages": 3,
        "SPLIT_K": 2
      },
      {
        "BLOCK_M": 64,
        "BLOCK_N": 128,
        "BLOCK_K": 128,
        "num_warps": 4,
        "num_stages": 3,
        "SPLIT_K": 4
      },
      {
        "BLOCK_M": 64,
        "BLOCK_N": 128,
        "BLOCK_K": 128,
        "num_warps": 4,
        "num_stages": 4,
        "SPLIT_K": 1
      },
      {
        "BLOCK_M": 64,
        "BLOCK_N": 128,
        "BLOCK_K": 128,
        "num_warps": 4,
        "num_stages": 4,
        "SPLIT_K": 2
      },
      {
        "BLOCK_M": 64,
        "BLOCK_N": 128,
        "BLOCK_K": 128,
        "num_warps": 4,
        "num_stages": 4,
        "SPLIT_K": 4
      },
      {
        "BLOCK_M": 64,
        "BLOCK_N": 128,
        "BLOCK_K": 128,
        "num_warps": 8,
        "num_stages": 2,
        "SPLIT_K": 1
      },
      {
        "BLOCK_M": 64,
        "BLOCK_N": 128,
        "BLOCK_K": 128,
        "num_warps": 8,
        "num_stages": 2,
        "SPLIT_K": 2
      },
      {
        "BLOCK_M": 64,
        "BLOCK_N": 128,
        "BLOCK_K": 128,
        "num_warps": 8,
        "num_stages": 2,
        "SPLIT_K": 4
      },
      {
        "BLOCK_M": 64,
        "BLOCK_N": 128,
        "BLOCK_K": 128,
        "num_warps": 8,
        "num_stages": 3,
        "SPLIT_K": 1
      },
      {
        "BLOCK_M": 64,
        "BLOCK_N": 128,
        "BLOCK_K": 128,
        "num_warps": 8,
        "num_stages": 3,
        "SPLIT_K": 2
      },
      {
        "BLOCK_M": 64,
        "BLOCK_N": 128,
        "BLOCK_K": 128,
        "num_warps": 8,
        "num_stages": 3,
        "SPLIT_K": 4
      },
      {
        "BLOCK_M": 64,
        "BLOCK_N": 128,
        "BLOCK_K": 128,
        "num_warps": 8,
        "num_stages": 4,
        "SPLIT_K": 1
      },
      {
        "BLOCK_M": 64,
        "BLOCK_N": 128,
        "BLOCK_K": 128,
        "num_warps": 8,
        "num_stages": 4,
        "SPLIT_K": 2
      },
      {
        "BLOCK_M": 64,
        "BLOCK_N": 128,
        "BLOCK_K": 128,
        "num_warps": 8,
        "num_stages": 4,
        "SPLIT_K": 4
      },
      {
        "BLOCK_M": 128,
        "BLOCK_N": 64,
        "BLOCK_K": 32,
        "num_warps": 4,
        "num_stages": 2,
        "SPLIT_K": 1
      },
      {
        "BLOCK_M": 128,
        "BLOCK_N": 64,
        "BLOCK_K": 32,
        "num_warps": 4,
        "num_stages": 2,
        "SPLIT_K": 2
      },
      {
        "BLOCK_M": 128,
        "BLOCK_N": 64,
        "BLOCK_K": 32,
        "num_warps": 4,
        "num_stages": 2,
        "SPLIT_K": 4
      },
      {
        "BLOCK_M": 128,
        "BLOCK_N": 64,
        "BLOCK_K": 32,
        "num_warps": 4,
        "num_stages": 3,
        "SPLIT_K": 1
      },
      {
        "BLOCK_M": 128,
        "BLOCK_N": 64,
        "BLOCK_K": 32,
        "num_warps": 4,
        "num_stages": 3,
        "SPLIT_K": 2
      },
      {
        "BLOCK_M": 128,
        "BLOCK_N": 64,
        "BLOCK_K": 32,
        "num_warps": 4,
        "num_stages": 3,
        "SPLIT_K": 4
      },
      {
        "BLOCK_M": 128,
        "BLOCK_N": 64,
        "BLOCK_K": 32,
        "num_warps": 4,
        "num_stages": 4,
        "SPLIT_K": 1
      },
      {
        "BLOCK_M": 128,
        "BLOCK_N": 64,
        "BLOCK_K": 32,
        "num_warps": 4,
        "num_stages": 4,
        "SPLIT_K": 2
      },
      {
        "BLOCK_M": 128,
        "BLOCK_N": 64,
        "BLOCK_K": 32,
        "num_warps": 4,
        "num_stages": 4,
        "SPLIT_K": 4
      },
      {
        "BLOCK_M": 128,
        "BLOCK_N": 64,
        "BLOCK_K": 32,
        "num_warps": 8,
        "num_stages": 2,
        "SPLIT_K": 1
      },
      {
        "BLOCK_M": 128,
        "BLOCK_N": 64,
        "BLOCK_K": 32,
        "num_warps": 8,
        "num_stages": 2,
        "SPLIT_K": 2
      },
      {
        "BLOCK_M": 128,
        "BLOCK_N": 64,
        "BLOCK_K": 32,
        "num_warps": 8,
        "num_stages": 2,
        "SPLIT_K": 4
      },
      {
        "BLOCK_M": 128,
        "BLOCK_N": 64,
        "BLOCK_K": 32,
        "num_warps": 8,
        "num_stages": 3,
        "SPLIT_K": 1
      },
      {
        "BLOCK_M": 128,
        "BLOCK_N": 64,
        "BLOCK_K": 32,
        "num_warps": 8,
        "num_stages": 3,
        "SPLIT_K": 2
      },
      {
        "BLOCK_M": 128,
        "BLOCK_N": 64,
        "BLOCK_K": 32,
        "num_warps": 8,
        "num_stages": 3,
        "SPLIT_K": 4
      },
      {
        "BLOCK_M": 128,
        "BLOCK_N": 64,
        "BLOCK_K": 32,
        "num_warps": 8,
        "num_stages": 4,
        "SPLIT_K": 1
      },
      {
        "BLOCK_M": 128,
        "BLOCK_N": 64,
        "BLOCK_K": 32,
        "num_warps": 8,
        "num_stages": 4,
        "SPLIT_K": 2
      },
      {
        "BLOCK_M": 128,
        "BLOCK_N": 64,
        "BLOCK_K": 32,
        "num_warps": 8,
        "num_stages": 4,
        "SPLIT_K": 4
      },
      {
        "BLOCK_M": 128,
        "BLOCK_N": 64,
        "BLOCK_K": 64,
        "num_warps": 4,
        "num_stages": 2,
        "SPLIT_K": 1
      },
      {
        "BLOCK_M": 128,
        "BLOCK_N": 64,
        "BLOCK_K": 64,
        "num_warps": 4,
        "num_stages": 2,
        "SPLIT_K": 2
      },
      {
        "BLOCK_M": 128,
        "BLOCK_N": 64,
        "BLOCK_K": 64,
        "num_warps": 4,
        "num_stages": 2,
        "SPLIT_K": 4
      },
      {
        "BLOCK_M": 128,
        "BLOCK_N": 64,
        "BLOCK_K": 64,
        "num_warps": 4,
        "num_stages": 3,
        "SPLIT_K": 1
      },
      {
        "BLOCK_M": 128,
        "BLOCK_N": 64,
        "BLOCK_K": 64,
        "num_warps": 4,
        "num_stages": 3,
        "SPLIT_K": 2
      },
      {
        "BLOCK_M": 128,
        "BLOCK_N": 64,
        "BLOCK_K": 64,
        "num_warps": 4,
        "num_stages": 3,
        "SPLIT_K": 4
      },
      {
        "BLOCK_M": 128,
        "BLOCK_N": 64,
        "BLOCK_K": 64,
        "num_warps": 4,
        "num_stages": 4,
        "SPLIT_K": 1
      },
      {
        "BLOCK_M": 128,
        "BLOCK_N": 64,
        "BLOCK_K": 64,
        "num_warps": 4,
        "num_stages": 4,
        "SPLIT_K": 2
      },
      {
        "BLOCK_M": 128,
        "BLOCK_N": 64,
        "BLOCK_K": 64,
        "num_warps": 4,
        "num_stages": 4,
        "SPLIT_K": 4
      },
      {
        "BLOCK_M": 128,
        "BLOCK_N": 64,
        "BLOCK_K": 64,
        "num_warps": 8,
        "num_stages": 2,
        "SPLIT_K": 1
      },
      {
        "BLOCK_M": 128,
        "BLOCK_N": 64,
        "BLOCK_K": 64,
        "num_warps": 8,
        "num_stages": 2,
        "SPLIT_K": 2
      },
      {
        "BLOCK_M": 128,
        "BLOCK_N": 64,
        "BLOCK_K": 64,
        "num_warps": 8,
        "num_stages": 2,
        "SPLIT_K": 4
      },
      {
        "BLOCK_M": 128,
        "BLOCK_N": 64,
        "BLOCK_K": 64,
        "num_warps": 8,
        "num_stages": 3,
        "SPLIT_K": 1
      },
      {
        "BLOCK_M": 128,
        "BLOCK_N": 64,
        "BLOCK_K": 64,
        "num_warps": 8,
        "num_stages": 3,
        "SPLIT_K": 2
      },
      {
        "BLOCK_M": 128,
        "BLOCK_N": 64,
        "BLOCK_K": 64,
        "num_warps": 8,
        "num_stages": 3,
        "SPLIT_K": 4
      },
      {
        "BLOCK_M": 128,
        "BLOCK_N": 64,
        "BLOCK_K": 64,
        "num_warps": 8,
        "num_stages": 4,
        "SPLIT_K": 1
      },
      {
        "BLOCK_M": 128,
        "BLOCK_N": 64,
        "BLOCK_K": 64,
        "num_warps": 8,
        "num_stages": 4,
        "SPLIT_K": 2
      },
      {
        "BLOCK_M": 128,
        "BLOCK_N": 64,
        "BLOCK_K": 64,
        "num_warps": 8,
        "num_stages": 4,
        "SPLIT_K": 4
      },
      {
        "BLOCK_M": 128,
        "BLOCK_N": 64,
        "BLOCK_K": 128,
        "num_warps": 4,
        "num_stages": 2,
        "SPLIT_K": 1
      },
      {
        "BLOCK_M": 128,
        "BLOCK_N": 64,
        "BLOCK_K": 128,
        "num_warps": 4,
        "num_stages": 2,
        "SPLIT_K": 2
      },
      {
        "BLOCK_M": 128,
        "BLOCK_N": 64,
        "BLOCK_K": 128,
        "num_warps": 4,
        "num_stages": 2,
        "SPLIT_K": 4
      },
      {
        "BLOCK_M": 128,
        "BLOCK_N": 64,
        "BLOCK_K": 128,
        "num_warps": 4,
        "num_stages": 3,
        "SPLIT_K": 1
      },
      {
        "BLOCK_M": 128,
        "BLOCK_N": 64,
        "BLOCK_K": 128,
        "num_warps": 4,
        "num_stages": 3,
        "SPLIT_K": 2
      },
      {
        "BLOCK_M": 128,
        "BLOCK_N": 64,
        "BLOCK_K": 128,
        "num_warps": 4,
        "num_stages": 3,
        "SPLIT_K": 4
      },
      {
        "BLOCK_M": 128,
        "BLOCK_N": 64,
        "BLOCK_K": 128,
        "num_warps": 4,
        "num_stages": 4,
        "SPLIT_K": 1
      },
      {
        "BLOCK_M": 128,
        "BLOCK_N": 64,
        "BLOCK_K": 128,
        "num_warps": 4,
        "num_stages": 4,
        "SPLIT_K": 2
      },
      {
        "BLOCK_M": 128,
        "BLOCK_N": 64,
        "BLOCK_K": 128,
        "num_warps": 4,
        "num_stages": 4,
        "SPLIT_K": 4
      },
      {
        "BLOCK_M": 128,
        "BLOCK_N": 64,
        "BLOCK_K": 128,
        "num_warps": 8,
        "num_stages": 2,
        "SPLIT_K": 1
      },
      {
        "BLOCK_M": 128,
        "BLOCK_N": 64,
        "BLOCK_K": 128,
        "num_warps": 8,
        "num_stages": 2,
        "SPLIT_K": 2
      },
      {
        "BLOCK_M": 128,
        "BLOCK_N": 64,
        "BLOCK_K": 128,
        "num_warps": 8,
        "num_stages": 2,
        "SPLIT_K": 4
      },
      {
        "BLOCK_M": 128,
        "BLOCK_N": 64,
        "BLOCK_K": 128,
        "num_warps": 8,
        "num_stages": 3,
        "SPLIT_K": 1
      },
      {
        "BLOCK_M": 128,
        "BLOCK_N": 64,
        "BLOCK_K": 128,
        "num_warps": 8,
        "num_stages": 3,
        "SPLIT_K": 2
      },
      {
        "BLOCK_M": 128,
        "BLOCK_N": 64,
        "BLOCK_K": 128,
        "num_warps": 8,
        "num_stages": 3,
        "SPLIT_K": 4
      },
      {
        "BLOCK_M": 128,
        "BLOCK_N": 64,
        "BLOCK_K": 128,
        "num_warps": 8,
        "num_stages": 4,
        "SPLIT_K": 1
      },
      {
        "BLOCK_M": 128,
        "BLOCK_N": 64,
        "BLOCK_K": 128,
        "num_warps": 8,
        "num_stages": 4,
        "SPLIT_K": 2
      },
      {
        "BLOCK_M": 128,
        "BLOCK_N": 64,
        "BLOCK_K": 128,
        "num_warps": 8,
        "num_stages": 4,
        "SPLIT_K": 4
      },
      {
        "BLOCK_M": 128,
        "BLOCK_N": 128,
        "BLOCK_K": 32,
        "num_warps": 4,
        "num_stages": 2,
        "SPLIT_K": 1
      },
      {
        "BLOCK_M": 128,
        "BLOCK_N": 128,
        "BLOCK_K": 32,
        "num_warps": 4,
        "num_stages": 2,
        "SPLIT_K": 2
      },
      {
        "BLOCK_M": 128,
        "BLOCK_N": 128,
        "BLOCK_K": 32,
        "num_warps": 4,
        "num_stages": 2,
        "SPLIT_K": 4
      },
      {
        "BLOCK_M": 128,
        "BLOCK_N": 128,
        "BLOCK_K": 32,
        "num_warps": 4,
        "num_stages": 3,
        "SPLIT_K": 1
      },
      {
        "BLOCK_M": 128,
        "BLOCK_N": 128,
        "BLOCK_K": 32,
        "num_warps": 4,
        "num_stages": 3,
        "SPLIT_K": 2
      },
      {
        "BLOCK_M": 128,
        "BLOCK_N": 128,
        "BLOCK_K": 32,
        "num_warps": 4,
        "num_stages": 3,
        "SPLIT_K": 4
      },
      {
        "BLOCK_M": 128,
        "BLOCK_N": 128,
        "BLOCK_K": 32,
        "num_warps": 4,
        "num_stages": 4,
        "SPLIT_K": 1
      },
      {
        "BLOCK_M": 128,
        "BLOCK_N": 128,
        "BLOCK_K": 32,
        "num_warps": 4,
        "num_stages": 4,
        "SPLIT_K": 2
      },
      {
        "BLOCK_M": 128,
        "BLOCK_N": 128,
        "BLOCK_K": 32,
        "num_warps": 4,
        "num_stages": 4,
        "SPLIT_K": 4
      },
      {
        "BLOCK_M": 128,
        "BLOCK_N": 128,
        "BLOCK_K": 32,
        "num_warps": 8,
        "num_stages": 2,
        "SPLIT_K": 1
      },
      {
        "BLOCK_M": 128,
        "BLOCK_N": 128,
        "BLOCK_K": 32,
        "num_warps": 8,
        "num_stages": 2,
        "SPLIT_K": 2
      },
      {
        "BLOCK_M": 128,
        "BLOCK_N": 128,
        "BLOCK_K": 32,
        "num_warps": 8,
        "num_stages": 2,
        "SPLIT_K": 4
      },
      {
        "BLOCK_M": 128,
        "BLOCK_N": 128,
        "BLOCK_K": 32,
        "num_warps": 8,
        "num_stages": 3,
        "SPLIT_K": 1
      },
      {
        "BLOCK_M": 128,
        "BLOCK_N": 128,
        "BLOCK_K": 32,
        "num_warps": 8,
        "num_stages": 3,
        "SPLIT_K": 2
      },
      {
        "BLOCK_M": 128,
        "BLOCK_N": 128,
        "BLOCK_K": 32,
        "num_warps": 8,
        "num_stages": 3,
        "SPLIT_K": 4
      },
      {
        "BLOCK_M": 128,
        "BLOCK_N": 128,
        "BLOCK_K": 32,
        "num_warps": 8,
        "num_stages": 4,
        "SPLIT_K": 1
      },
      {
        "BLOCK_M": 128,
        "BLOCK_N": 128,
        "BLOCK_K": 32,
        "num_warps": 8,
        "num_stages": 4,
        "SPLIT_K": 2
      },
      {
        "BLOCK_M": 128,
        "BLOCK_N": 128,
        "BLOCK_K": 32,
        "num_warps": 8,
        "num_stages": 4,
        "SPLIT_K": 4
      },
      {
        "BLOCK_M": 128,
        "BLOCK_N": 128,
        "BLOCK_K": 64,
        "num_warps": 4,
        "num_stages": 2,
        "SPLIT_K": 1
      },
      {
        "BLOCK_M": 128,
        "BLOCK_N": 128,
        "BLOCK_K": 64,
        "num_warps": 4,
        "num_stages": 2,
        "SPLIT_K": 2
      },
      {
        "BLOCK_M": 128,
        "BLOCK_N": 128,
        "BLOCK_K": 64,
        "num_warps": 4,
        "num_stages": 2,
        "SPLIT_K": 4
      },
      {
        "BLOCK_M": 128,
        "BLOCK_N": 128,
        "BLOCK_K": 64,
        "num_warps": 4,
        "num_stages": 3,
        "SPLIT_K": 1
      },
      {
        "BLOCK_M": 128,
        "BLOCK_N": 128,
        "BLOCK_K": 64,
        "num_warps": 4,
        "num_stages": 3,
        "SPLIT_K": 2
      },
      {
        "BLOCK_M": 128,
        "BLOCK_N": 128,
        "BLOCK_K": 64,
        "num_warps": 4,
        "num_stages": 3,
        "SPLIT_K": 4
      },
      {
        "BLOCK_M": 128,
        "BLOCK_N": 128,
        "BLOCK_K": 64,
        "num_warps": 4,
        "num_stages": 4,
        "SPLIT_K": 1
      },
      {
        "BLOCK_M": 128,
        "BLOCK_N": 128,
        "BLOCK_K": 64,
        "num_warps": 4,
        "num_stages": 4,
        "SPLIT_K": 2
      },
      {
        "BLOCK_M": 128,
        "BLOCK_N": 128,
        "BLOCK_K": 64,
        "num_warps": 4,
        "num_stages": 4,
        "SPLIT_K": 4
      },
      {
        "BLOCK_M": 128,
        "BLOCK_N": 128,
        "BLOCK_K": 64,
        "num_warps": 8,
        "num_stages": 2,
        "SPLIT_K": 1
      },
      {
        "BLOCK_M": 128,
        "BLOCK_N": 128,
        "BLOCK_K": 64,
        "num_warps": 8,
        "num_stages": 2,
        "SPLIT_K": 2
      },
      {
        "BLOCK_M": 128,
        "BLOCK_N": 128,
        "BLOCK_K": 64,
        "num_warps": 8,
        "num_stages": 2,
        "SPLIT_K": 4
      },
      {
        "BLOCK_M": 128,
        "BLOCK_N": 128,
        "BLOCK_K": 64,
        "num_warps": 8,
        "num_stages": 3,
        "SPLIT_K": 1
      },
      {
        "BLOCK_M": 128,
        "BLOCK_N": 128,
        "BLOCK_K": 64,
        "num_warps": 8,
        "num_stages": 3,
        "SPLIT_K": 2
      },
      {
        "BLOCK_M": 128,
        "BLOCK_N": 128,
        "BLOCK_K": 64,
        "num_warps": 8,
        "num_stages": 3,
        "SPLIT_K": 4
      },
      {
        "BLOCK_M": 128,
        "BLOCK_N": 128,
        "BLOCK_K": 64,
        "num_warps": 8,
        "num_stages": 4,
        "SPLIT_K": 1
      },
      {
        "BLOCK_M": 128,
        "BLOCK_N": 128,
        "BLOCK_K": 64,
        "num_warps": 8,
        "num_stages": 4,
        "SPLIT_K": 2
      },
      {
        "BLOCK_M": 128,
        "BLOCK_N": 128,
        "BLOCK_K": 64,
        "num_warps": 8,
        "num_stages": 4,
        "SPLIT_K": 4
      },
      {
        "BLOCK_M": 128,
        "BLOCK_N": 128,
        "BLOCK_K": 128,
        "num_warps": 4,
        "num_stages": 2,
        "SPLIT_K": 1
      },
      {
        "BLOCK_M": 128,
        "BLOCK_N": 128,
        "BLOCK_K": 128,
        "num_warps": 4,
        "num_stages": 2,
        "SPLIT_K": 2
      },
      {
        "BLOCK_M": 128,
        "BLOCK_N": 128,
        "BLOCK_K": 128,
        "num_warps": 4,
        "num_stages": 2,
        "SPLIT_K": 4
      },
      {
        "BLOCK_M": 128,
        "BLOCK_N": 128,
        "BLOCK_K": 128,
        "num_warps": 4,
        "num_stages": 3,
        "SPLIT_K": 1
      },
      {
        "BLOCK_M": 128,
        "BLOCK_N": 128,
        "BLOCK_K": 128,
        "num_warps": 4,
        "num_stages": 3,
        "SPLIT_K": 2
      },
      {
        "BLOCK_M": 128,
        "BLOCK_N": 128,
        "BLOCK_K": 128,
        "num_warps": 4,
        "num_stages": 3,
        "SPLIT_K": 4
      },
      {
        "BLOCK_M": 128,
        "BLOCK_N": 128,
        "BLOCK_K": 128,
        "num_warps": 4,
        "num_stages": 4,
        "SPLIT_K": 1
      },
      {
        "BLOCK_M": 128,
        "BLOCK_N": 128,
        "BLOCK_K": 128,
        "num_warps": 4,
        "num_stages": 4,
        "SPLIT_K": 2
      },
      {
        "BLOCK_M": 128,
        "BLOCK_N": 128,
        "BLOCK_K": 128,
        "num_warps": 4,
        "num_stages": 4,
        "SPLIT_K": 4
      },
      {
        "BLOCK_M": 128,
        "BLOCK_N": 128,
        "BLOCK_K": 128,
        "num_warps": 8,
        "num_stages": 2,
        "SPLIT_K": 1
      },
      {
        "BLOCK_M": 128,
        "BLOCK_N": 128,
        "BLOCK_K": 128,
        "num_warps": 8,
        "num_stages": 2,
        "SPLIT_K": 2
      },
      {
        "BLOCK_M": 128,
        "BLOCK_N": 128,
        "BLOCK_K": 128,
        "num_warps": 8,
        "num_stages": 2,
        "SPLIT_K": 4
      },
      {
        "BLOCK_M": 128,
        "BLOCK_N": 128,
        "BLOCK_K": 128,
        "num_warps": 8,
        "num_stages": 3,
        "SPLIT_K": 1
      },
      {
        "BLOCK_M": 128,
        "BLOCK_N": 128,
        "BLOCK_K": 128,
        "num_warps": 8,
        "num_stages": 3,
        "SPLIT_K": 2
      },
      {
        "BLOCK_M": 128,
        "BLOCK_N": 128,
        "BLOCK_K": 128,
        "num_warps": 8,
        "num_stages": 3,
        "SPLIT_K": 4
      },
      {
        "BLOCK_M": 128,
        "BLOCK_N": 128,
        "BLOCK_K": 128,
        "num_warps": 8,
        "num_stages": 4,
        "SPLIT_K": 1
      },
      {
        "BLOCK_M": 128,
        "BLOCK_N": 128,
        "BLOCK_K": 128,
        "num_warps": 8,
        "num_stages": 4,
        "SPLIT_K": 2
      },
      {
        "BLOCK_M": 128,
        "BLOCK_N": 128,
        "BLOCK_K": 128,
        "num_warps": 8,
        "num_stages": 4,
        "SPLIT_K": 4
      },
      {
        "BLOCK_M": 256,
        "BLOCK_N": 64,
        "BLOCK_K": 32,
        "num_warps": 4,
        "num_stages": 2,
        "SPLIT_K": 1
      },
      {
        "BLOCK_M": 256,
        "BLOCK_N": 64,
        "BLOCK_K": 32,
        "num_warps": 4,
        "num_stages": 2,
        "SPLIT_K": 2
      },
      {
        "BLOCK_M": 256,
        "BLOCK_N": 64,
        "BLOCK_K": 32,
        "num_warps": 4,
        "num_stages": 2,
        "SPLIT_K": 4
      },
      {
        "BLOCK_M": 256,
        "BLOCK_N": 64,
        "BLOCK_K": 32,
        "num_warps": 4,
        "num_stages": 3,
        "SPLIT_K": 1
      },
      {
        "BLOCK_M": 256,
        "BLOCK_N": 64,
        "BLOCK_K": 32,
        "num_warps": 4,
        "num_stages": 3,
        "SPLIT_K": 2
      },
      {
        "BLOCK_M": 256,
        "BLOCK_N": 64,
        "BLOCK_K": 32,
        "num_warps": 4,
        "num_stages": 3,
        "SPLIT_K": 4
      },
      {
        "BLOCK_M": 256,
        "BLOCK_N": 64,
        "BLOCK_K": 32,
        "num_warps": 4,
        "num_stages": 4,
        "SPLIT_K": 1
      },
      {
        "BLOCK_M": 256,
        "BLOCK_N": 64,
        "BLOCK_K": 32,
        "num_warps": 4,
        "num_stages": 4,
        "SPLIT_K": 2
      },
      {
        "BLOCK_M": 256,
        "BLOCK_N": 64,
        "BLOCK_K": 32,
        "num_warps": 4,
        "num_stages": 4,
        "SPLIT_K": 4
      },
      {
        "BLOCK_M": 256,
        "BLOCK_N": 64,
        "BLOCK_K": 32,
        "num_warps": 8,
        "num_stages": 2,
        "SPLIT_K": 1
      },
      {
        "BLOCK_M": 256,
        "BLOCK_N": 64,
        "BLOCK_K": 32,
        "num_warps": 8,
        "num_stages": 2,
        "SPLIT_K": 2
      },
      {
        "BLOCK_M": 256,
        "BLOCK_N": 64,
        "BLOCK_K": 32,
        "num_warps": 8,
        "num_stages": 2,
        "SPLIT_K": 4
      },
      {
        "BLOCK_M": 256,
        "BLOCK_N": 64,
        "BLOCK_K": 32,
        "num_warps": 8,
        "num_stages": 3,
        "SPLIT_K": 1
      },
      {
        "BLOCK_M": 256,
        "BLOCK_N": 64,
        "BLOCK_K": 32,
        "num_warps": 8,
        "num_stages": 3,
        "SPLIT_K": 2
      },
      {
        "BLOCK_M": 256,
        "BLOCK_N": 64,
        "BLOCK_K": 32,
        "num_warps": 8,
        "num_stages": 3,
        "SPLIT_K": 4
      },
      {
        "BLOCK_M": 256,
        "BLOCK_N": 64,
        "BLOCK_K": 32,
        "num_warps": 8,
        "num_stages": 4,
        "SPLIT_K": 1
      },
      {
        "BLOCK_M": 256,
        "BLOCK_N": 64,
        "BLOCK_K": 32,
        "num_warps": 8,
        "num_stages": 4,
        "SPLIT_K": 2
      },
      {
        "BLOCK_M": 256,
        "BLOCK_N": 64,
        "BLOCK_K": 32,
        "num_warps": 8,
        "num_stages": 4,
        "SPLIT_K": 4
      },
      {
        "BLOCK_M": 256,
        "BLOCK_N": 64,
        "BLOCK_K": 64,
        "num_warps": 4,
        "num_stages": 2,
        "SPLIT_K": 1
      },
      {
        "BLOCK_M": 256,
        "BLOCK_N": 64,
        "BLOCK_K": 64,
        "num_warps": 4,
        "num_stages": 2,
        "SPLIT_K": 2
      },
      {
        "BLOCK_M": 256,
        "BLOCK_N": 64,
        "BLOCK_K": 64,
        "num_warps": 4,
        "num_stages": 2,
        "SPLIT_K": 4
      },
      {
        "BLOCK_M": 256,
        "BLOCK_N": 64,
        "BLOCK_K": 64,
        "num_warps": 4,
        "num_stages": 3,
        "SPLIT_K": 1
      },
      {
        "BLOCK_M": 256,
        "BLOCK_N": 64,
        "BLOCK_K": 64,
        "num_warps": 4,
        "num_stages": 3,
        "SPLIT_K": 2
      },
      {
        "BLOCK_M": 256,
        "BLOCK_N": 64,
        "BLOCK_K": 64,
        "num_warps": 4,
        "num_stages": 3,
        "SPLIT_K": 4
      },
      {
        "BLOCK_M": 256,
        "BLOCK_N": 64,
        "BLOCK_K": 64,
        "num_warps": 4,
        "num_stages": 4,
        "SPLIT_K": 1
      },
      {
        "BLOCK_M": 256,
        "BLOCK_N": 64,
        "BLOCK_K": 64,
        "num_warps": 4,
        "num_stages": 4,
        "SPLIT_K": 2
      },
      {
        "BLOCK_M": 256,
        "BLOCK_N": 64,
        "BLOCK_K": 64,
        "num_warps": 4,
        "num_stages": 4,
        "SPLIT_K": 4
      },
      {
        "BLOCK_M": 256,
        "BLOCK_N": 64,
        "BLOCK_K": 64,
        "num_warps": 8,
        "num_stages": 2,
        "SPLIT_K": 1
      },
      {
        "BLOCK_M": 256,
        "BLOCK_N": 64,
        "BLOCK_K": 64,
        "num_warps": 8,
        "num_stages": 2,
        "SPLIT_K": 2
      },
      {
        "BLOCK_M": 256,
        "BLOCK_N": 64,
        "BLOCK_K": 64,
        "num_warps": 8,
        "num_stages": 2,
        "SPLIT_K": 4
      },
      {
        "BLOCK_M": 256,
        "BLOCK_N": 64,
        "BLOCK_K": 64,
        "num_warps": 8,
        "num_stages": 3,
        "SPLIT_K": 1
      },
      {
        "BLOCK_M": 256,
        "BLOCK_N": 64,
        "BLOCK_K": 64,
        "num_warps": 8,
        "num_stages": 3,
        "SPLIT_K": 2
      },
      {
        "BLOCK_M": 256,
        "BLOCK_N": 64,
        "BLOCK_K": 64,
        "num_warps": 8,
        "num_stages": 3,
        "SPLIT_K": 4
      },
      {
        "BLOCK_M": 256,
        "BLOCK_N": 64,
        "BLOCK_K": 64,
        "num_warps": 8,
        "num_stages": 4,
        "SPLIT_K": 1
      },
      {
        "BLOCK_M": 256,
        "BLOCK_N": 64,
        "BLOCK_K": 64,
        "num_warps": 8,
        "num_stages": 4,
        "SPLIT_K": 2
      },
      {
        "BLOCK_M": 256,
        "BLOCK_N": 64,
        "BLOCK_K": 64,
        "num_warps": 8,
        "num_stages": 4,
        "SPLIT_K": 4
      },
      {
        "BLOCK_M": 256,
        "BLOCK_N": 64,
        "BLOCK_K": 128,
        "num_warps": 4,
        "num_stages": 2,
        "SPLIT_K": 1
      },
      {
        "BLOCK_M": 256,
        "BLOCK_N": 64,
        "BLOCK_K": 128,
        "num_warps": 4,
        "num_stages": 2,
        "SPLIT_K": 2
      },
      {
        "BLOCK_M": 256,
        "BLOCK_N": 64,
        "BLOCK_K": 128,
        "num_warps": 4,
        "num_stages": 2,
        "SPLIT_K": 4
      },
      {
        "BLOCK_M": 256,
        "BLOCK_N": 64,
        "BLOCK_K": 128,
        "num_warps": 4,
        "num_stages": 3,
        "SPLIT_K": 1
      },
      {
        "BLOCK_M": 256,
        "BLOCK_N": 64,
        "BLOCK_K": 128,
        "num_warps": 4,
        "num_stages": 3,
        "SPLIT_K": 2
      },
      {
        "BLOCK_M": 256,
        "BLOCK_N": 64,
        "BLOCK_K": 128,
        "num_warps": 4,
        "num_stages": 3,
        "SPLIT_K": 4
      },
      {
        "BLOCK_M": 256,
        "BLOCK_N": 64,
        "BLOCK_K": 128,
        "num_warps": 4,
        "num_stages": 4,
        "SPLIT_K": 1
      },
      {
        "BLOCK_M": 256,
        "BLOCK_N": 64,
        "BLOCK_K": 128,
        "num_warps": 4,
        "num_stages": 4,
        "SPLIT_K": 2
      },
      {
        "BLOCK_M": 256,
        "BLOCK_N": 64,
        "BLOCK_K": 128,
        "num_warps": 4,
        "num_stages": 4,
        "SPLIT_K": 4
      },
      {
        "BLOCK_M": 256,
        "BLOCK_N": 64,
        "BLOCK_K": 128,
        "num_warps": 8,
        "num_stages": 2,
        "SPLIT_K": 1
      },
      {
        "BLOCK_M": 256,
        "BLOCK_N": 64,
        "BLOCK_K": 128,
        "num_warps": 8,
        "num_stages": 2,
        "SPLIT_K": 2
      },
      {
        "BLOCK_M": 256,
        "BLOCK_N": 64,
        "BLOCK_K": 128,
        "num_warps": 8,
        "num_stages": 2,
        "SPLIT_K": 4
      },
      {
        "BLOCK_M": 256,
        "BLOCK_N": 64,
        "BLOCK_K": 128,
        "num_warps": 8,
        "num_stages": 3,
        "SPLIT_K": 1
      },
      {
        "BLOCK_M": 256,
        "BLOCK_N": 64,
        "BLOCK_K": 128,
        "num_warps": 8,
        "num_stages": 3,
        "SPLIT_K": 2
      },
      {
        "BLOCK_M": 256,
        "BLOCK_N": 64,
        "BLOCK_K": 128,
        "num_warps": 8,
        "num_stages": 3,
        "SPLIT_K": 4
      },
      {
        "BLOCK_M": 256,
        "BLOCK_N": 64,
        "BLOCK_K": 128,
        "num_warps": 8,
        "num_stages": 4,
        "SPLIT_K": 1
      },
      {
        "BLOCK_M": 256,
        "BLOCK_N": 64,
        "BLOCK_K": 128,
        "num_warps": 8,
        "num_stages": 4,
        "SPLIT_K": 2
      },
      {
        "BLOCK_M": 256,
        "BLOCK_N": 64,
        "BLOCK_K": 128,
        "num_warps": 8,
        "num_stages": 4,
        "SPLIT_K": 4
      },
      {
        "BLOCK_M": 256,
        "BLOCK_N": 128,
        "BLOCK_K": 32,
        "num_warps": 4,
        "num_stages": 2,
        "SPLIT_K": 1
      },
      {
        "BLOCK_M": 256,
        "BLOCK_N": 128,
        "BLOCK_K": 32,
        "num_warps": 4,
        "num_stages": 2,
        "SPLIT_K": 2
      },
      {
        "BLOCK_M": 256,
        "BLOCK_N": 128,
        "BLOCK_K": 32,
        "num_warps": 4,
        "num_stages": 2,
        "SPLIT_K": 4
      },
      {
        "BLOCK_M": 256,
        "BLOCK_N": 128,
        "BLOCK_K": 32,
        "num_warps": 4,
        "num_stages": 3,
        "SPLIT_K": 1
      },
      {
        "BLOCK_M": 256,
        "BLOCK_N": 128,
        "BLOCK_K": 32,
        "num_warps": 4,
        "num_stages": 3,
        "SPLIT_K": 2
      },
      {
        "BLOCK_M": 256,
        "BLOCK_N": 128,
        "BLOCK_K": 32,
        "num_warps": 4,
        "num_stages": 3,
        "SPLIT_K": 4
      },
      {
        "BLOCK_M": 256,
        "BLOCK_N": 128,
        "BLOCK_K": 32,
        "num_warps": 4,
        "num_stages": 4,
        "SPLIT_K": 1
      },
      {
        "BLOCK_M": 256,
        "BLOCK_N": 128,
        "BLOCK_K": 32,
        "num_warps": 4,
        "num_stages": 4,
        "SPLIT_K": 2
      },
      {
        "BLOCK_M": 256,
        "BLOCK_N": 128,
        "BLOCK_K": 32,
        "num_warps": 4,
        "num_stages": 4,
        "SPLIT_K": 4
      },
      {
        "BLOCK_M": 256,
        "BLOCK_N": 128,
        "BLOCK_K": 32,
        "num_warps": 8,
        "num_stages": 2,
        "SPLIT_K": 1
      },
      {
        "BLOCK_M": 256,
        "BLOCK_N": 128,
        "BLOCK_K": 32,
        "num_warps": 8,
        "num_stages": 2,
        "SPLIT_K": 2
      },
      {
        "BLOCK_M": 256,
        "BLOCK_N": 128,
        "BLOCK_K": 32,
        "num_warps": 8,
        "num_stages": 2,
        "SPLIT_K": 4
      },
      {
        "BLOCK_M": 256,
        "BLOCK_N": 128,
        "BLOCK_K": 32,
        "num_warps": 8,
        "num_stages": 3,
        "SPLIT_K": 1
      },
      {
        "BLOCK_M": 256,
        "BLOCK_N": 128,
        "BLOCK_K": 32,
        "num_warps": 8,
        "num_stages": 3,
        "SPLIT_K": 2
      },
      {
        "BLOCK_M": 256,
        "BLOCK_N": 128,
        "BLOCK_K": 32,
        "num_warps": 8,
        "num_stages": 3,
        "SPLIT_K": 4
      },
      {
        "BLOCK_M": 256,
        "BLOCK_N": 128,
        "BLOCK_K": 32,
        "num_warps": 8,
        "num_stages": 4,
        "SPLIT_K": 1
      },
      {
        "BLOCK_M": 256,
        "BLOCK_N": 128,
        "BLOCK_K": 32,
        "num_warps": 8,
        "num_stages": 4,
        "SPLIT_K": 2
      },
      {
        "BLOCK_M": 256,
        "BLOCK_N": 128,
        "BLOCK_K": 32,
        "num_warps": 8,
        "num_stages": 4,
        "SPLIT_K": 4
      },
      {
        "BLOCK_M": 256,
        "BLOCK_N": 128,
        "BLOCK_K": 64,
        "num_warps": 4,
        "num_stages": 2,
        "SPLIT_K": 1
      },
      {
        "BLOCK_M": 256,
        "BLOCK_N": 128,
        "BLOCK_K": 64,
        "num_warps": 4,
        "num_stages": 2,
        "SPLIT_K": 2
      },
      {
        "BLOCK_M": 256,
        "BLOCK_N": 128,
        "BLOCK_K": 64,
        "num_warps": 4,
        "num_stages": 2,
        "SPLIT_K": 4
      },
      {
        "BLOCK_M": 256,
        "BLOCK_N": 128,
        "BLOCK_K": 64,
        "num_warps": 4,
        "num_stages": 3,
        "SPLIT_K": 1
      },
      {
        "BLOCK_M": 256,
        "BLOCK_N": 128,
        "BLOCK_K": 64,
        "num_warps": 4,
        "num_stages": 3,
        "SPLIT_K": 2
      },
      {
        "BLOCK_M": 256,
        "BLOCK_N": 128,
        "BLOCK_K": 64,
        "num_warps": 4,
        "num_stages": 3,
        "SPLIT_K": 4
      },
      {
        "BLOCK_M": 256,
        "BLOCK_N": 128,
        "BLOCK_K": 64,
        "num_warps": 4,
        "num_stages": 4,
        "SPLIT_K": 1
      },
      {
        "BLOCK_M": 256,
        "BLOCK_N": 128,
        "BLOCK_K": 64,
        "num_warps": 4,
        "num_stages": 4,
        "SPLIT_K": 2
      },
      {
        "BLOCK_M": 256,
        "BLOCK_N": 128,
        "BLOCK_K": 64,
        "num_warps": 4,
        "num_stages": 4,
        "SPLIT_K": 4
      },
      {
        "BLOCK_M": 256,
        "BLOCK_N": 128,
        "BLOCK_K": 64,
        "num_warps": 8,
        "num_stages": 2,
        "SPLIT_K": 1
      },
      {
        "BLOCK_M": 256,
        "BLOCK_N": 128,
        "BLOCK_K": 64,
        "num_warps": 8,
        "num_stages": 2,
        "SPLIT_K": 2
      },
      {
        "BLOCK_M": 256,
        "BLOCK_N": 128,
        "BLOCK_K": 64,
        "num_warps": 8,
        "num_stages": 2,
        "SPLIT_K": 4
      },
      {
        "BLOCK_M": 256,
        "BLOCK_N": 128,
        "BLOCK_K": 64,
        "num_warps": 8,
        "num_stages": 3,
        "SPLIT_K": 1
      },
      {
        "BLOCK_M": 256,
        "BLOCK_N": 128,
        "BLOCK_K": 64,
        "num_warps": 8,
        "num_stages": 3,
        "SPLIT_K": 2
      },
      {
        "BLOCK_M": 256,
        "BLOCK_N": 128,
        "BLOCK_K": 64,
        "num_warps": 8,
        "num_stages": 3,
        "SPLIT_K": 4
      },
      {
        "BLOCK_M": 256,
        "BLOCK_N": 128,
        "BLOCK_K": 64,
        "num_warps": 8,
        "num_stages": 4,
        "SPLIT_K": 1
      },
      {
        "BLOCK_M": 256,
        "BLOCK_N": 128,
        "BLOCK_K": 64,
        "num_warps": 8,
        "num_stages": 4,
        "SPLIT_K": 2
      },
      {
        "BLOCK_M": 256,
        "BLOCK_N": 128,
        "BLOCK_K": 64,
        "num_warps": 8,
        "num_stages": 4,
        "SPLIT_K": 4
      },
      {
        "BLOCK_M": 256,
        "BLOCK_N": 128,
        "BLOCK_K": 128,
        "num_warps": 4,
        "num_stages": 2,
        "SPLIT_K": 1
      },
      {
        "BLOCK_M": 256,
        "BLOCK_N": 128,
        "BLOCK_K": 128,
        "num_warps": 4,
        "num_stages": 2,
        "SPLIT_K": 2
      },
      {
        "BLOCK_M": 256,
        "BLOCK_N": 128,
        "BLOCK_K": 128,
        "num_warps": 4,
        "num_stages": 2,
        "SPLIT_K": 4
      },
      {
        "BLOCK_M": 256,
        "BLOCK_N": 128,
        "BLOCK_K": 128,
        "num_warps": 4,
        "num_stages": 3,
        "SPLIT_K": 1
      },
      {
        "BLOCK_M": 256,
        "BLOCK_N": 128,
        "BLOCK_K": 128,
        "num_warps": 4,
        "num_stages": 3,
        "SPLIT_K": 2
      },
      {
        "BLOCK_M": 256,
        "BLOCK_N": 128,
        "BLOCK_K": 128,
        "num_warps": 4,
        "num_stages": 3,
        "SPLIT_K": 4
      },
      {
        "BLOCK_M": 256,
        "BLOCK_N": 128,
        "BLOCK_K": 128,
        "num_warps": 4,
        "num_stages": 4,
        "SPLIT_K": 1
      },
      {
        "BLOCK_M": 256,
        "BLOCK_N": 128,
        "BLOCK_K": 128,
        "num_warps": 4,
        "num_stages": 4,
        "SPLIT_K": 2
      },
      {
        "BLOCK_M": 256,
        "BLOCK_N": 128,
        "BLOCK_K": 128,
        "num_warps": 4,
        "num_stages": 4,
        "SPLIT_K": 4
      },
      {
        "BLOCK_M": 256,
        "BLOCK_N": 128,
        "BLOCK_K": 128,
        "num_warps": 8,
        "num_stages": 2,
        "SPLIT_K": 1
      },
      {
        "BLOCK_M": 256,
        "BLOCK_N": 128,
        "BLOCK_K": 128,
        "num_warps": 8,
        "num_stages": 2,
        "SPLIT_K": 2
      },
      {
        "BLOCK_M": 256,
        "BLOCK_N": 128,
        "BLOCK_K": 128,
        "num_warps": 8,
        "num_stages": 2,
        "SPLIT_K": 4
      },
      {
        "BLOCK_M": 256,
        "BLOCK_N": 128,
        "BLOCK_K": 128,
        "num_warps": 8,
        "num_stages": 3,
        "SPLIT_K": 1
      },
      {
        "BLOCK_M": 256,
        "BLOCK_N": 128,
        "BLOCK_K": 128,
        "num_warps": 8,
        "num_stages": 3,
        "SPLIT_K": 2
      },
      {
        "BLOCK_M": 256,
        "BLOCK_N": 128,
        "BLOCK_K": 128,
        "num_warps": 8,
        "num_stages": 3,
        "SPLIT_K": 4
      },
      {
        "BLOCK_M": 256,
        "BLOCK_N": 128,
        "BLOCK_K": 128,
        "num_warps": 8,
        "num_stages": 4,
        "SPLIT_K": 1
      },
      {
        "BLOCK_M": 256,
        "BLOCK_N": 128,
        "BLOCK_K": 128,
        "num_warps": 8,
        "num_stages": 4,
        "SPLIT_K": 2
      },
      {
        "BLOCK_M": 256,
        "BLOCK_N": 128,
        "BLOCK_K": 128,
        "num_warps": 8,
        "num_stages": 4,
        "SPLIT_K": 4
      }
    ]
  },
  "grouped_gemm": {
    "count": 96,
    "configs": [
      {
        "GROUP_SIZE_M": 4,
        "BLOCK_M": 64,
        "BLOCK_N": 64,
        "BLOCK_K": 32,
        "num_warps": 4,
        "num_stages": 2
      },
      {
        "GROUP_SIZE_M": 4,
        "BLOCK_M": 64,
        "BLOCK_N": 64,
        "BLOCK_K": 32,
        "num_warps": 4,
        "num_stages": 3
      },
      {
        "GROUP_SIZE_M": 4,
        "BLOCK_M": 64,
        "BLOCK_N": 64,
        "BLOCK_K": 32,
        "num_warps": 8,
        "num_stages": 2
      },
      {
        "GROUP_SIZE_M": 4,
        "BLOCK_M": 64,
        "BLOCK_N": 64,
        "BLOCK_K": 32,
        "num_warps": 8,
        "num_stages": 3
      },
      {
        "GROUP_SIZE_M": 4,
        "BLOCK_M": 64,
        "BLOCK_N": 64,
        "BLOCK_K": 64,
        "num_warps": 4,
        "num_stages": 2
      },
      {
        "GROUP_SIZE_M": 4,
        "BLOCK_M": 64,
        "BLOCK_N": 64,
        "BLOCK_K": 64,
        "num_warps": 4,
        "num_stages": 3
      },
      {
        "GROUP_SIZE_M": 4,
        "BLOCK_M": 64,
        "BLOCK_N": 64,
        "BLOCK_K": 64,
        "num_warps": 8,
        "num_stages": 2
      },
      {
        "GROUP_SIZE_M": 4,
        "BLOCK_M": 64,
        "BLOCK_N": 64,
        "BLOCK_K": 64,
        "num_warps": 8,
        "num_stages": 3
      },
      {
        "GROUP_SIZE_M": 4,
        "BLOCK_M": 64,
        "BLOCK_N": 128,
        "BLOCK_K": 32,
        "num_warps": 4,
        "num_stages": 2
      },
      {
        "GROUP_SIZE_M": 4,
        "BLOCK_M": 64,
        "BLOCK_N": 128,
        "BLOCK_K": 32,
        "num_warps": 4,
        "num_stages": 3
      },
      {
        "GROUP_SIZE_M": 4,
        "BLOCK_M": 64,
        "BLOCK_N": 128,
        "BLOCK_K": 32,
        "num_warps": 8,
        "num_stages": 2
      },
      {
        "GROUP_SIZE_M": 4,
        "BLOCK_M": 64,
        "BLOCK_N": 128,
        "BLOCK_K": 32,
        "num_warps": 8,
        "num_stages": 3
      },
      {
        "GROUP_SIZE_M": 4,
        "BLOCK_M": 64,
        "BLOCK_N": 128,
        "BLOCK_K": 64,
        "num_warps": 4,
        "num_stages": 2
      },
      {
        "GROUP_SIZE_M": 4,
        "BLOCK_M": 64,
        "BLOCK_N": 128,
        "BLOCK_K": 64,
        "num_warps": 4,
        "num_stages": 3
      },
      {
        "GROUP_SIZE_M": 4,
        "BLOCK_M": 64,
        "BLOCK_N": 128,
        "BLOCK_K": 64,
        "num_warps": 8,
        "num_stages": 2
      },
      {
        "GROUP_SIZE_M": 4,
        "BLOCK_M": 64,
        "BLOCK_N": 128,
        "BLOCK_K": 64,
        "num_warps": 8,
        "num_stages": 3
      },
      {
        "GROUP_SIZE_M": 4,
        "BLOCK_M": 128,
        "BLOCK_N": 64,
        "BLOCK_K": 32,
        "num_warps": 4,
        "num_stages": 2
      },
      {
        "GROUP_SIZE_M": 4,
        "BLOCK_M": 128,
        "BLOCK_N": 64,
        "BLOCK_K": 32,
        "num_warps": 4,
        "num_stages": 3
      },
      {
        "GROUP_SIZE_M": 4,
        "BLOCK_M": 128,
        "BLOCK_N": 64,
        "BLOCK_K": 32,
        "num_warps": 8,
        "num_stages": 2
      },
      {
        "GROUP_SIZE_M": 4,
        "BLOCK_M": 128,
        "BLOCK_N": 64,
        "BLOCK_K": 32,
        "num_warps": 8,
        "num_stages": 3
      },
      {
        "GROUP_SIZE_M": 4,
        "BLOCK_M": 128,
        "BLOCK_N": 64,
        "BLOCK_K": 64,
        "num_warps": 4,
        "num_stages": 2
      },
      {
        "GROUP_SIZE_M": 4,
        "BLOCK_M": 128,
        "BLOCK_N": 64,
        "BLOCK_K": 64,
        "num_warps": 4,
        "num_stages": 3
      },
      {
        "GROUP_SIZE_M": 4,
        "BLOCK_M": 128,
        "BLOCK_N": 64,
        "BLOCK_K": 64,
        "num_warps": 8,
        "num_stages": 2
      },
      {
        "GROUP_SIZE_M": 4,
        "BLOCK_M": 128,
        "BLOCK_N": 64,
        "BLOCK_K": 64,
        "num_warps": 8,
        "num_stages": 3
      },
      {
        "GROUP_SIZE_M": 4,
        "BLOCK_M": 128,
        "BLOCK_N": 128,
        "BLOCK_K": 32,
        "num_warps": 4,
        "num_stages": 2
      },
      {
        "GROUP_SIZE_M": 4,
        "BLOCK_M": 128,
        "BLOCK_N": 128,
        "BLOCK_K": 32,
        "num_warps": 4,
        "num_stages": 3
      },
      {
        "GROUP_SIZE_M": 4,
        "BLOCK_M": 128,
        "BLOCK_N": 128,
        "BLOCK_K": 32,
        "num_warps": 8,
        "num_stages": 2
      },
      {
        "GROUP_SIZE_M": 4,
        "BLOCK_M": 128,
        "BLOCK_N": 128,
        "BLOCK_K": 32,
        "num_warps": 8,
        "num_stages": 3
      },
      {
        "GROUP_SIZE_M": 4,
        "BLOCK_M": 128,
        "BLOCK_N": 128,
        "BLOCK_K": 64,
        "num_warps": 4,
        "num_stages": 2
      },
      {
        "GROUP_SIZE_M": 4,
        "BLOCK_M": 128,
        "BLOCK_N": 128,
        "BLOCK_K": 64,
        "num_warps": 4,
        "num_stages": 3
      },
      {
        "GROUP_SIZE_M": 4,
        "BLOCK_M": 128,
        "BLOCK_N": 128,
        "BLOCK_K": 64,
        "num_warps": 8,
        "num_stages": 2
      },
      {
        "GROUP_SIZE_M": 4,
        "BLOCK_M": 128,
        "BLOCK_N": 128,
        "BLOCK_K": 64,
        "num_warps": 8,
        "num_stages": 3
      },
      {
        "GROUP_SIZE_M": 8,
        "BLOCK_M": 64,
        "BLOCK_N": 64,
        "BLOCK_K": 32,
        "num_warps": 4,
        "num_stages": 2
      },
      {
        "GROUP_SIZE_M": 8,
        "BLOCK_M": 64,
        "BLOCK_N": 64,
        "BLOCK_K": 32,
        "num_warps": 4,
        "num_stages": 3
      },
      {
        "GROUP_SIZE_M": 8,
        "BLOCK_M": 64,
        "BLOCK_N": 64,
        "BLOCK_K": 32,
        "num_warps": 8,
        "num_stages": 2
      },
      {
        "GROUP_SIZE_M": 8,
        "BLOCK_M": 64,
        "BLOCK_N": 64,
        "BLOCK_K": 32,
        "num_warps": 8,
        "num_stages": 3
      },
      {
        "GROUP_SIZE_M": 8,
        "BLOCK_M": 64,
        "BLOCK_N": 64,
        "BLOCK_K": 64,
        "num_warps": 4,
        "num_stages": 2
      },
      {
        "GROUP_SIZE_M": 8,
        "BLOCK_M": 64,
        "BLOCK_N": 64,
        "BLOCK_K": 64,
        "num_warps": 4,
        "num_stages": 3
      },
      {
        "GROUP_SIZE_M": 8,
        "BLOCK_M": 64,
        "BLOCK_N": 64,
        "BLOCK_K": 64,
        "num_warps": 8,
        "num_stages": 2
      },
      {
        "GROUP_SIZE_M": 8,
        "BLOCK_M": 64,
        "BLOCK_N": 64,
        "BLOCK_K": 64,
        "num_warps": 8,
        "num_stages": 3
      },
      {
        "GROUP_SIZE_M": 8,
        "BLOCK_M": 64,
        "BLOCK_N": 128,
        "BLOCK_K": 32,
        "num_warps": 4,
        "num_stages": 2
      },
      {
        "GROUP_SIZE_M": 8,
        "BLOCK_M": 64,
        "BLOCK_N": 128,
        "BLOCK_K": 32,
        "num_warps": 4,
        "num_stages": 3
      },
      {
        "GROUP_SIZE_M": 8,
        "BLOCK_M": 64,
        "BLOCK_N": 128,
        "BLOCK_K": 32,
        "num_warps": 8,
        "num_stages": 2
      },
      {
        "GROUP_SIZE_M": 8,
        "BLOCK_M": 64,
        "BLOCK_N": 128,
        "BLOCK_K": 32,
        "num_warps": 8,
        "num_stages": 3
      },
      {
        "GROUP_SIZE_M": 8,
        "BLOCK_M": 64,
        "BLOCK_N": 128,
        "BLOCK_K": 64,
        "num_warps": 4,
        "num_stages": 2
      },
      {
        "GROUP_SIZE_M": 8,
        "BLOCK_M": 64,
        "BLOCK_N": 128,
        "BLOCK_K": 64,
        "num_warps": 4,
        "num_stages": 3
      },
      {
        "GROUP_SIZE_M": 8,
        "BLOCK_M": 64,
        "BLOCK_N": 128,
        "BLOCK_K": 64,
        "num_warps": 8,
        "num_stages": 2
      },
      {
        "GROUP_SIZE_M": 8,
        "BLOCK_M": 64,
        "BLOCK_N": 128,
        "BLOCK_K": 64,
        "num_warps": 8,
        "num_stages": 3
      },
      {
        "GROUP_SIZE_M": 8,
        "BLOCK_M": 128,
        "BLOCK_N": 64,
        "BLOCK_K": 32,
        "num_warps": 4,
        "num_stages": 2
      },
      {
        "GROUP_SIZE_M": 8,
        "BLOCK_M": 128,
        "BLOCK_N": 64,
        "BLOCK_K": 32,
        "num_warps": 4,
        "num_stages": 3
      },
      {
        "GROUP_SIZE_M": 8,
        "BLOCK_M": 128,
        "BLOCK_N": 64,
        "BLOCK_K": 32,
        "num_warps": 8,
        "num_stages": 2
      },
      {
        "GROUP_SIZE_M": 8,
        "BLOCK_M": 128,
        "BLOCK_N": 64,
        "BLOCK_K": 32,
        "num_warps": 8,
        "num_stages": 3
      },
      {
        "GROUP_SIZE_M": 8,
        "BLOCK_M": 128,
        "BLOCK_N": 64,
        "BLOCK_K": 64,
        "num_warps": 4,
        "num_stages": 2
      },
      {
        "GROUP_SIZE_M": 8,
        "BLOCK_M": 128,
        "BLOCK_N": 64,
        "BLOCK_K": 64,
        "num_warps": 4,
        "num_stages": 3
      },
      {
        "GROUP_SIZE_M": 8,
        "BLOCK_M": 128,
        "BLOCK_N": 64,
        "BLOCK_K": 64,
        "num_warps": 8,
        "num_stages": 2
      },
      {
        "GROUP_SIZE_M": 8,
        "BLOCK_M": 128,
        "BLOCK_N": 64,
        "BLOCK_K": 64,
        "num_warps": 8,
        "num_stages": 3
      },
      {
        "GROUP_SIZE_M": 8,
        "BLOCK_M": 128,
        "BLOCK_N": 128,
        "BLOCK_K": 32,
        "num_warps": 4,
        "num_stages": 2
      },
      {
        "GROUP_SIZE_M": 8,
        "BLOCK_M": 128,
        "BLOCK_N": 128,
        "BLOCK_K": 32,
        "num_warps": 4,
        "num_stages": 3
      },
      {
        "GROUP_SIZE_M": 8,
        "BLOCK_M": 128,
        "BLOCK_N": 128,
        "BLOCK_K": 32,
        "num_warps": 8,
        "num_stages": 2
      },
      {
        "GROUP_SIZE_M": 8,
        "BLOCK_M": 128,
        "BLOCK_N": 128,
        "BLOCK_K": 32,
        "num_warps": 8,
        "num_stages": 3
      },
      {
        "GROUP_SIZE_M": 8,
        "BLOCK_M": 128,
        "BLOCK_N": 128,
        "BLOCK_K": 64,
        "num_warps": 4,
        "num_stages": 2
      },
      {
        "GROUP_SIZE_M": 8,
        "BLOCK_M": 128,
        "BLOCK_N": 128,
        "BLOCK_K": 64,
        "num_warps": 4,
        "num_stages": 3
      },
      {
        "GROUP_SIZE_M": 8,
        "BLOCK_M": 128,
        "BLOCK_N": 128,
        "BLOCK_K": 64,
        "num_warps": 8,
        "num_stages": 2
      },
      {
        "GROUP_SIZE_M": 8,
        "BLOCK_M": 128,
        "BLOCK_N": 128,
        "BLOCK_K": 64,
        "num_warps": 8,
        "num_stages": 3
      },
      {
        "GROUP_SIZE_M": 16,
        "BLOCK_M": 64,
        "BLOCK_N": 64,
        "BLOCK_K": 32,
        "num_warps": 4,
        "num_stages": 2
      },
      {
        "GROUP_SIZE_M": 16,
        "BLOCK_M": 64,
        "BLOCK_N": 64,
        "BLOCK_K": 32,
        "num_warps": 4,
        "num_stages": 3
      },
      {
        "GROUP_SIZE_M": 16,
        "BLOCK_M": 64,
        "BLOCK_N": 64,
        "BLOCK_K": 32,
        "num_warps": 8,
        "num_stages": 2
      },
      {
        "GROUP_SIZE_M": 16,
        "BLOCK_M": 64,
        "BLOCK_N": 64,
        "BLOCK_K": 32,
        "num_warps": 8,
        "num_stages": 3
      },
      {
        "GROUP_SIZE_M": 16,
        "BLOCK_M": 64,
        "BLOCK_N": 64,
        "BLOCK_K": 64,
        "num_warps": 4,
        "num_stages": 2
      },
      {
        "GROUP_SIZE_M": 16,
        "BLOCK_M": 64,
        "BLOCK_N": 64,
        "BLOCK_K": 64,
        "num_warps": 4,
        "num_stages": 3
      },
      {
        "GROUP_SIZE_M": 16,
        "BLOCK_M": 64,
        "BLOCK_N": 64,
        "BLOCK_K": 64,
        "num_warps": 8,
        "num_stages": 2
      },
      {
        "GROUP_SIZE_M": 16,
        "BLOCK_M": 64,
        "BLOCK_N": 64,
        "BLOCK_K": 64,
        "num_warps": 8,
        "num_stages": 3
      },
      {
        "GROUP_SIZE_M": 16,
        "BLOCK_M": 64,
        "BLOCK_N": 128,
        "BLOCK_K": 32,
        "num_warps": 4,
        "num_stages": 2
      },
      {
        "GROUP_SIZE_M": 16,
        "BLOCK_M": 64,
        "BLOCK_N": 128,
        "BLOCK_K": 32,
        "num_warps": 4,
        "num_stages": 3
      },
      {
        "GROUP_SIZE_M": 16,
        "BLOCK_M": 64,
        "BLOCK_N": 128,
        "BLOCK_K": 32,
        "num_warps": 8,
        "num_stages": 2
      },
      {
        "GROUP_SIZE_M": 16,
        "BLOCK_M": 64,
        "BLOCK_N": 128,
        "BLOCK_K": 32,
        "num_warps": 8,
        "num_stages": 3
      },
      {
        "GROUP_SIZE_M": 16,
        "BLOCK_M": 64,
        "BLOCK_N": 128,
        "BLOCK_K": 64,
        "num_warps": 4,
        "num_stages": 2
      },
      {
        "GROUP_SIZE_M": 16,
        "BLOCK_M": 64,
        "BLOCK_N": 128,
        "BLOCK_K": 64,
        "num_warps": 4,
        "num_stages": 3
      },
      {
        "GROUP_SIZE_M": 16,
        "BLOCK_M": 64,
        "BLOCK_N": 128,
        "BLOCK_K": 64,
        "num_warps": 8,
        "num_stages": 2
      },
      {
        "GROUP_SIZE_M": 16,
        "BLOCK_M": 64,
        "BLOCK_N": 128,
        "BLOCK_K": 64,
        "num_warps": 8,
        "num_stages": 3
      },
      {
        "GROUP_SIZE_M": 16,
        "BLOCK_M": 128,
        "BLOCK_N": 64,
        "BLOCK_K": 32,
        "num_warps": 4,
        "num_stages": 2
      },
      {
        "GROUP_SIZE_M": 16,
        "BLOCK_M": 128,
        "BLOCK_N": 64,
        "BLOCK_K": 32,
        "num_warps": 4,
        "num_stages": 3
      },
      {
        "GROUP_SIZE_M": 16,
        "BLOCK_M": 128,
        "BLOCK_N": 64,
        "BLOCK_K": 32,
        "num_warps": 8,
        "num_stages": 2
      },
      {
        "GROUP_SIZE_M": 16,
        "BLOCK_M": 128,
        "BLOCK_N": 64,
        "BLOCK_K": 32,
        "num_warps": 8,
        "num_stages": 3
      },
      {
        "GROUP_SIZE_M": 16,
        "BLOCK_M": 128,
        "BLOCK_N": 64,
        "BLOCK_K": 64,
        "num_warps": 4,
        "num_stages": 2
      },
      {
        "GROUP_SIZE_M": 16,
        "BLOCK_M": 128,
        "BLOCK_N": 64,
        "BLOCK_K": 64,
        "num_warps": 4,
        "num_stages": 3
      },
      {
        "GROUP_SIZE_M": 16,
        "BLOCK_M": 128,
        "BLOCK_N": 64,
        "BLOCK_K": 64,
        "num_warps": 8,
        "num_stages": 2
      },
      {
        "GROUP_SIZE_M": 16,
        "BLOCK_M": 128,
        "BLOCK_N": 64,
        "BLOCK_K": 64,
        "num_warps": 8,
        "num_stages": 3
      },
      {
        "GROUP_SIZE_M": 16,
        "BLOCK_M": 128,
        "BLOCK_N": 128,
        "BLOCK_K": 32,
        "num_warps": 4,
        "num_stages": 2
      },
      {
        "GROUP_SIZE_M": 16,
        "BLOCK_M": 128,
        "BLOCK_N": 128,
        "BLOCK_K": 32,
        "num_warps": 4,
        "num_stages": 3
      },
      {
        "GROUP_SIZE_M": 16,
        "BLOCK_M": 128,
        "BLOCK_N": 128,
        "BLOCK_K": 32,
        "num_warps": 8,
        "num_stages": 2
      },
      {
        "GROUP_SIZE_M": 16,
        "BLOCK_M": 128,
        "BLOCK_N": 128,
        "BLOCK_K": 32,
        "num_warps": 8,
        "num_stages": 3
      },
      {
        "GROUP_SIZE_M": 16,
        "BLOCK_M": 128,
        "BLOCK_N": 128,
        "BLOCK_K": 64,
        "num_warps": 4,
        "num_stages": 2
      },
      {
        "GROUP_SIZE_M": 16,
        "BLOCK_M": 128,
        "BLOCK_N": 128,
        "BLOCK_K": 64,
        "num_warps": 4,
        "num_stages": 3
      },
      {
        "GROUP_SIZE_M": 16,
        "BLOCK_M": 128,
        "BLOCK_N": 128,
        "BLOCK_K": 64,
        "num_warps": 8,
        "num_stages": 2
      },
      {
        "GROUP_SIZE_M": 16,
        "BLOCK_M": 128,
        "BLOCK_N": 128,
        "BLOCK_K": 64,
        "num_warps": 8,
        "num_stages": 3
      }
    ]
  }
}
