.noeris/cost-model-training.json
{
  "records": {
    "rmsnorm:small_hidden:NVIDIA A100-SXM4-80GB": {
      "shape_key": "rmsnorm:small_hidden:NVIDIA A100-SXM4-80GB",
      "shape": {
        "n_rows": 1024,
        "hidden_dim": 768,
        "bucket": "small_hidden"
      },
      "best_config_id": "bs128_w1_s1",
      "best_tflops": 321.77,
      "results": [
        {
          "config_id": "bs1024_w4_s1",
          "config": {
            "BLOCK_SIZE": 1024,
            "num_warps": 4,
            "num_stages": 1
          },
          "tflops": 289.95,
          "ms": 0.0109,
          "correct": true,
          "run_id": "bs1024_w4_s1",
          "hardware": "NVIDIA A100-SXM4-80GB",
          "operator": "rmsnorm"
        },
        {
          "config_id": "bs2048_w8_s1",
          "config": {
            "BLOCK_SIZE": 2048,
            "num_warps": 8,
            "num_stages": 1
          },
          "tflops": 300.38,
          "ms": 0.0105,
          "correct": true,
          "run_id": "bs2048_w8_s1",
          "hardware": "NVIDIA A100-SXM4-80GB",
          "operator": "rmsnorm"
        },
        {
          "config_id": "bs4096_w16_s1",
          "config": {
            "BLOCK_SIZE": 4096,
            "num_warps": 16,
            "num_stages": 1
          },
          "tflops": 263.4,
          "ms": 0.0119,
          "correct": true,
          "run_id": "bs4096_w16_s1",
          "hardware": "NVIDIA A100-SXM4-80GB",
          "operator": "rmsnorm"
        },
        {
          "config_id": "bs512_w2_s2",
          "config": {
            "BLOCK_SIZE": 512,
            "num_warps": 2,
            "num_stages": 2
          },
          "tflops": 303.89,
          "ms": 0.0104,
          "correct": true,
          "run_id": "bs512_w2_s2",
          "hardware": "NVIDIA A100-SXM4-80GB",
          "operator": "rmsnorm"
        },
        {
          "config_id": "bs1024_w8_s2",
          "config": {
            "BLOCK_SIZE": 1024,
            "num_warps": 8,
            "num_stages": 2
          },
          "tflops": 307.72,
          "ms": 0.0102,
          "correct": true,
          "run_id": "bs1024_w8_s2",
          "hardware": "NVIDIA A100-SXM4-80GB",
          "operator": "rmsnorm"
        },
        {
          "config_id": "bs2048_w4_s2",
          "config": {
            "BLOCK_SIZE": 2048,
            "num_warps": 4,
            "num_stages": 2
          },
          "tflops": 302.0,
          "ms": 0.0104,
          "correct": true,
          "run_id": "bs2048_w4_s2",
          "hardware": "NVIDIA A100-SXM4-80GB",
          "operator": "rmsnorm"
        },
        {
          "config_id": "bs256_w1_s1",
          "config": {
            "BLOCK_SIZE": 256,
            "num_warps": 1,
            "num_stages": 1
          },
          "tflops": 308.18,
          "ms": 0.0102,
          "correct": true,
          "run_id": "bs256_w1_s1",
          "hardware": "NVIDIA A100-SXM4-80GB",
          "operator": "rmsnorm"
        },
        {
          "config_id": "bs4096_w8_s2",
          "config": {
            "BLOCK_SIZE": 4096,
            "num_warps": 8,
            "num_stages": 2
          },
          "tflops": 273.94,
          "ms": 0.0115,
          "correct": true,
          "run_id": "bs4096_w8_s2",
          "hardware": "NVIDIA A100-SXM4-80GB",
          "operator": "rmsnorm"
        },
        {
          "config_id": "bs128_w1_s1",
          "config": {
            "BLOCK_SIZE": 128,
            "num_warps": 1,
            "num_stages": 1
          },
          "tflops": 321.77,
          "ms": 0.0098,
          "correct": true,
          "run_id": "bs128_w1_s1",
          "hardware": "NVIDIA A100-SXM4-80GB",
          "operator": "rmsnorm"
        },
        {
          "config_id": "bs128_w1_s2",
          "config": {
            "BLOCK_SIZE": 128,
            "num_warps": 1,
            "num_stages": 2
          },
          "tflops": 303.95,
          "ms": 0.0104,
          "correct": true,
          "run_id": "bs128_w1_s2",
          "hardware": "NVIDIA A100-SXM4-80GB",
          "operator": "rmsnorm"
        },
        {
          "config_id": "bs128_w2_s1",
          "config": {
            "BLOCK_SIZE": 128,
            "num_warps": 2,
            "num_stages": 1
          },
          "tflops": 305.71,
          "ms": 0.0103,
          "correct": true,
          "run_id": "bs128_w2_s1",
          "hardware": "NVIDIA A100-SXM4-80GB",
          "operator": "rmsnorm"
        },
        {
          "config_id": "bs128_w2_s2",
          "config": {
            "BLOCK_SIZE": 128,
            "num_warps": 2,
            "num_stages": 2
          },
          "tflops": 320.52,
          "ms": 0.0098,
          "correct": true,
          "run_id": "bs128_w2_s2",
          "hardware": "NVIDIA A100-SXM4-80GB",
          "operator": "rmsnorm"
        },
        {
          "config_id": "bs128_w4_s1",
          "config": {
            "BLOCK_SIZE": 128,
            "num_warps": 4,
            "num_stages": 1
          },
          "tflops": 305.09,
          "ms": 0.0103,
          "correct": true,
          "run_id": "bs128_w4_s1",
          "hardware": "NVIDIA A100-SXM4-80GB",
          "operator": "rmsnorm"
        },
        {
          "config_id": "bs128_w4_s2",
          "config": {
            "BLOCK_SIZE": 128,
            "num_warps": 4,
            "num_stages": 2
          },
          "tflops": 305.8,
          "ms": 0.0103,
          "correct": true,
          "run_id": "bs128_w4_s2",
          "hardware": "NVIDIA A100-SXM4-80GB",
          "operator": "rmsnorm"
        },
        {
          "config_id": "bs128_w8_s1",
          "config": {
            "BLOCK_SIZE": 128,
            "num_warps": 8,
            "num_stages": 1
          },
          "tflops": 306.46,
          "ms": 0.0103,
          "correct": true,
          "run_id": "bs128_w8_s1",
          "hardware": "NVIDIA A100-SXM4-80GB",
          "operator": "rmsnorm"
        },
        {
          "config_id": "bs128_w8_s2",
          "config": {
            "BLOCK_SIZE": 128,
            "num_warps": 8,
            "num_stages": 2
          },
          "tflops": 289.22,
          "ms": 0.0109,
          "correct": true,
          "run_id": "bs128_w8_s2",
          "hardware": "NVIDIA A100-SXM4-80GB",
          "operator": "rmsnorm"
        }
      ]
    },
    "rmsnorm:gpt2_base:NVIDIA A100-SXM4-80GB": {
      "shape_key": "rmsnorm:gpt2_base:NVIDIA A100-SXM4-80GB",
      "shape": {
        "n_rows": 4096,
        "hidden_dim": 768,
        "bucket": "gpt2_base"
      },
      "best_config_id": "bs256_w1_s1",
      "best_tflops": 888.35,
      "results": [
        {
          "config_id": "bs1024_w4_s1",
          "config": {
            "BLOCK_SIZE": 1024,
            "num_warps": 4,
            "num_stages": 1
          },
          "tflops": 712.07,
          "ms": 0.0177,
          "correct": true,
          "run_id": "bs1024_w4_s1",
          "hardware": "NVIDIA A100-SXM4-80GB",
          "operator": "rmsnorm"
        },
        {
          "config_id": "bs1024_w4_s1",
          "config": {
            "BLOCK_SIZE": 1024,
            "num_warps": 4,
            "num_stages": 1
          },
          "tflops": 775.0,
          "ms": 0.0162,
          "correct": true,
          "run_id": "bs1024_w4_s1",
          "hardware": "NVIDIA A100-SXM4-80GB",
          "operator": "rmsnorm"
        },
        {
          "config_id": "bs2048_w8_s1",
          "config": {
            "BLOCK_SIZE": 2048,
            "num_warps": 8,
            "num_stages": 1
          },
          "tflops": 744.78,
          "ms": 0.0169,
          "correct": true,
          "run_id": "bs2048_w8_s1",
          "hardware": "NVIDIA A100-SXM4-80GB",
          "operator": "rmsnorm"
        },
        {
          "config_id": "bs2048_w8_s1",
          "config": {
            "BLOCK_SIZE": 2048,
            "num_warps": 8,
            "num_stages": 1
          },
          "tflops": 746.55,
          "ms": 0.0169,
          "correct": true,
          "run_id": "bs2048_w8_s1",
          "hardware": "NVIDIA A100-SXM4-80GB",
          "operator": "rmsnorm"
        },
        {
          "config_id": "bs4096_w16_s1",
          "config": {
            "BLOCK_SIZE": 4096,
            "num_warps": 16,
            "num_stages": 1
          },
          "tflops": 511.38,
          "ms": 0.0246,
          "correct": true,
          "run_id": "bs4096_w16_s1",
          "hardware": "NVIDIA A100-SXM4-80GB",
          "operator": "rmsnorm"
        },
        {
          "config_id": "bs4096_w16_s1",
          "config": {
            "BLOCK_SIZE": 4096,
            "num_warps": 16,
            "num_stages": 1
          },
          "tflops": 498.53,
          "ms": 0.0252,
          "correct": true,
          "run_id": "bs4096_w16_s1",
          "hardware": "NVIDIA A100-SXM4-80GB",
          "operator": "rmsnorm"
        },
        {
          "config_id": "bs512_w2_s2",
          "config": {
            "BLOCK_SIZE": 512,
            "num_warps": 2,
            "num_stages": 2
          },
          "tflops": 838.85,
          "ms": 0.015,
          "correct": true,
          "run_id": "bs512_w2_s2",
          "hardware": "NVIDIA A100-SXM4-80GB",
          "operator": "rmsnorm"
        },
        {
          "config_id": "bs512_w2_s2",
          "config": {
            "BLOCK_SIZE": 512,
            "num_warps": 2,
            "num_stages": 2
          },
          "tflops": 868.19,
          "ms": 0.0145,
          "correct": true,
          "run_id": "bs512_w2_s2",
          "hardware": "NVIDIA A100-SXM4-80GB",
          "operator": "rmsnorm"
        },
        {
          "config_id": "bs1024_w8_s2",
          "config": {
            "BLOCK_SIZE": 1024,
            "num_warps": 8,
            "num_stages": 2
          },
          "tflops": 736.58,
          "ms": 0.0171,
          "correct": true,
          "run_id": "bs1024_w8_s2",
          "hardware": "NVIDIA A100-SXM4-80GB",
          "operator": "rmsnorm"
        },
        {
          "config_id": "bs1024_w8_s2",
          "config": {
            "BLOCK_SIZE": 1024,
            "num_warps": 8,
            "num_stages": 2
          },
          "tflops": 733.52,
          "ms": 0.0172,
          "correct": true,
          "run_id": "bs1024_w8_s2",
          "hardware": "NVIDIA A100-SXM4-80GB",
          "operator": "rmsnorm"
        },
        {
          "config_id": "bs2048_w4_s2",
          "config": {
            "BLOCK_SIZE": 2048,
            "num_warps": 4,
            "num_stages": 2
          },
          "tflops": 754.35,
          "ms": 0.0167,
          "correct": true,
          "run_id": "bs2048_w4_s2",
          "hardware": "NVIDIA A100-SXM4-80GB",
          "operator": "rmsnorm"
        },
        {
          "config_id": "bs2048_w4_s2",
          "config": {
            "BLOCK_SIZE": 2048,
            "num_warps": 4,
            "num_stages": 2
          },
          "tflops": 777.51,
          "ms": 0.0162,
          "correct": true,
          "run_id": "bs2048_w4_s2",
          "hardware": "NVIDIA A100-SXM4-80GB",
          "operator": "rmsnorm"
        },
        {
          "config_id": "bs256_w1_s1",
          "config": {
            "BLOCK_SIZE": 256,
            "num_warps": 1,
            "num_stages": 1
          },
          "tflops": 888.35,
          "ms": 0.0142,
          "correct": true,
          "run_id": "bs256_w1_s1",
          "hardware": "NVIDIA A100-SXM4-80GB",
          "operator": "rmsnorm"
        },
        {
          "config_id": "bs256_w1_s1",
          "config": {
            "BLOCK_SIZE": 256,
            "num_warps": 1,
            "num_stages": 1
          },
          "tflops": 877.92,
          "ms": 0.0143,
          "correct": true,
          "run_id": "bs256_w1_s1",
          "hardware": "NVIDIA A100-SXM4-80GB",
          "operator": "rmsnorm"
        },
        {
          "config_id": "bs4096_w8_s2",
          "config": {
            "BLOCK_SIZE": 4096,
            "num_warps": 8,
            "num_stages": 2
          },
          "tflops": 652.33,
          "ms": 0.0193,
          "correct": true,
          "run_id": "bs4096_w8_s2",
          "hardware": "NVIDIA A100-SXM4-80GB",
          "operator": "rmsnorm"
        },
        {
          "config_id": "bs4096_w8_s2",
          "config": {
            "BLOCK_SIZE": 4096,
            "num_warps": 8,
            "num_stages": 2
          },
          "tflops": 671.8,
          "ms": 0.0187,
          "correct": true,
          "run_id": "bs4096_w8_s2",
          "hardware": "NVIDIA A100-SXM4-80GB",
          "operator": "rmsnorm"
        },
        {
          "config_id": "bs128_w1_s1",
          "config": {
            "BLOCK_SIZE": 128,
            "num_warps": 1,
            "num_stages": 1
          },
          "tflops": 878.11,
          "ms": 0.0143,
          "correct": true,
          "run_id": "bs128_w1_s1",
          "hardware": "NVIDIA A100-SXM4-80GB",
          "operator": "rmsnorm"
        },
        {
          "config_id": "bs128_w1_s1",
          "config": {
            "BLOCK_SIZE": 128,
            "num_warps": 1,
            "num_stages": 1
          },
          "tflops": 877.73,
          "ms": 0.0143,
          "correct": true,
          "run_id": "bs128_w1_s1",
          "hardware": "NVIDIA A100-SXM4-80GB",
          "operator": "rmsnorm"
        },
        {
          "config_id": "bs128_w1_s2",
          "config": {
            "BLOCK_SIZE": 128,
            "num_warps": 1,
            "num_stages": 2
          },
          "tflops": 846.53,
          "ms": 0.0149,
          "correct": true,
          "run_id": "bs128_w1_s2",
          "hardware": "NVIDIA A100-SXM4-80GB",
          "operator": "rmsnorm"
        },
        {
          "config_id": "bs128_w1_s2",
          "config": {
            "BLOCK_SIZE": 128,
            "num_warps": 1,
            "num_stages": 2
          },
          "tflops": 870.96,
          "ms": 0.0144,
          "correct": true,
          "run_id": "bs128_w1_s2",
          "hardware": "NVIDIA A100-SXM4-80GB",
          "operator": "rmsnorm"
        },
        {
          "config_id": "bs128_w2_s1",
          "config": {
            "BLOCK_SIZE": 128,
            "num_warps": 2,
            "num_stages": 1
          },
          "tflops": 865.24,
          "ms": 0.0145,
          "correct": true,
          "run_id": "bs128_w2_s1",
          "hardware": "NVIDIA A100-SXM4-80GB",
          "operator": "rmsnorm"
        },
        {
          "config_id": "bs128_w2_s1",
          "config": {
            "BLOCK_SIZE": 128,
            "num_warps": 2,
            "num_stages": 1
          },
          "tflops": 875.24,
          "ms": 0.0144,
          "correct": true,
          "run_id": "bs128_w2_s1",
          "hardware": "NVIDIA A100-SXM4-80GB",
          "operator": "rmsnorm"
        },
        {
          "config_id": "bs128_w2_s2",
          "config": {
            "BLOCK_SIZE": 128,
            "num_warps": 2,
            "num_stages": 2
          },
          "tflops": 840.21,
          "ms": 0.015,
          "correct": true,
          "run_id": "bs128_w2_s2",
          "hardware": "NVIDIA A100-SXM4-80GB",
          "operator": "rmsnorm"
        },
        {
          "config_id": "bs128_w2_s2",
          "config": {
            "BLOCK_SIZE": 128,
            "num_warps": 2,
            "num_stages": 2
          },
          "tflops": 872.67,
          "ms": 0.0144,
          "correct": true,
          "run_id": "bs128_w2_s2",
          "hardware": "NVIDIA A100-SXM4-80GB",
          "operator": "rmsnorm"
        },
        {
          "config_id": "bs128_w4_s1",
          "config": {
            "BLOCK_SIZE": 128,
            "num_warps": 4,
            "num_stages": 1
          },
          "tflops": 767.07,
          "ms": 0.0164,
          "correct": true,
          "run_id": "bs128_w4_s1",
          "hardware": "NVIDIA A100-SXM4-80GB",
          "operator": "rmsnorm"
        },
        {
          "config_id": "bs128_w4_s1",
          "config": {
            "BLOCK_SIZE": 128,
            "num_warps": 4,
            "num_stages": 1
          },
          "tflops": 789.28,
          "ms": 0.0159,
          "correct": true,
          "run_id": "bs128_w4_s1",
          "hardware": "NVIDIA A100-SXM4-80GB",
          "operator": "rmsnorm"
        },
        {
          "config_id": "bs128_w4_s2",
          "config": {
            "BLOCK_SIZE": 128,
            "num_warps": 4,
            "num_stages": 2
          },
          "tflops": 766.99,
          "ms": 0.0164,
          "correct": true,
          "run_id": "bs128_w4_s2",
          "hardware": "NVIDIA A100-SXM4-80GB",
          "operator": "rmsnorm"
        },
        {
          "config_id": "bs128_w4_s2",
          "config": {
            "BLOCK_SIZE": 128,
            "num_warps": 4,
            "num_stages": 2
          },
          "tflops": 794.7,
          "ms": 0.0158,
          "correct": true,
          "run_id": "bs128_w4_s2",
          "hardware": "NVIDIA A100-SXM4-80GB",
          "operator": "rmsnorm"
        },
        {
          "config_id": "bs128_w8_s1",
          "config": {
            "BLOCK_SIZE": 128,
            "num_warps": 8,
            "num_stages": 1
          },
          "tflops": 732.49,
          "ms": 0.0172,
          "correct": true,
          "run_id": "bs128_w8_s1",
          "hardware": "NVIDIA A100-SXM4-80GB",
          "operator": "rmsnorm"
        },
        {
          "config_id": "bs128_w8_s1",
          "config": {
            "BLOCK_SIZE": 128,
            "num_warps": 8,
            "num_stages": 1
          },
          "tflops": 761.52,
          "ms": 0.0165,
          "correct": true,
          "run_id": "bs128_w8_s1",
          "hardware": "NVIDIA A100-SXM4-80GB",
          "operator": "rmsnorm"
        },
        {
          "config_id": "bs128_w8_s2",
          "config": {
            "BLOCK_SIZE": 128,
            "num_warps": 8,
            "num_stages": 2
          },
          "tflops": 757.12,
          "ms": 0.0166,
          "correct": true,
          "run_id": "bs128_w8_s2",
          "hardware": "NVIDIA A100-SXM4-80GB",
          "operator": "rmsnorm"
        },
        {
          "config_id": "bs128_w8_s2",
          "config": {
            "BLOCK_SIZE": 128,
            "num_warps": 8,
            "num_stages": 2
          },
          "tflops": 760.77,
          "ms": 0.0165,
          "correct": true,
          "run_id": "bs128_w8_s2",
          "hardware": "NVIDIA A100-SXM4-80GB",
          "operator": "rmsnorm"
        }
      ]
    },
    "rmsnorm:llama_160m:NVIDIA A100-SXM4-80GB": {
      "shape_key": "rmsnorm:llama_160m:NVIDIA A100-SXM4-80GB",
      "shape": {
        "n_rows": 2048,
        "hidden_dim": 1024,
        "bucket": "llama_160m"
      },
      "best_config_id": "bs128_w2_s2",
      "best_tflops": 667.79,
      "results": [
        {
          "config_id": "bs1024_w4_s1",
          "config": {
            "BLOCK_SIZE": 1024,
            "num_warps": 4,
            "num_stages": 1
          },
          "tflops": 602.08,
          "ms": 0.0139,
          "correct": true,
          "run_id": "bs1024_w4_s1",
          "hardware": "NVIDIA A100-SXM4-80GB",
          "operator": "rmsnorm"
        },
        {
          "config_id": "bs2048_w8_s1",
          "config": {
            "BLOCK_SIZE": 2048,
            "num_warps": 8,
            "num_stages": 1
          },
          "tflops": 621.01,
          "ms": 0.0135,
          "correct": true,
          "run_id": "bs2048_w8_s1",
          "hardware": "NVIDIA A100-SXM4-80GB",
          "operator": "rmsnorm"
        },
        {
          "config_id": "bs4096_w16_s1",
          "config": {
            "BLOCK_SIZE": 4096,
            "num_warps": 16,
            "num_stages": 1
          },
          "tflops": 490.42,
          "ms": 0.0171,
          "correct": true,
          "run_id": "bs4096_w16_s1",
          "hardware": "NVIDIA A100-SXM4-80GB",
          "operator": "rmsnorm"
        },
        {
          "config_id": "bs512_w2_s2",
          "config": {
            "BLOCK_SIZE": 512,
            "num_warps": 2,
            "num_stages": 2
          },
          "tflops": 638.08,
          "ms": 0.0131,
          "correct": true,
          "run_id": "bs512_w2_s2",
          "hardware": "NVIDIA A100-SXM4-80GB",
          "operator": "rmsnorm"
        },
        {
          "config_id": "bs1024_w8_s2",
          "config": {
            "BLOCK_SIZE": 1024,
            "num_warps": 8,
            "num_stages": 2
          },
          "tflops": 628.18,
          "ms": 0.0134,
          "correct": true,
          "run_id": "bs1024_w8_s2",
          "hardware": "NVIDIA A100-SXM4-80GB",
          "operator": "rmsnorm"
        },
        {
          "config_id": "bs2048_w4_s2",
          "config": {
            "BLOCK_SIZE": 2048,
            "num_warps": 4,
            "num_stages": 2
          },
          "tflops": 598.16,
          "ms": 0.014,
          "correct": true,
          "run_id": "bs2048_w4_s2",
          "hardware": "NVIDIA A100-SXM4-80GB",
          "operator": "rmsnorm"
        },
        {
          "config_id": "bs256_w1_s1",
          "config": {
            "BLOCK_SIZE": 256,
            "num_warps": 1,
            "num_stages": 1
          },
          "tflops": 638.49,
          "ms": 0.0131,
          "correct": true,
          "run_id": "bs256_w1_s1",
          "hardware": "NVIDIA A100-SXM4-80GB",
          "operator": "rmsnorm"
        },
        {
          "config_id": "bs4096_w8_s2",
          "config": {
            "BLOCK_SIZE": 4096,
            "num_warps": 8,
            "num_stages": 2
          },
          "tflops": 576.23,
          "ms": 0.0146,
          "correct": true,
          "run_id": "bs4096_w8_s2",
          "hardware": "NVIDIA A100-SXM4-80GB",
          "operator": "rmsnorm"
        },
        {
          "config_id": "bs128_w1_s1",
          "config": {
            "BLOCK_SIZE": 128,
            "num_warps": 1,
            "num_stages": 1
          },
          "tflops": 637.51,
          "ms": 0.0132,
          "correct": true,
          "run_id": "bs128_w1_s1",
          "hardware": "NVIDIA A100-SXM4-80GB",
          "operator": "rmsnorm"
        },
        {
          "config_id": "bs128_w1_s2",
          "config": {
            "BLOCK_SIZE": 128,
            "num_warps": 1,
            "num_stages": 2
          },
          "tflops": 666.59,
          "ms": 0.0126,
          "correct": true,
          "run_id": "bs128_w1_s2",
          "hardware": "NVIDIA A100-SXM4-80GB",
          "operator": "rmsnorm"
        },
        {
          "config_id": "bs128_w2_s1",
          "config": {
            "BLOCK_SIZE": 128,
            "num_warps": 2,
            "num_stages": 1
          },
          "tflops": 667.13,
          "ms": 0.0126,
          "correct": true,
          "run_id": "bs128_w2_s1",
          "hardware": "NVIDIA A100-SXM4-80GB",
          "operator": "rmsnorm"
        },
        {
          "config_id": "bs128_w2_s2",
          "config": {
            "BLOCK_SIZE": 128,
            "num_warps": 2,
            "num_stages": 2
          },
          "tflops": 667.79,
          "ms": 0.0126,
          "correct": true,
          "run_id": "bs128_w2_s2",
          "hardware": "NVIDIA A100-SXM4-80GB",
          "operator": "rmsnorm"
        },
        {
          "config_id": "bs128_w4_s1",
          "config": {
            "BLOCK_SIZE": 128,
            "num_warps": 4,
            "num_stages": 1
          },
          "tflops": 633.53,
          "ms": 0.0132,
          "correct": true,
          "run_id": "bs128_w4_s1",
          "hardware": "NVIDIA A100-SXM4-80GB",
          "operator": "rmsnorm"
        },
        {
          "config_id": "bs128_w4_s2",
          "config": {
            "BLOCK_SIZE": 128,
            "num_warps": 4,
            "num_stages": 2
          },
          "tflops": 605.22,
          "ms": 0.0139,
          "correct": true,
          "run_id": "bs128_w4_s2",
          "hardware": "NVIDIA A100-SXM4-80GB",
          "operator": "rmsnorm"
        },
        {
          "config_id": "bs128_w8_s1",
          "config": {
            "BLOCK_SIZE": 128,
            "num_warps": 8,
            "num_stages": 1
          },
          "tflops": 625.47,
          "ms": 0.0134,
          "correct": true,
          "run_id": "bs128_w8_s1",
          "hardware": "NVIDIA A100-SXM4-80GB",
          "operator": "rmsnorm"
        },
        {
          "config_id": "bs128_w8_s2",
          "config": {
            "BLOCK_SIZE": 128,
            "num_warps": 8,
            "num_stages": 2
          },
          "tflops": 598.65,
          "ms": 0.014,
          "correct": true,
          "run_id": "bs128_w8_s2",
          "hardware": "NVIDIA A100-SXM4-80GB",
          "operator": "rmsnorm"
        }
      ]
    },
    "rmsnorm:llama_7b:NVIDIA A100-SXM4-80GB": {
      "shape_key": "rmsnorm:llama_7b:NVIDIA A100-SXM4-80GB",
      "shape": {
        "n_rows": 4096,
        "hidden_dim": 4096,
        "bucket": "llama_7b"
      },
      "best_config_id": "bs128_w8_s1",
      "best_tflops": 1375.29,
      "results": [
        {
          "config_id": "bs1024_w4_s1",
          "config": {
            "BLOCK_SIZE": 1024,
            "num_warps": 4,
            "num_stages": 1
          },
          "tflops": 1344.82,
          "ms": 0.0499,
          "correct": true,
          "run_id": "bs1024_w4_s1",
          "hardware": "NVIDIA A100-SXM4-80GB",
          "operator": "rmsnorm"
        },
        {
          "config_id": "bs2048_w8_s1",
          "config": {
            "BLOCK_SIZE": 2048,
            "num_warps": 8,
            "num_stages": 1
          },
          "tflops": 1357.27,
          "ms": 0.0495,
          "correct": true,
          "run_id": "bs2048_w8_s1",
          "hardware": "NVIDIA A100-SXM4-80GB",
          "operator": "rmsnorm"
        },
        {
          "config_id": "bs4096_w16_s1",
          "config": {
            "BLOCK_SIZE": 4096,
            "num_warps": 16,
            "num_stages": 1
          },
          "tflops": 1330.5,
          "ms": 0.0504,
          "correct": true,
          "run_id": "bs4096_w16_s1",
          "hardware": "NVIDIA A100-SXM4-80GB",
          "operator": "rmsnorm"
        },
        {
          "config_id": "bs512_w2_s2",
          "config": {
            "BLOCK_SIZE": 512,
            "num_warps": 2,
            "num_stages": 2
          },
          "tflops": 1316.79,
          "ms": 0.051,
          "correct": true,
          "run_id": "bs512_w2_s2",
          "hardware": "NVIDIA A100-SXM4-80GB",
          "operator": "rmsnorm"
        },
        {
          "config_id": "bs1024_w8_s2",
          "config": {
            "BLOCK_SIZE": 1024,
            "num_warps": 8,
            "num_stages": 2
          },
          "tflops": 1357.61,
          "ms": 0.0494,
          "correct": true,
          "run_id": "bs1024_w8_s2",
          "hardware": "NVIDIA A100-SXM4-80GB",
          "operator": "rmsnorm"
        },
        {
          "config_id": "bs2048_w4_s2",
          "config": {
            "BLOCK_SIZE": 2048,
            "num_warps": 4,
            "num_stages": 2
          },
          "tflops": 1358.29,
          "ms": 0.0494,
          "correct": true,
          "run_id": "bs2048_w4_s2",
          "hardware": "NVIDIA A100-SXM4-80GB",
          "operator": "rmsnorm"
        },
        {
          "config_id": "bs256_w1_s1",
          "config": {
            "BLOCK_SIZE": 256,
            "num_warps": 1,
            "num_stages": 1
          },
          "tflops": 1326.64,
          "ms": 0.0506,
          "correct": true,
          "run_id": "bs256_w1_s1",
          "hardware": "NVIDIA A100-SXM4-80GB",
          "operator": "rmsnorm"
        },
        {
          "config_id": "bs4096_w8_s2",
          "config": {
            "BLOCK_SIZE": 4096,
            "num_warps": 8,
            "num_stages": 2
          },
          "tflops": 1356.68,
          "ms": 0.0495,
          "correct": true,
          "run_id": "bs4096_w8_s2",
          "hardware": "NVIDIA A100-SXM4-80GB",
          "operator": "rmsnorm"
        },
        {
          "config_id": "bs128_w1_s1",
          "config": {
            "BLOCK_SIZE": 128,
            "num_warps": 1,
            "num_stages": 1
          },
          "tflops": 1325.01,
          "ms": 0.0507,
          "correct": true,
          "run_id": "bs128_w1_s1",
          "hardware": "NVIDIA A100-SXM4-80GB",
          "operator": "rmsnorm"
        },
        {
          "config_id": "bs128_w1_s2",
          "config": {
            "BLOCK_SIZE": 128,
            "num_warps": 1,
            "num_stages": 2
          },
          "tflops": 1308.92,
          "ms": 0.0513,
          "correct": true,
          "run_id": "bs128_w1_s2",
          "hardware": "NVIDIA A100-SXM4-80GB",
          "operator": "rmsnorm"
        },
        {
          "config_id": "bs128_w2_s1",
          "config": {
            "BLOCK_SIZE": 128,
            "num_warps": 2,
            "num_stages": 1
          },
          "tflops": 1318.62,
          "ms": 0.0509,
          "correct": true,
          "run_id": "bs128_w2_s1",
          "hardware": "NVIDIA A100-SXM4-80GB",
          "operator": "rmsnorm"
        },
        {
          "config_id": "bs128_w2_s2",
          "config": {
            "BLOCK_SIZE": 128,
            "num_warps": 2,
            "num_stages": 2
          },
          "tflops": 1331.51,
          "ms": 0.0504,
          "correct": true,
          "run_id": "bs128_w2_s2",
          "hardware": "NVIDIA A100-SXM4-80GB",
          "operator": "rmsnorm"
        },
        {
          "config_id": "bs128_w4_s1",
          "config": {
            "BLOCK_SIZE": 128,
            "num_warps": 4,
            "num_stages": 1
          },
          "tflops": 1358.93,
          "ms": 0.0494,
          "correct": true,
          "run_id": "bs128_w4_s1",
          "hardware": "NVIDIA A100-SXM4-80GB",
          "operator": "rmsnorm"
        },
        {
          "config_id": "bs128_w4_s2",
          "config": {
            "BLOCK_SIZE": 128,
            "num_warps": 4,
            "num_stages": 2
          },
          "tflops": 1357.35,
          "ms": 0.0494,
          "correct": true,
          "run_id": "bs128_w4_s2",
          "hardware": "NVIDIA A100-SXM4-80GB",
          "operator": "rmsnorm"
        },
        {
          "config_id": "bs128_w8_s1",
          "config": {
            "BLOCK_SIZE": 128,
            "num_warps": 8,
            "num_stages": 1
          },
          "tflops": 1375.29,
          "ms": 0.0488,
          "correct": true,
          "run_id": "bs128_w8_s1",
          "hardware": "NVIDIA A100-SXM4-80GB",
          "operator": "rmsnorm"
        },
        {
          "config_id": "bs128_w8_s2",
          "config": {
            "BLOCK_SIZE": 128,
            "num_warps": 8,
            "num_stages": 2
          },
          "tflops": 1373.66,
          "ms": 0.0489,
          "correct": true,
          "run_id": "bs128_w8_s2",
          "hardware": "NVIDIA A100-SXM4-80GB",
          "operator": "rmsnorm"
        }
      ]
    },
    "rmsnorm:llama_13b:NVIDIA A100-SXM4-80GB": {
      "shape_key": "rmsnorm:llama_13b:NVIDIA A100-SXM4-80GB",
      "shape": {
        "n_rows": 4096,
        "hidden_dim": 5120,
        "bucket": "llama_13b"
      },
      "best_config_id": "bs128_w8_s1",
      "best_tflops": 1409.04,
      "results": [
        {
          "config_id": "bs1024_w4_s1",
          "config": {
            "BLOCK_SIZE": 1024,
            "num_warps": 4,
            "num_stages": 1
          },
          "tflops": 1372.07,
          "ms": 0.0611,
          "correct": true,
          "run_id": "bs1024_w4_s1",
          "hardware": "NVIDIA A100-SXM4-80GB",
          "operator": "rmsnorm"
        },
        {
          "config_id": "bs2048_w8_s1",
          "config": {
            "BLOCK_SIZE": 2048,
            "num_warps": 8,
            "num_stages": 1
          },
          "tflops": 1394.8,
          "ms": 0.0601,
          "correct": true,
          "run_id": "bs2048_w8_s1",
          "hardware": "NVIDIA A100-SXM4-80GB",
          "operator": "rmsnorm"
        },
        {
          "config_id": "bs4096_w16_s1",
          "config": {
            "BLOCK_SIZE": 4096,
            "num_warps": 16,
            "num_stages": 1
          },
          "tflops": 1405.92,
          "ms": 0.0597,
          "correct": true,
          "run_id": "bs4096_w16_s1",
          "hardware": "NVIDIA A100-SXM4-80GB",
          "operator": "rmsnorm"
        },
        {
          "config_id": "bs512_w2_s2",
          "config": {
            "BLOCK_SIZE": 512,
            "num_warps": 2,
            "num_stages": 2
          },
          "tflops": 1378.05,
          "ms": 0.0609,
          "correct": true,
          "run_id": "bs512_w2_s2",
          "hardware": "NVIDIA A100-SXM4-80GB",
          "operator": "rmsnorm"
        },
        {
          "config_id": "bs1024_w8_s2",
          "config": {
            "BLOCK_SIZE": 1024,
            "num_warps": 8,
            "num_stages": 2
          },
          "tflops": 1395.86,
          "ms": 0.0601,
          "correct": true,
          "run_id": "bs1024_w8_s2",
          "hardware": "NVIDIA A100-SXM4-80GB",
          "operator": "rmsnorm"
        },
        {
          "config_id": "bs2048_w4_s2",
          "config": {
            "BLOCK_SIZE": 2048,
            "num_warps": 4,
            "num_stages": 2
          },
          "tflops": 1389.36,
          "ms": 0.0604,
          "correct": true,
          "run_id": "bs2048_w4_s2",
          "hardware": "NVIDIA A100-SXM4-80GB",
          "operator": "rmsnorm"
        },
        {
          "config_id": "bs256_w1_s1",
          "config": {
            "BLOCK_SIZE": 256,
            "num_warps": 1,
            "num_stages": 1
          },
          "tflops": 969.52,
          "ms": 0.0865,
          "correct": true,
          "run_id": "bs256_w1_s1",
          "hardware": "NVIDIA A100-SXM4-80GB",
          "operator": "rmsnorm"
        },
        {
          "config_id": "bs4096_w8_s2",
          "config": {
            "BLOCK_SIZE": 4096,
            "num_warps": 8,
            "num_stages": 2
          },
          "tflops": 1392.94,
          "ms": 0.0602,
          "correct": true,
          "run_id": "bs4096_w8_s2",
          "hardware": "NVIDIA A100-SXM4-80GB",
          "operator": "rmsnorm"
        },
        {
          "config_id": "bs128_w1_s1",
          "config": {
            "BLOCK_SIZE": 128,
            "num_warps": 1,
            "num_stages": 1
          },
          "tflops": 969.57,
          "ms": 0.0865,
          "correct": true,
          "run_id": "bs128_w1_s1",
          "hardware": "NVIDIA A100-SXM4-80GB",
          "operator": "rmsnorm"
        },
        {
          "config_id": "bs128_w1_s2",
          "config": {
            "BLOCK_SIZE": 128,
            "num_warps": 1,
            "num_stages": 2
          },
          "tflops": 974.58,
          "ms": 0.0861,
          "correct": true,
          "run_id": "bs128_w1_s2",
          "hardware": "NVIDIA A100-SXM4-80GB",
          "operator": "rmsnorm"
        },
        {
          "config_id": "bs128_w2_s1",
          "config": {
            "BLOCK_SIZE": 128,
            "num_warps": 2,
            "num_stages": 1
          },
          "tflops": 1377.51,
          "ms": 0.0609,
          "correct": true,
          "run_id": "bs128_w2_s1",
          "hardware": "NVIDIA A100-SXM4-80GB",
          "operator": "rmsnorm"
        },
        {
          "config_id": "bs128_w2_s2",
          "config": {
            "BLOCK_SIZE": 128,
            "num_warps": 2,
            "num_stages": 2
          },
          "tflops": 1377.21,
          "ms": 0.0609,
          "correct": true,
          "run_id": "bs128_w2_s2",
          "hardware": "NVIDIA A100-SXM4-80GB",
          "operator": "rmsnorm"
        },
        {
          "config_id": "bs128_w4_s1",
          "config": {
            "BLOCK_SIZE": 128,
            "num_warps": 4,
            "num_stages": 1
          },
          "tflops": 1374.87,
          "ms": 0.061,
          "correct": true,
          "run_id": "bs128_w4_s1",
          "hardware": "NVIDIA A100-SXM4-80GB",
          "operator": "rmsnorm"
        },
        {
          "config_id": "bs128_w4_s2",
          "config": {
            "BLOCK_SIZE": 128,
            "num_warps": 4,
            "num_stages": 2
          },
          "tflops": 1372.44,
          "ms": 0.0611,
          "correct": true,
          "run_id": "bs128_w4_s2",
          "hardware": "NVIDIA A100-SXM4-80GB",
          "operator": "rmsnorm"
        },
        {
          "config_id": "bs128_w8_s1",
          "config": {
            "BLOCK_SIZE": 128,
            "num_warps": 8,
            "num_stages": 1
          },
          "tflops": 1409.04,
          "ms": 0.0595,
          "correct": true,
          "run_id": "bs128_w8_s1",
          "hardware": "NVIDIA A100-SXM4-80GB",
          "operator": "rmsnorm"
        },
        {
          "config_id": "bs128_w8_s2",
          "config": {
            "BLOCK_SIZE": 128,
            "num_warps": 8,
            "num_stages": 2
          },
          "tflops": 1393.05,
          "ms": 0.0602,
          "correct": true,
          "run_id": "bs128_w8_s2",
          "hardware": "NVIDIA A100-SXM4-80GB",
          "operator": "rmsnorm"
        }
      ]
    },
    "softmax:small:NVIDIA A100-SXM4-80GB": {
      "shape_key": "softmax:small:NVIDIA A100-SXM4-80GB",
      "shape": {
        "n_rows": 1024,
        "n_cols": 512,
        "bucket": "small"
      },
      "best_config_id": "bs128_w1_s1",
      "best_tflops": 236.95,
      "results": [
        {
          "config_id": "bs1024_w4_s1",
          "config": {
            "BLOCK_SIZE": 1024,
            "num_warps": 4,
            "num_stages": 1
          },
          "tflops": 175.72,
          "ms": 0.0119,
          "correct": true,
          "run_id": "bs1024_w4_s1",
          "hardware": "NVIDIA A100-SXM4-80GB",
          "operator": "softmax"
        },
        {
          "config_id": "bs2048_w8_s1",
          "config": {
            "BLOCK_SIZE": 2048,
            "num_warps": 8,
            "num_stages": 1
          },
          "tflops": 184.84,
          "ms": 0.0113,
          "correct": true,
          "run_id": "bs2048_w8_s1",
          "hardware": "NVIDIA A100-SXM4-80GB",
          "operator": "softmax"
        },
        {
          "config_id": "bs4096_w8_s1",
          "config": {
            "BLOCK_SIZE": 4096,
            "num_warps": 8,
            "num_stages": 1
          },
          "tflops": 163.12,
          "ms": 0.0129,
          "correct": true,
          "run_id": "bs4096_w8_s1",
          "hardware": "NVIDIA A100-SXM4-80GB",
          "operator": "softmax"
        },
        {
          "config_id": "bs4096_w16_s1",
          "config": {
            "BLOCK_SIZE": 4096,
            "num_warps": 16,
            "num_stages": 1
          },
          "tflops": 145.57,
          "ms": 0.0144,
          "correct": true,
          "run_id": "bs4096_w16_s1",
          "hardware": "NVIDIA A100-SXM4-80GB",
          "operator": "softmax"
        },
        {
          "config_id": "bs8192_w16_s1",
          "config": {
            "BLOCK_SIZE": 8192,
            "num_warps": 16,
            "num_stages": 1
          },
          "tflops": 119.94,
          "ms": 0.0175,
          "correct": true,
          "run_id": "bs8192_w16_s1",
          "hardware": "NVIDIA A100-SXM4-80GB",
          "operator": "softmax"
        },
        {
          "config_id": "bs512_w2_s2",
          "config": {
            "BLOCK_SIZE": 512,
            "num_warps": 2,
            "num_stages": 2
          },
          "tflops": 234.5,
          "ms": 0.0089,
          "correct": true,
          "run_id": "bs512_w2_s2",
          "hardware": "NVIDIA A100-SXM4-80GB",
          "operator": "softmax"
        },
        {
          "config_id": "bs1024_w8_s2",
          "config": {
            "BLOCK_SIZE": 1024,
            "num_warps": 8,
            "num_stages": 2
          },
          "tflops": 192.62,
          "ms": 0.0109,
          "correct": true,
          "run_id": "bs1024_w8_s2",
          "hardware": "NVIDIA A100-SXM4-80GB",
          "operator": "softmax"
        },
        {
          "config_id": "bs128_w1_s1",
          "config": {
            "BLOCK_SIZE": 128,
            "num_warps": 1,
            "num_stages": 1
          },
          "tflops": 236.95,
          "ms": 0.0089,
          "correct": true,
          "run_id": "bs128_w1_s1",
          "hardware": "NVIDIA A100-SXM4-80GB",
          "operator": "softmax"
        },
        {
          "config_id": "bs128_w1_s2",
          "config": {
            "BLOCK_SIZE": 128,
            "num_warps": 1,
            "num_stages": 2
          },
          "tflops": 219.29,
          "ms": 0.0096,
          "correct": true,
          "run_id": "bs128_w1_s2",
          "hardware": "NVIDIA A100-SXM4-80GB",
          "operator": "softmax"
        },
        {
          "config_id": "bs128_w2_s1",
          "config": {
            "BLOCK_SIZE": 128,
            "num_warps": 2,
            "num_stages": 1
          },
          "tflops": 233.38,
          "ms": 0.009,
          "correct": true,
          "run_id": "bs128_w2_s1",
          "hardware": "NVIDIA A100-SXM4-80GB",
          "operator": "softmax"
        },
        {
          "config_id": "bs128_w2_s2",
          "config": {
            "BLOCK_SIZE": 128,
            "num_warps": 2,
            "num_stages": 2
          },
          "tflops": 217.69,
          "ms": 0.0096,
          "correct": true,
          "run_id": "bs128_w2_s2",
          "hardware": "NVIDIA A100-SXM4-80GB",
          "operator": "softmax"
        },
        {
          "config_id": "bs128_w4_s1",
          "config": {
            "BLOCK_SIZE": 128,
            "num_warps": 4,
            "num_stages": 1
          },
          "tflops": 216.34,
          "ms": 0.0097,
          "correct": true,
          "run_id": "bs128_w4_s1",
          "hardware": "NVIDIA A100-SXM4-80GB",
          "operator": "softmax"
        },
        {
          "config_id": "bs128_w4_s2",
          "config": {
            "BLOCK_SIZE": 128,
            "num_warps": 4,
            "num_stages": 2
          },
          "tflops": 216.75,
          "ms": 0.0097,
          "correct": true,
          "run_id": "bs128_w4_s2",
          "hardware": "NVIDIA A100-SXM4-80GB",
          "operator": "softmax"
        },
        {
          "config_id": "bs128_w8_s1",
          "config": {
            "BLOCK_SIZE": 128,
            "num_warps": 8,
            "num_stages": 1
          },
          "tflops": 209.51,
          "ms": 0.01,
          "correct": true,
          "run_id": "bs128_w8_s1",
          "hardware": "NVIDIA A100-SXM4-80GB",
          "operator": "softmax"
        },
        {
          "config_id": "bs128_w8_s2",
          "config": {
            "BLOCK_SIZE": 128,
            "num_warps": 8,
            "num_stages": 2
          },
          "tflops": 210.4,
          "ms": 0.01,
          "correct": true,
          "run_id": "bs128_w8_s2",
          "hardware": "NVIDIA A100-SXM4-80GB",
          "operator": "softmax"
        },
        {
          "config_id": "bs128_w16_s1",
          "config": {
            "BLOCK_SIZE": 128,
            "num_warps": 16,
            "num_stages": 1
          },
          "tflops": 165.46,
          "ms": 0.0127,
          "correct": true,
          "run_id": "bs128_w16_s1",
          "hardware": "NVIDIA A100-SXM4-80GB",
          "operator": "softmax"
        }
      ]
    },
    "softmax:medium:NVIDIA A100-SXM4-80GB": {
      "shape_key": "softmax:medium:NVIDIA A100-SXM4-80GB",
      "shape": {
        "n_rows": 2048,
        "n_cols": 1024,
        "bucket": "medium"
      },
      "best_config_id": "bs128_w1_s2",
      "best_tflops": 656.01,
      "results": [
        {
          "config_id": "bs1024_w4_s1",
          "config": {
            "BLOCK_SIZE": 1024,
            "num_warps": 4,
            "num_stages": 1
          },
          "tflops": 575.29,
          "ms": 0.0146,
          "correct": true,
          "run_id": "bs1024_w4_s1",
          "hardware": "NVIDIA A100-SXM4-80GB",
          "operator": "softmax"
        },
        {
          "config_id": "bs2048_w8_s1",
          "config": {
            "BLOCK_SIZE": 2048,
            "num_warps": 8,
            "num_stages": 1
          },
          "tflops": 546.91,
          "ms": 0.0153,
          "correct": true,
          "run_id": "bs2048_w8_s1",
          "hardware": "NVIDIA A100-SXM4-80GB",
          "operator": "softmax"
        },
        {
          "config_id": "bs4096_w8_s1",
          "config": {
            "BLOCK_SIZE": 4096,
            "num_warps": 8,
            "num_stages": 1
          },
          "tflops": 458.1,
          "ms": 0.0183,
          "correct": true,
          "run_id": "bs4096_w8_s1",
          "hardware": "NVIDIA A100-SXM4-80GB",
          "operator": "softmax"
        },
        {
          "config_id": "bs4096_w16_s1",
          "config": {
            "BLOCK_SIZE": 4096,
            "num_warps": 16,
            "num_stages": 1
          },
          "tflops": 403.32,
          "ms": 0.0208,
          "correct": true,
          "run_id": "bs4096_w16_s1",
          "hardware": "NVIDIA A100-SXM4-80GB",
          "operator": "softmax"
        },
        {
          "config_id": "bs8192_w16_s1",
          "config": {
            "BLOCK_SIZE": 8192,
            "num_warps": 16,
            "num_stages": 1
          },
          "tflops": 294.1,
          "ms": 0.0285,
          "correct": true,
          "run_id": "bs8192_w16_s1",
          "hardware": "NVIDIA A100-SXM4-80GB",
          "operator": "softmax"
        },
        {
          "config_id": "bs512_w2_s2",
          "config": {
            "BLOCK_SIZE": 512,
            "num_warps": 2,
            "num_stages": 2
          },
          "tflops": 628.97,
          "ms": 0.0133,
          "correct": true,
          "run_id": "bs512_w2_s2",
          "hardware": "NVIDIA A100-SXM4-80GB",
          "operator": "softmax"
        },
        {
          "config_id": "bs1024_w8_s2",
          "config": {
            "BLOCK_SIZE": 1024,
            "num_warps": 8,
            "num_stages": 2
          },
          "tflops": 569.7,
          "ms": 0.0147,
          "correct": true,
          "run_id": "bs1024_w8_s2",
          "hardware": "NVIDIA A100-SXM4-80GB",
          "operator": "softmax"
        },
        {
          "config_id": "bs128_w1_s1",
          "config": {
            "BLOCK_SIZE": 128,
            "num_warps": 1,
            "num_stages": 1
          },
          "tflops": 625.7,
          "ms": 0.0134,
          "correct": true,
          "run_id": "bs128_w1_s1",
          "hardware": "NVIDIA A100-SXM4-80GB",
          "operator": "softmax"
        },
        {
          "config_id": "bs128_w1_s2",
          "config": {
            "BLOCK_SIZE": 128,
            "num_warps": 1,
            "num_stages": 2
          },
          "tflops": 656.01,
          "ms": 0.0128,
          "correct": true,
          "run_id": "bs128_w1_s2",
          "hardware": "NVIDIA A100-SXM4-80GB",
          "operator": "softmax"
        },
        {
          "config_id": "bs128_w2_s1",
          "config": {
            "BLOCK_SIZE": 128,
            "num_warps": 2,
            "num_stages": 1
          },
          "tflops": 619.25,
          "ms": 0.0135,
          "correct": true,
          "run_id": "bs128_w2_s1",
          "hardware": "NVIDIA A100-SXM4-80GB",
          "operator": "softmax"
        },
        {
          "config_id": "bs128_w2_s2",
          "config": {
            "BLOCK_SIZE": 128,
            "num_warps": 2,
            "num_stages": 2
          },
          "tflops": 649.26,
          "ms": 0.0129,
          "correct": true,
          "run_id": "bs128_w2_s2",
          "hardware": "NVIDIA A100-SXM4-80GB",
          "operator": "softmax"
        },
        {
          "config_id": "bs128_w4_s1",
          "config": {
            "BLOCK_SIZE": 128,
            "num_warps": 4,
            "num_stages": 1
          },
          "tflops": 655.87,
          "ms": 0.0128,
          "correct": true,
          "run_id": "bs128_w4_s1",
          "hardware": "NVIDIA A100-SXM4-80GB",
          "operator": "softmax"
        },
        {
          "config_id": "bs128_w4_s2",
          "config": {
            "BLOCK_SIZE": 128,
            "num_warps": 4,
            "num_stages": 2
          },
          "tflops": 631.66,
          "ms": 0.0133,
          "correct": true,
          "run_id": "bs128_w4_s2",
          "hardware": "NVIDIA A100-SXM4-80GB",
          "operator": "softmax"
        },
        {
          "config_id": "bs128_w8_s1",
          "config": {
            "BLOCK_SIZE": 128,
            "num_warps": 8,
            "num_stages": 1
          },
          "tflops": 624.35,
          "ms": 0.0134,
          "correct": true,
          "run_id": "bs128_w8_s1",
          "hardware": "NVIDIA A100-SXM4-80GB",
          "operator": "softmax"
        },
        {
          "config_id": "bs128_w8_s2",
          "config": {
            "BLOCK_SIZE": 128,
            "num_warps": 8,
            "num_stages": 2
          },
          "tflops": 593.08,
          "ms": 0.0141,
          "correct": true,
          "run_id": "bs128_w8_s2",
          "hardware": "NVIDIA A100-SXM4-80GB",
          "operator": "softmax"
        },
        {
          "config_id": "bs128_w16_s1",
          "config": {
            "BLOCK_SIZE": 128,
            "num_warps": 16,
            "num_stages": 1
          },
          "tflops": 464.73,
          "ms": 0.0181,
          "correct": true,
          "run_id": "bs128_w16_s1",
          "hardware": "NVIDIA A100-SXM4-80GB",
          "operator": "softmax"
        }
      ]
    },
    "softmax:attn_long:NVIDIA A100-SXM4-80GB": {
      "shape_key": "softmax:attn_long:NVIDIA A100-SXM4-80GB",
      "shape": {
        "n_rows": 4096,
        "n_cols": 4096,
        "bucket": "attn_long"
      },
      "best_config_id": "bs4096_w16_s1",
      "best_tflops": 1543.86,
      "results": [
        {
          "config_id": "bs1024_w4_s1",
          "config": {
            "BLOCK_SIZE": 1024,
            "num_warps": 4,
            "num_stages": 1
          },
          "tflops": 1388.44,
          "ms": 0.0483,
          "correct": true,
          "run_id": "bs1024_w4_s1",
          "hardware": "NVIDIA A100-SXM4-80GB",
          "operator": "softmax"
        },
        {
          "config_id": "bs1024_w4_s1",
          "config": {
            "BLOCK_SIZE": 1024,
            "num_warps": 4,
            "num_stages": 1
          },
          "tflops": 1473.63,
          "ms": 0.0911,
          "correct": true,
          "run_id": "bs1024_w4_s1",
          "hardware": "NVIDIA A100-SXM4-80GB",
          "operator": "softmax"
        },
        {
          "config_id": "bs2048_w8_s1",
          "config": {
            "BLOCK_SIZE": 2048,
            "num_warps": 8,
            "num_stages": 1
          },
          "tflops": 1386.17,
          "ms": 0.0484,
          "correct": true,
          "run_id": "bs2048_w8_s1",
          "hardware": "NVIDIA A100-SXM4-80GB",
          "operator": "softmax"
        },
        {
          "config_id": "bs2048_w8_s1",
          "config": {
            "BLOCK_SIZE": 2048,
            "num_warps": 8,
            "num_stages": 1
          },
          "tflops": 1541.44,
          "ms": 0.0871,
          "correct": true,
          "run_id": "bs2048_w8_s1",
          "hardware": "NVIDIA A100-SXM4-80GB",
          "operator": "softmax"
        },
        {
          "config_id": "bs4096_w8_s1",
          "config": {
            "BLOCK_SIZE": 4096,
            "num_warps": 8,
            "num_stages": 1
          },
          "tflops": 1369.52,
          "ms": 0.049,
          "correct": true,
          "run_id": "bs4096_w8_s1",
          "hardware": "NVIDIA A100-SXM4-80GB",
          "operator": "softmax"
        },
        {
          "config_id": "bs4096_w8_s1",
          "config": {
            "BLOCK_SIZE": 4096,
            "num_warps": 8,
            "num_stages": 1
          },
          "tflops": 1529.01,
          "ms": 0.0878,
          "correct": true,
          "run_id": "bs4096_w8_s1",
          "hardware": "NVIDIA A100-SXM4-80GB",
          "operator": "softmax"
        },
        {
          "config_id": "bs4096_w16_s1",
          "config": {
            "BLOCK_SIZE": 4096,
            "num_warps": 16,
            "num_stages": 1
          },
          "tflops": 1325.29,
          "ms": 0.0506,
          "correct": true,
          "run_id": "bs4096_w16_s1",
          "hardware": "NVIDIA A100-SXM4-80GB",
          "operator": "softmax"
        },
        {
          "config_id": "bs4096_w16_s1",
          "config": {
            "BLOCK_SIZE": 4096,
            "num_warps": 16,
            "num_stages": 1
          },
          "tflops": 1543.86,
          "ms": 0.0869,
          "correct": true,
          "run_id": "bs4096_w16_s1",
          "hardware": "NVIDIA A100-SXM4-80GB",
          "operator": "softmax"
        },
        {
          "config_id": "bs8192_w16_s1",
          "config": {
            "BLOCK_SIZE": 8192,
            "num_warps": 16,
            "num_stages": 1
          },
          "tflops": 1246.83,
          "ms": 0.0538,
          "correct": true,
          "run_id": "bs8192_w16_s1",
          "hardware": "NVIDIA A100-SXM4-80GB",
          "operator": "softmax"
        },
        {
          "config_id": "bs8192_w16_s1",
          "config": {
            "BLOCK_SIZE": 8192,
            "num_warps": 16,
            "num_stages": 1
          },
          "tflops": 1543.37,
          "ms": 0.087,
          "correct": true,
          "run_id": "bs8192_w16_s1",
          "hardware": "NVIDIA A100-SXM4-80GB",
          "operator": "softmax"
        },
        {
          "config_id": "bs512_w2_s2",
          "config": {
            "BLOCK_SIZE": 512,
            "num_warps": 2,
            "num_stages": 2
          },
          "tflops": 1310.26,
          "ms": 0.0512,
          "correct": true,
          "run_id": "bs512_w2_s2",
          "hardware": "NVIDIA A100-SXM4-80GB",
          "operator": "softmax"
        },
        {
          "config_id": "bs512_w2_s2",
          "config": {
            "BLOCK_SIZE": 512,
            "num_warps": 2,
            "num_stages": 2
          },
          "tflops": 1410.71,
          "ms": 0.0951,
          "correct": true,
          "run_id": "bs512_w2_s2",
          "hardware": "NVIDIA A100-SXM4-80GB",
          "operator": "softmax"
        },
        {
          "config_id": "bs1024_w8_s2",
          "config": {
            "BLOCK_SIZE": 1024,
            "num_warps": 8,
            "num_stages": 2
          },
          "tflops": 1367.07,
          "ms": 0.0491,
          "correct": true,
          "run_id": "bs1024_w8_s2",
          "hardware": "NVIDIA A100-SXM4-80GB",
          "operator": "softmax"
        },
        {
          "config_id": "bs1024_w8_s2",
          "config": {
            "BLOCK_SIZE": 1024,
            "num_warps": 8,
            "num_stages": 2
          },
          "tflops": 1527.99,
          "ms": 0.0878,
          "correct": true,
          "run_id": "bs1024_w8_s2",
          "hardware": "NVIDIA A100-SXM4-80GB",
          "operator": "softmax"
        },
        {
          "config_id": "bs128_w1_s1",
          "config": {
            "BLOCK_SIZE": 128,
            "num_warps": 1,
            "num_stages": 1
          },
          "tflops": 1209.54,
          "ms": 0.0555,
          "correct": true,
          "run_id": "bs128_w1_s1",
          "hardware": "NVIDIA A100-SXM4-80GB",
          "operator": "softmax"
        },
        {
          "config_id": "bs128_w1_s1",
          "config": {
            "BLOCK_SIZE": 128,
            "num_warps": 1,
            "num_stages": 1
          },
          "tflops": 879.19,
          "ms": 0.1527,
          "correct": true,
          "run_id": "bs128_w1_s1",
          "hardware": "NVIDIA A100-SXM4-80GB",
          "operator": "softmax"
        },
        {
          "config_id": "bs128_w1_s2",
          "config": {
            "BLOCK_SIZE": 128,
            "num_warps": 1,
            "num_stages": 2
          },
          "tflops": 1212.08,
          "ms": 0.0554,
          "correct": true,
          "run_id": "bs128_w1_s2",
          "hardware": "NVIDIA A100-SXM4-80GB",
          "operator": "softmax"
        },
        {
          "config_id": "bs128_w1_s2",
          "config": {
            "BLOCK_SIZE": 128,
            "num_warps": 1,
            "num_stages": 2
          },
          "tflops": 875.83,
          "ms": 0.1532,
          "correct": true,
          "run_id": "bs128_w1_s2",
          "hardware": "NVIDIA A100-SXM4-80GB",
          "operator": "softmax"
        },
        {
          "config_id": "bs128_w2_s1",
          "config": {
            "BLOCK_SIZE": 128,
            "num_warps": 2,
            "num_stages": 1
          },
          "tflops": 1321.91,
          "ms": 0.0508,
          "correct": true,
          "run_id": "bs128_w2_s1",
          "hardware": "NVIDIA A100-SXM4-80GB",
          "operator": "softmax"
        },
        {
          "config_id": "bs128_w2_s1",
          "config": {
            "BLOCK_SIZE": 128,
            "num_warps": 2,
            "num_stages": 1
          },
          "tflops": 1414.87,
          "ms": 0.0949,
          "correct": true,
          "run_id": "bs128_w2_s1",
          "hardware": "NVIDIA A100-SXM4-80GB",
          "operator": "softmax"
        },
        {
          "config_id": "bs128_w2_s2",
          "config": {
            "BLOCK_SIZE": 128,
            "num_warps": 2,
            "num_stages": 2
          },
          "tflops": 1307.25,
          "ms": 0.0513,
          "correct": true,
          "run_id": "bs128_w2_s2",
          "hardware": "NVIDIA A100-SXM4-80GB",
          "operator": "softmax"
        },
        {
          "config_id": "bs128_w2_s2",
          "config": {
            "BLOCK_SIZE": 128,
            "num_warps": 2,
            "num_stages": 2
          },
          "tflops": 1410.96,
          "ms": 0.0951,
          "correct": true,
          "run_id": "bs128_w2_s2",
          "hardware": "NVIDIA A100-SXM4-80GB",
          "operator": "softmax"
        },
        {
          "config_id": "bs128_w4_s1",
          "config": {
            "BLOCK_SIZE": 128,
            "num_warps": 4,
            "num_stages": 1
          },
          "tflops": 1385.46,
          "ms": 0.0484,
          "correct": true,
          "run_id": "bs128_w4_s1",
          "hardware": "NVIDIA A100-SXM4-80GB",
          "operator": "softmax"
        },
        {
          "config_id": "bs128_w4_s1",
          "config": {
            "BLOCK_SIZE": 128,
            "num_warps": 4,
            "num_stages": 1
          },
          "tflops": 1474.96,
          "ms": 0.091,
          "correct": true,
          "run_id": "bs128_w4_s1",
          "hardware": "NVIDIA A100-SXM4-80GB",
          "operator": "softmax"
        },
        {
          "config_id": "bs128_w4_s2",
          "config": {
            "BLOCK_SIZE": 128,
            "num_warps": 4,
            "num_stages": 2
          },
          "tflops": 1386.87,
          "ms": 0.0484,
          "correct": true,
          "run_id": "bs128_w4_s2",
          "hardware": "NVIDIA A100-SXM4-80GB",
          "operator": "softmax"
        },
        {
          "config_id": "bs128_w4_s2",
          "config": {
            "BLOCK_SIZE": 128,
            "num_warps": 4,
            "num_stages": 2
          },
          "tflops": 1474.93,
          "ms": 0.091,
          "correct": true,
          "run_id": "bs128_w4_s2",
          "hardware": "NVIDIA A100-SXM4-80GB",
          "operator": "softmax"
        },
        {
          "config_id": "bs128_w8_s1",
          "config": {
            "BLOCK_SIZE": 128,
            "num_warps": 8,
            "num_stages": 1
          },
          "tflops": 1381.92,
          "ms": 0.0486,
          "correct": true,
          "run_id": "bs128_w8_s1",
          "hardware": "NVIDIA A100-SXM4-80GB",
          "operator": "softmax"
        },
        {
          "config_id": "bs128_w8_s1",
          "config": {
            "BLOCK_SIZE": 128,
            "num_warps": 8,
            "num_stages": 1
          },
          "tflops": 1539.83,
          "ms": 0.0872,
          "correct": true,
          "run_id": "bs128_w8_s1",
          "hardware": "NVIDIA A100-SXM4-80GB",
          "operator": "softmax"
        },
        {
          "config_id": "bs128_w8_s2",
          "config": {
            "BLOCK_SIZE": 128,
            "num_warps": 8,
            "num_stages": 2
          },
          "tflops": 1381.08,
          "ms": 0.0486,
          "correct": true,
          "run_id": "bs128_w8_s2",
          "hardware": "NVIDIA A100-SXM4-80GB",
          "operator": "softmax"
        },
        {
          "config_id": "bs128_w8_s2",
          "config": {
            "BLOCK_SIZE": 128,
            "num_warps": 8,
            "num_stages": 2
          },
          "tflops": 1538.71,
          "ms": 0.0872,
          "correct": true,
          "run_id": "bs128_w8_s2",
          "hardware": "NVIDIA A100-SXM4-80GB",
          "operator": "softmax"
        },
        {
          "config_id": "bs128_w16_s1",
          "config": {
            "BLOCK_SIZE": 128,
            "num_warps": 16,
            "num_stages": 1
          },
          "tflops": 1325.97,
          "ms": 0.0506,
          "correct": true,
          "run_id": "bs128_w16_s1",
          "hardware": "NVIDIA A100-SXM4-80GB",
          "operator": "softmax"
        },
        {
          "config_id": "bs128_w16_s1",
          "config": {
            "BLOCK_SIZE": 128,
            "num_warps": 16,
            "num_stages": 1
          },
          "tflops": 1530.78,
          "ms": 0.0877,
          "correct": true,
          "run_id": "bs128_w16_s1",
          "hardware": "NVIDIA A100-SXM4-80GB",
          "operator": "softmax"
        }
      ]
    },
    "softmax:attn_short:NVIDIA A100-SXM4-80GB": {
      "shape_key": "softmax:attn_short:NVIDIA A100-SXM4-80GB",
      "shape": {
        "n_rows": 8192,
        "n_cols": 1024,
        "bucket": "attn_short"
      },
      "best_config_id": "bs512_w2_s2",
      "best_tflops": 1168.86,
      "results": [
        {
          "config_id": "bs1024_w4_s1",
          "config": {
            "BLOCK_SIZE": 1024,
            "num_warps": 4,
            "num_stages": 1
          },
          "tflops": 1119.47,
          "ms": 0.03,
          "correct": true,
          "run_id": "bs1024_w4_s1",
          "hardware": "NVIDIA A100-SXM4-80GB",
          "operator": "softmax"
        },
        {
          "config_id": "bs2048_w8_s1",
          "config": {
            "BLOCK_SIZE": 2048,
            "num_warps": 8,
            "num_stages": 1
          },
          "tflops": 948.6,
          "ms": 0.0354,
          "correct": true,
          "run_id": "bs2048_w8_s1",
          "hardware": "NVIDIA A100-SXM4-80GB",
          "operator": "softmax"
        },
        {
          "config_id": "bs4096_w8_s1",
          "config": {
            "BLOCK_SIZE": 4096,
            "num_warps": 8,
            "num_stages": 1
          },
          "tflops": 715.01,
          "ms": 0.0469,
          "correct": true,
          "run_id": "bs4096_w8_s1",
          "hardware": "NVIDIA A100-SXM4-80GB",
          "operator": "softmax"
        },
        {
          "config_id": "bs4096_w16_s1",
          "config": {
            "BLOCK_SIZE": 4096,
            "num_warps": 16,
            "num_stages": 1
          },
          "tflops": 559.09,
          "ms": 0.06,
          "correct": true,
          "run_id": "bs4096_w16_s1",
          "hardware": "NVIDIA A100-SXM4-80GB",
          "operator": "softmax"
        },
        {
          "config_id": "bs8192_w16_s1",
          "config": {
            "BLOCK_SIZE": 8192,
            "num_warps": 16,
            "num_stages": 1
          },
          "tflops": 376.24,
          "ms": 0.0892,
          "correct": true,
          "run_id": "bs8192_w16_s1",
          "hardware": "NVIDIA A100-SXM4-80GB",
          "operator": "softmax"
        },
        {
          "config_id": "bs512_w2_s2",
          "config": {
            "BLOCK_SIZE": 512,
            "num_warps": 2,
            "num_stages": 2
          },
          "tflops": 1168.86,
          "ms": 0.0287,
          "correct": true,
          "run_id": "bs512_w2_s2",
          "hardware": "NVIDIA A100-SXM4-80GB",
          "operator": "softmax"
        },
        {
          "config_id": "bs1024_w8_s2",
          "config": {
            "BLOCK_SIZE": 1024,
            "num_warps": 8,
            "num_stages": 2
          },
          "tflops": 1093.62,
          "ms": 0.0307,
          "correct": true,
          "run_id": "bs1024_w8_s2",
          "hardware": "NVIDIA A100-SXM4-80GB",
          "operator": "softmax"
        },
        {
          "config_id": "bs128_w1_s1",
          "config": {
            "BLOCK_SIZE": 128,
            "num_warps": 1,
            "num_stages": 1
          },
          "tflops": 1146.02,
          "ms": 0.0293,
          "correct": true,
          "run_id": "bs128_w1_s1",
          "hardware": "NVIDIA A100-SXM4-80GB",
          "operator": "softmax"
        },
        {
          "config_id": "bs128_w1_s2",
          "config": {
            "BLOCK_SIZE": 128,
            "num_warps": 1,
            "num_stages": 2
          },
          "tflops": 1168.71,
          "ms": 0.0287,
          "correct": true,
          "run_id": "bs128_w1_s2",
          "hardware": "NVIDIA A100-SXM4-80GB",
          "operator": "softmax"
        },
        {
          "config_id": "bs128_w2_s1",
          "config": {
            "BLOCK_SIZE": 128,
            "num_warps": 2,
            "num_stages": 1
          },
          "tflops": 1165.75,
          "ms": 0.0288,
          "correct": true,
          "run_id": "bs128_w2_s1",
          "hardware": "NVIDIA A100-SXM4-80GB",
          "operator": "softmax"
        },
        {
          "config_id": "bs128_w2_s2",
          "config": {
            "BLOCK_SIZE": 128,
            "num_warps": 2,
            "num_stages": 2
          },
          "tflops": 1165.09,
          "ms": 0.0288,
          "correct": true,
          "run_id": "bs128_w2_s2",
          "hardware": "NVIDIA A100-SXM4-80GB",
          "operator": "softmax"
        },
        {
          "config_id": "bs128_w4_s1",
          "config": {
            "BLOCK_SIZE": 128,
            "num_warps": 4,
            "num_stages": 1
          },
          "tflops": 1119.36,
          "ms": 0.03,
          "correct": true,
          "run_id": "bs128_w4_s1",
          "hardware": "NVIDIA A100-SXM4-80GB",
          "operator": "softmax"
        },
        {
          "config_id": "bs128_w4_s2",
          "config": {
            "BLOCK_SIZE": 128,
            "num_warps": 4,
            "num_stages": 2
          },
          "tflops": 1114.74,
          "ms": 0.0301,
          "correct": true,
          "run_id": "bs128_w4_s2",
          "hardware": "NVIDIA A100-SXM4-80GB",
          "operator": "softmax"
        },
        {
          "config_id": "bs128_w8_s1",
          "config": {
            "BLOCK_SIZE": 128,
            "num_warps": 8,
            "num_stages": 1
          },
          "tflops": 1096.43,
          "ms": 0.0306,
          "correct": true,
          "run_id": "bs128_w8_s1",
          "hardware": "NVIDIA A100-SXM4-80GB",
          "operator": "softmax"
        },
        {
          "config_id": "bs128_w8_s2",
          "config": {
            "BLOCK_SIZE": 128,
            "num_warps": 8,
            "num_stages": 2
          },
          "tflops": 1074.33,
          "ms": 0.0312,
          "correct": true,
          "run_id": "bs128_w8_s2",
          "hardware": "NVIDIA A100-SXM4-80GB",
          "operator": "softmax"
        },
        {
          "config_id": "bs128_w16_s1",
          "config": {
            "BLOCK_SIZE": 128,
            "num_warps": 16,
            "num_stages": 1
          },
          "tflops": 726.23,
          "ms": 0.0462,
          "correct": true,
          "run_id": "bs128_w16_s1",
          "hardware": "NVIDIA A100-SXM4-80GB",
          "operator": "softmax"
        }
      ]
    },
    "softmax:vocab_small:NVIDIA A100-SXM4-80GB": {
      "shape_key": "softmax:vocab_small:NVIDIA A100-SXM4-80GB",
      "shape": {
        "n_rows": 1024,
        "n_cols": 32000,
        "bucket": "vocab_small"
      },
      "best_config_id": "bs4096_w16_s1",
      "best_tflops": 1373.76,
      "results": [
        {
          "config_id": "bs1024_w4_s1",
          "config": {
            "BLOCK_SIZE": 1024,
            "num_warps": 4,
            "num_stages": 1
          },
          "tflops": 858.75,
          "ms": 0.1526,
          "correct": true,
          "run_id": "bs1024_w4_s1",
          "hardware": "NVIDIA A100-SXM4-80GB",
          "operator": "softmax"
        },
        {
          "config_id": "bs2048_w8_s1",
          "config": {
            "BLOCK_SIZE": 2048,
            "num_warps": 8,
            "num_stages": 1
          },
          "tflops": 1195.61,
          "ms": 0.1096,
          "correct": true,
          "run_id": "bs2048_w8_s1",
          "hardware": "NVIDIA A100-SXM4-80GB",
          "operator": "softmax"
        },
        {
          "config_id": "bs4096_w8_s1",
          "config": {
            "BLOCK_SIZE": 4096,
            "num_warps": 8,
            "num_stages": 1
          },
          "tflops": 1196.07,
          "ms": 0.1096,
          "correct": true,
          "run_id": "bs4096_w8_s1",
          "hardware": "NVIDIA A100-SXM4-80GB",
          "operator": "softmax"
        },
        {
          "config_id": "bs4096_w16_s1",
          "config": {
            "BLOCK_SIZE": 4096,
            "num_warps": 16,
            "num_stages": 1
          },
          "tflops": 1373.76,
          "ms": 0.0954,
          "correct": true,
          "run_id": "bs4096_w16_s1",
          "hardware": "NVIDIA A100-SXM4-80GB",
          "operator": "softmax"
        },
        {
          "config_id": "bs8192_w16_s1",
          "config": {
            "BLOCK_SIZE": 8192,
            "num_warps": 16,
            "num_stages": 1
          },
          "tflops": 1372.85,
          "ms": 0.0955,
          "correct": true,
          "run_id": "bs8192_w16_s1",
          "hardware": "NVIDIA A100-SXM4-80GB",
          "operator": "softmax"
        },
        {
          "config_id": "bs512_w2_s2",
          "config": {
            "BLOCK_SIZE": 512,
            "num_warps": 2,
            "num_stages": 2
          },
          "tflops": 207.08,
          "ms": 0.633,
          "correct": true,
          "run_id": "bs512_w2_s2",
          "hardware": "NVIDIA A100-SXM4-80GB",
          "operator": "softmax"
        },
        {
          "config_id": "bs1024_w8_s2",
          "config": {
            "BLOCK_SIZE": 1024,
            "num_warps": 8,
            "num_stages": 2
          },
          "tflops": 1194.18,
          "ms": 0.1098,
          "correct": true,
          "run_id": "bs1024_w8_s2",
          "hardware": "NVIDIA A100-SXM4-80GB",
          "operator": "softmax"
        },
        {
          "config_id": "bs128_w1_s1",
          "config": {
            "BLOCK_SIZE": 128,
            "num_warps": 1,
            "num_stages": 1
          },
          "tflops": 224.55,
          "ms": 0.5837,
          "correct": true,
          "run_id": "bs128_w1_s1",
          "hardware": "NVIDIA A100-SXM4-80GB",
          "operator": "softmax"
        },
        {
          "config_id": "bs128_w1_s2",
          "config": {
            "BLOCK_SIZE": 128,
            "num_warps": 1,
            "num_stages": 2
          },
          "tflops": 224.96,
          "ms": 0.5827,
          "correct": true,
          "run_id": "bs128_w1_s2",
          "hardware": "NVIDIA A100-SXM4-80GB",
          "operator": "softmax"
        },
        {
          "config_id": "bs128_w2_s1",
          "config": {
            "BLOCK_SIZE": 128,
            "num_warps": 2,
            "num_stages": 1
          },
          "tflops": 205.8,
          "ms": 0.6369,
          "correct": true,
          "run_id": "bs128_w2_s1",
          "hardware": "NVIDIA A100-SXM4-80GB",
          "operator": "softmax"
        },
        {
          "config_id": "bs128_w2_s2",
          "config": {
            "BLOCK_SIZE": 128,
            "num_warps": 2,
            "num_stages": 2
          },
          "tflops": 210.2,
          "ms": 0.6236,
          "correct": true,
          "run_id": "bs128_w2_s2",
          "hardware": "NVIDIA A100-SXM4-80GB",
          "operator": "softmax"
        },
        {
          "config_id": "bs128_w4_s1",
          "config": {
            "BLOCK_SIZE": 128,
            "num_warps": 4,
            "num_stages": 1
          },
          "tflops": 852.49,
          "ms": 0.1538,
          "correct": true,
          "run_id": "bs128_w4_s1",
          "hardware": "NVIDIA A100-SXM4-80GB",
          "operator": "softmax"
        },
        {
          "config_id": "bs128_w4_s2",
          "config": {
            "BLOCK_SIZE": 128,
            "num_warps": 4,
            "num_stages": 2
          },
          "tflops": 852.59,
          "ms": 0.1537,
          "correct": true,
          "run_id": "bs128_w4_s2",
          "hardware": "NVIDIA A100-SXM4-80GB",
          "operator": "softmax"
        },
        {
          "config_id": "bs128_w8_s1",
          "config": {
            "BLOCK_SIZE": 128,
            "num_warps": 8,
            "num_stages": 1
          },
          "tflops": 1201.54,
          "ms": 0.1091,
          "correct": true,
          "run_id": "bs128_w8_s1",
          "hardware": "NVIDIA A100-SXM4-80GB",
          "operator": "softmax"
        },
        {
          "config_id": "bs128_w8_s2",
          "config": {
            "BLOCK_SIZE": 128,
            "num_warps": 8,
            "num_stages": 2
          },
          "tflops": 1193.75,
          "ms": 0.1098,
          "correct": true,
          "run_id": "bs128_w8_s2",
          "hardware": "NVIDIA A100-SXM4-80GB",
          "operator": "softmax"
        },
        {
          "config_id": "bs128_w16_s1",
          "config": {
            "BLOCK_SIZE": 128,
            "num_warps": 16,
            "num_stages": 1
          },
          "tflops": 1372.55,
          "ms": 0.0955,
          "correct": true,
          "run_id": "bs128_w16_s1",
          "hardware": "NVIDIA A100-SXM4-80GB",
          "operator": "softmax"
        }
      ]
    },
    "layernorm:small_hidden:NVIDIA A100-SXM4-80GB": {
      "shape_key": "layernorm:small_hidden:NVIDIA A100-SXM4-80GB",
      "shape": {
        "n_rows": 1024,
        "hidden_dim": 768,
        "bucket": "small_hidden"
      },
      "best_config_id": "bs256_w1_s1",
      "best_tflops": 325.57,
      "results": [
        {
          "config_id": "bs1024_w4_s1",
          "config": {
            "BLOCK_SIZE": 1024,
            "num_warps": 4,
            "num_stages": 1
          },
          "tflops": 276.85,
          "ms": 0.0114,
          "correct": true,
          "run_id": "bs1024_w4_s1",
          "hardware": "NVIDIA A100-SXM4-80GB",
          "operator": "layernorm"
        },
        {
          "config_id": "bs2048_w8_s1",
          "config": {
            "BLOCK_SIZE": 2048,
            "num_warps": 8,
            "num_stages": 1
          },
          "tflops": 283.72,
          "ms": 0.0111,
          "correct": true,
          "run_id": "bs2048_w8_s1",
          "hardware": "NVIDIA A100-SXM4-80GB",
          "operator": "layernorm"
        },
        {
          "config_id": "bs4096_w16_s1",
          "config": {
            "BLOCK_SIZE": 4096,
            "num_warps": 16,
            "num_stages": 1
          },
          "tflops": 221.55,
          "ms": 0.0142,
          "correct": true,
          "run_id": "bs4096_w16_s1",
          "hardware": "NVIDIA A100-SXM4-80GB",
          "operator": "layernorm"
        },
        {
          "config_id": "bs512_w2_s2",
          "config": {
            "BLOCK_SIZE": 512,
            "num_warps": 2,
            "num_stages": 2
          },
          "tflops": 318.89,
          "ms": 0.0099,
          "correct": true,
          "run_id": "bs512_w2_s2",
          "hardware": "NVIDIA A100-SXM4-80GB",
          "operator": "layernorm"
        },
        {
          "config_id": "bs1024_w8_s2",
          "config": {
            "BLOCK_SIZE": 1024,
            "num_warps": 8,
            "num_stages": 2
          },
          "tflops": 275.51,
          "ms": 0.0114,
          "correct": true,
          "run_id": "bs1024_w8_s2",
          "hardware": "NVIDIA A100-SXM4-80GB",
          "operator": "layernorm"
        },
        {
          "config_id": "bs2048_w4_s2",
          "config": {
            "BLOCK_SIZE": 2048,
            "num_warps": 4,
            "num_stages": 2
          },
          "tflops": 302.2,
          "ms": 0.0104,
          "correct": true,
          "run_id": "bs2048_w4_s2",
          "hardware": "NVIDIA A100-SXM4-80GB",
          "operator": "layernorm"
        },
        {
          "config_id": "bs256_w1_s1",
          "config": {
            "BLOCK_SIZE": 256,
            "num_warps": 1,
            "num_stages": 1
          },
          "tflops": 325.57,
          "ms": 0.0097,
          "correct": true,
          "run_id": "bs256_w1_s1",
          "hardware": "NVIDIA A100-SXM4-80GB",
          "operator": "layernorm"
        },
        {
          "config_id": "bs4096_w8_s2",
          "config": {
            "BLOCK_SIZE": 4096,
            "num_warps": 8,
            "num_stages": 2
          },
          "tflops": 260.56,
          "ms": 0.0121,
          "correct": true,
          "run_id": "bs4096_w8_s2",
          "hardware": "NVIDIA A100-SXM4-80GB",
          "operator": "layernorm"
        },
        {
          "config_id": "bs128_w1_s1",
          "config": {
            "BLOCK_SIZE": 128,
            "num_warps": 1,
            "num_stages": 1
          },
          "tflops": 304.47,
          "ms": 0.0103,
          "correct": true,
          "run_id": "bs128_w1_s1",
          "hardware": "NVIDIA A100-SXM4-80GB",
          "operator": "layernorm"
        },
        {
          "config_id": "bs128_w1_s2",
          "config": {
            "BLOCK_SIZE": 128,
            "num_warps": 1,
            "num_stages": 2
          },
          "tflops": 307.22,
          "ms": 0.0102,
          "correct": true,
          "run_id": "bs128_w1_s2",
          "hardware": "NVIDIA A100-SXM4-80GB",
          "operator": "layernorm"
        },
        {
          "config_id": "bs128_w2_s1",
          "config": {
            "BLOCK_SIZE": 128,
            "num_warps": 2,
            "num_stages": 1
          },
          "tflops": 318.68,
          "ms": 0.0099,
          "correct": true,
          "run_id": "bs128_w2_s1",
          "hardware": "NVIDIA A100-SXM4-80GB",
          "operator": "layernorm"
        },
        {
          "config_id": "bs128_w2_s2",
          "config": {
            "BLOCK_SIZE": 128,
            "num_warps": 2,
            "num_stages": 2
          },
          "tflops": 299.14,
          "ms": 0.0105,
          "correct": true,
          "run_id": "bs128_w2_s2",
          "hardware": "NVIDIA A100-SXM4-80GB",
          "operator": "layernorm"
        },
        {
          "config_id": "bs128_w4_s1",
          "config": {
            "BLOCK_SIZE": 128,
            "num_warps": 4,
            "num_stages": 1
          },
          "tflops": 296.31,
          "ms": 0.0106,
          "correct": true,
          "run_id": "bs128_w4_s1",
          "hardware": "NVIDIA A100-SXM4-80GB",
          "operator": "layernorm"
        },
        {
          "config_id": "bs128_w4_s2",
          "config": {
            "BLOCK_SIZE": 128,
            "num_warps": 4,
            "num_stages": 2
          },
          "tflops": 313.24,
          "ms": 0.0101,
          "correct": true,
          "run_id": "bs128_w4_s2",
          "hardware": "NVIDIA A100-SXM4-80GB",
          "operator": "layernorm"
        },
        {
          "config_id": "bs128_w8_s1",
          "config": {
            "BLOCK_SIZE": 128,
            "num_warps": 8,
            "num_stages": 1
          },
          "tflops": 291.06,
          "ms": 0.0108,
          "correct": true,
          "run_id": "bs128_w8_s1",
          "hardware": "NVIDIA A100-SXM4-80GB",
          "operator": "layernorm"
        },
        {
          "config_id": "bs128_w8_s2",
          "config": {
            "BLOCK_SIZE": 128,
            "num_warps": 8,
            "num_stages": 2
          },
          "tflops": 274.71,
          "ms": 0.0115,
          "correct": true,
          "run_id": "bs128_w8_s2",
          "hardware": "NVIDIA A100-SXM4-80GB",
          "operator": "layernorm"
        }
      ]
    },
    "layernorm:gpt2_base:NVIDIA A100-SXM4-80GB": {
      "shape_key": "layernorm:gpt2_base:NVIDIA A100-SXM4-80GB",
      "shape": {
        "n_rows": 4096,
        "hidden_dim": 768,
        "bucket": "gpt2_base"
      },
      "best_config_id": "bs128_w1_s1",
      "best_tflops": 787.76,
      "results": [
        {
          "config_id": "bs1024_w4_s1",
          "config": {
            "BLOCK_SIZE": 1024,
            "num_warps": 4,
            "num_stages": 1
          },
          "tflops": 698.42,
          "ms": 0.018,
          "correct": true,
          "run_id": "bs1024_w4_s1",
          "hardware": "NVIDIA A100-SXM4-80GB",
          "operator": "layernorm"
        },
        {
          "config_id": "bs1024_w4_s1",
          "config": {
            "BLOCK_SIZE": 1024,
            "num_warps": 4,
            "num_stages": 1
          },
          "tflops": 717.22,
          "ms": 0.0175,
          "correct": true,
          "run_id": "bs1024_w4_s1",
          "hardware": "NVIDIA A100-SXM4-80GB",
          "operator": "layernorm"
        },
        {
          "config_id": "bs2048_w8_s1",
          "config": {
            "BLOCK_SIZE": 2048,
            "num_warps": 8,
            "num_stages": 1
          },
          "tflops": 646.04,
          "ms": 0.0195,
          "correct": true,
          "run_id": "bs2048_w8_s1",
          "hardware": "NVIDIA A100-SXM4-80GB",
          "operator": "layernorm"
        },
        {
          "config_id": "bs2048_w8_s1",
          "config": {
            "BLOCK_SIZE": 2048,
            "num_warps": 8,
            "num_stages": 1
          },
          "tflops": 649.04,
          "ms": 0.0194,
          "correct": true,
          "run_id": "bs2048_w8_s1",
          "hardware": "NVIDIA A100-SXM4-80GB",
          "operator": "layernorm"
        },
        {
          "config_id": "bs4096_w16_s1",
          "config": {
            "BLOCK_SIZE": 4096,
            "num_warps": 16,
            "num_stages": 1
          },
          "tflops": 398.2,
          "ms": 0.0316,
          "correct": true,
          "run_id": "bs4096_w16_s1",
          "hardware": "NVIDIA A100-SXM4-80GB",
          "operator": "layernorm"
        },
        {
          "config_id": "bs4096_w16_s1",
          "config": {
            "BLOCK_SIZE": 4096,
            "num_warps": 16,
            "num_stages": 1
          },
          "tflops": 397.29,
          "ms": 0.0317,
          "correct": true,
          "run_id": "bs4096_w16_s1",
          "hardware": "NVIDIA A100-SXM4-80GB",
          "operator": "layernorm"
        },
        {
          "config_id": "bs512_w2_s2",
          "config": {
            "BLOCK_SIZE": 512,
            "num_warps": 2,
            "num_stages": 2
          },
          "tflops": 748.25,
          "ms": 0.0168,
          "correct": true,
          "run_id": "bs512_w2_s2",
          "hardware": "NVIDIA A100-SXM4-80GB",
          "operator": "layernorm"
        },
        {
          "config_id": "bs512_w2_s2",
          "config": {
            "BLOCK_SIZE": 512,
            "num_warps": 2,
            "num_stages": 2
          },
          "tflops": 723.13,
          "ms": 0.0174,
          "correct": true,
          "run_id": "bs512_w2_s2",
          "hardware": "NVIDIA A100-SXM4-80GB",
          "operator": "layernorm"
        },
        {
          "config_id": "bs1024_w8_s2",
          "config": {
            "BLOCK_SIZE": 1024,
            "num_warps": 8,
            "num_stages": 2
          },
          "tflops": 693.66,
          "ms": 0.0181,
          "correct": true,
          "run_id": "bs1024_w8_s2",
          "hardware": "NVIDIA A100-SXM4-80GB",
          "operator": "layernorm"
        },
        {
          "config_id": "bs1024_w8_s2",
          "config": {
            "BLOCK_SIZE": 1024,
            "num_warps": 8,
            "num_stages": 2
          },
          "tflops": 694.56,
          "ms": 0.0181,
          "correct": true,
          "run_id": "bs1024_w8_s2",
          "hardware": "NVIDIA A100-SXM4-80GB",
          "operator": "layernorm"
        },
        {
          "config_id": "bs2048_w4_s2",
          "config": {
            "BLOCK_SIZE": 2048,
            "num_warps": 4,
            "num_stages": 2
          },
          "tflops": 717.88,
          "ms": 0.0175,
          "correct": true,
          "run_id": "bs2048_w4_s2",
          "hardware": "NVIDIA A100-SXM4-80GB",
          "operator": "layernorm"
        },
        {
          "config_id": "bs2048_w4_s2",
          "config": {
            "BLOCK_SIZE": 2048,
            "num_warps": 4,
            "num_stages": 2
          },
          "tflops": 740.26,
          "ms": 0.017,
          "correct": true,
          "run_id": "bs2048_w4_s2",
          "hardware": "NVIDIA A100-SXM4-80GB",
          "operator": "layernorm"
        },
        {
          "config_id": "bs256_w1_s1",
          "config": {
            "BLOCK_SIZE": 256,
            "num_warps": 1,
            "num_stages": 1
          },
          "tflops": 763.28,
          "ms": 0.0165,
          "correct": true,
          "run_id": "bs256_w1_s1",
          "hardware": "NVIDIA A100-SXM4-80GB",
          "operator": "layernorm"
        },
        {
          "config_id": "bs256_w1_s1",
          "config": {
            "BLOCK_SIZE": 256,
            "num_warps": 1,
            "num_stages": 1
          },
          "tflops": 765.49,
          "ms": 0.0164,
          "correct": true,
          "run_id": "bs256_w1_s1",
          "hardware": "NVIDIA A100-SXM4-80GB",
          "operator": "layernorm"
        },
        {
          "config_id": "bs4096_w8_s2",
          "config": {
            "BLOCK_SIZE": 4096,
            "num_warps": 8,
            "num_stages": 2
          },
          "tflops": 507.3,
          "ms": 0.0248,
          "correct": true,
          "run_id": "bs4096_w8_s2",
          "hardware": "NVIDIA A100-SXM4-80GB",
          "operator": "layernorm"
        },
        {
          "config_id": "bs4096_w8_s2",
          "config": {
            "BLOCK_SIZE": 4096,
            "num_warps": 8,
            "num_stages": 2
          },
          "tflops": 507.93,
          "ms": 0.0248,
          "correct": true,
          "run_id": "bs4096_w8_s2",
          "hardware": "NVIDIA A100-SXM4-80GB",
          "operator": "layernorm"
        },
        {
          "config_id": "bs128_w1_s1",
          "config": {
            "BLOCK_SIZE": 128,
            "num_warps": 1,
            "num_stages": 1
          },
          "tflops": 760.98,
          "ms": 0.0165,
          "correct": true,
          "run_id": "bs128_w1_s1",
          "hardware": "NVIDIA A100-SXM4-80GB",
          "operator": "layernorm"
        },
        {
          "config_id": "bs128_w1_s1",
          "config": {
            "BLOCK_SIZE": 128,
            "num_warps": 1,
            "num_stages": 1
          },
          "tflops": 787.76,
          "ms": 0.016,
          "correct": true,
          "run_id": "bs128_w1_s1",
          "hardware": "NVIDIA A100-SXM4-80GB",
          "operator": "layernorm"
        },
        {
          "config_id": "bs128_w1_s2",
          "config": {
            "BLOCK_SIZE": 128,
            "num_warps": 1,
            "num_stages": 2
          },
          "tflops": 765.33,
          "ms": 0.0164,
          "correct": true,
          "run_id": "bs128_w1_s2",
          "hardware": "NVIDIA A100-SXM4-80GB",
          "operator": "layernorm"
        },
        {
          "config_id": "bs128_w1_s2",
          "config": {
            "BLOCK_SIZE": 128,
            "num_warps": 1,
            "num_stages": 2
          },
          "tflops": 763.19,
          "ms": 0.0165,
          "correct": true,
          "run_id": "bs128_w1_s2",
          "hardware": "NVIDIA A100-SXM4-80GB",
          "operator": "layernorm"
        },
        {
          "config_id": "bs128_w2_s1",
          "config": {
            "BLOCK_SIZE": 128,
            "num_warps": 2,
            "num_stages": 1
          },
          "tflops": 750.43,
          "ms": 0.0168,
          "correct": true,
          "run_id": "bs128_w2_s1",
          "hardware": "NVIDIA A100-SXM4-80GB",
          "operator": "layernorm"
        },
        {
          "config_id": "bs128_w2_s1",
          "config": {
            "BLOCK_SIZE": 128,
            "num_warps": 2,
            "num_stages": 1
          },
          "tflops": 742.15,
          "ms": 0.017,
          "correct": true,
          "run_id": "bs128_w2_s1",
          "hardware": "NVIDIA A100-SXM4-80GB",
          "operator": "layernorm"
        },
        {
          "config_id": "bs128_w2_s2",
          "config": {
            "BLOCK_SIZE": 128,
            "num_warps": 2,
            "num_stages": 2
          },
          "tflops": 749.03,
          "ms": 0.0168,
          "correct": true,
          "run_id": "bs128_w2_s2",
          "hardware": "NVIDIA A100-SXM4-80GB",
          "operator": "layernorm"
        },
        {
          "config_id": "bs128_w2_s2",
          "config": {
            "BLOCK_SIZE": 128,
            "num_warps": 2,
            "num_stages": 2
          },
          "tflops": 721.23,
          "ms": 0.0175,
          "correct": true,
          "run_id": "bs128_w2_s2",
          "hardware": "NVIDIA A100-SXM4-80GB",
          "operator": "layernorm"
        },
        {
          "config_id": "bs128_w4_s1",
          "config": {
            "BLOCK_SIZE": 128,
            "num_warps": 4,
            "num_stages": 1
          },
          "tflops": 768.49,
          "ms": 0.0164,
          "correct": true,
          "run_id": "bs128_w4_s1",
          "hardware": "NVIDIA A100-SXM4-80GB",
          "operator": "layernorm"
        },
        {
          "config_id": "bs128_w4_s1",
          "config": {
            "BLOCK_SIZE": 128,
            "num_warps": 4,
            "num_stages": 1
          },
          "tflops": 742.5,
          "ms": 0.017,
          "correct": true,
          "run_id": "bs128_w4_s1",
          "hardware": "NVIDIA A100-SXM4-80GB",
          "operator": "layernorm"
        },
        {
          "config_id": "bs128_w4_s2",
          "config": {
            "BLOCK_SIZE": 128,
            "num_warps": 4,
            "num_stages": 2
          },
          "tflops": 768.64,
          "ms": 0.0164,
          "correct": true,
          "run_id": "bs128_w4_s2",
          "hardware": "NVIDIA A100-SXM4-80GB",
          "operator": "layernorm"
        },
        {
          "config_id": "bs128_w4_s2",
          "config": {
            "BLOCK_SIZE": 128,
            "num_warps": 4,
            "num_stages": 2
          },
          "tflops": 770.68,
          "ms": 0.0163,
          "correct": true,
          "run_id": "bs128_w4_s2",
          "hardware": "NVIDIA A100-SXM4-80GB",
          "operator": "layernorm"
        },
        {
          "config_id": "bs128_w8_s1",
          "config": {
            "BLOCK_SIZE": 128,
            "num_warps": 8,
            "num_stages": 1
          },
          "tflops": 693.0,
          "ms": 0.0182,
          "correct": true,
          "run_id": "bs128_w8_s1",
          "hardware": "NVIDIA A100-SXM4-80GB",
          "operator": "layernorm"
        },
        {
          "config_id": "bs128_w8_s1",
          "config": {
            "BLOCK_SIZE": 128,
            "num_warps": 8,
            "num_stages": 1
          },
          "tflops": 692.89,
          "ms": 0.0182,
          "correct": true,
          "run_id": "bs128_w8_s1",
          "hardware": "NVIDIA A100-SXM4-80GB",
          "operator": "layernorm"
        },
        {
          "config_id": "bs128_w8_s2",
          "config": {
            "BLOCK_SIZE": 128,
            "num_warps": 8,
            "num_stages": 2
          },
          "tflops": 694.5,
          "ms": 0.0181,
          "correct": true,
          "run_id": "bs128_w8_s2",
          "hardware": "NVIDIA A100-SXM4-80GB",
          "operator": "layernorm"
        },
        {
          "config_id": "bs128_w8_s2",
          "config": {
            "BLOCK_SIZE": 128,
            "num_warps": 8,
            "num_stages": 2
          },
          "tflops": 670.19,
          "ms": 0.0188,
          "correct": true,
          "run_id": "bs128_w8_s2",
          "hardware": "NVIDIA A100-SXM4-80GB",
          "operator": "layernorm"
        }
      ]
    },
    "layernorm:bert_large:NVIDIA A100-SXM4-80GB": {
      "shape_key": "layernorm:bert_large:NVIDIA A100-SXM4-80GB",
      "shape": {
        "n_rows": 4096,
        "hidden_dim": 1024,
        "bucket": "bert_large"
      },
      "best_config_id": "bs256_w1_s1",
      "best_tflops": 893.09,
      "results": [
        {
          "config_id": "bs1024_w4_s1",
          "config": {
            "BLOCK_SIZE": 1024,
            "num_warps": 4,
            "num_stages": 1
          },
          "tflops": 849.76,
          "ms": 0.0197,
          "correct": true,
          "run_id": "bs1024_w4_s1",
          "hardware": "NVIDIA A100-SXM4-80GB",
          "operator": "layernorm"
        },
        {
          "config_id": "bs2048_w8_s1",
          "config": {
            "BLOCK_SIZE": 2048,
            "num_warps": 8,
            "num_stages": 1
          },
          "tflops": 808.4,
          "ms": 0.0208,
          "correct": true,
          "run_id": "bs2048_w8_s1",
          "hardware": "NVIDIA A100-SXM4-80GB",
          "operator": "layernorm"
        },
        {
          "config_id": "bs4096_w16_s1",
          "config": {
            "BLOCK_SIZE": 4096,
            "num_warps": 16,
            "num_stages": 1
          },
          "tflops": 514.55,
          "ms": 0.0326,
          "correct": true,
          "run_id": "bs4096_w16_s1",
          "hardware": "NVIDIA A100-SXM4-80GB",
          "operator": "layernorm"
        },
        {
          "config_id": "bs512_w2_s2",
          "config": {
            "BLOCK_SIZE": 512,
            "num_warps": 2,
            "num_stages": 2
          },
          "tflops": 836.44,
          "ms": 0.0201,
          "correct": true,
          "run_id": "bs512_w2_s2",
          "hardware": "NVIDIA A100-SXM4-80GB",
          "operator": "layernorm"
        },
        {
          "config_id": "bs1024_w8_s2",
          "config": {
            "BLOCK_SIZE": 1024,
            "num_warps": 8,
            "num_stages": 2
          },
          "tflops": 850.89,
          "ms": 0.0197,
          "correct": true,
          "run_id": "bs1024_w8_s2",
          "hardware": "NVIDIA A100-SXM4-80GB",
          "operator": "layernorm"
        },
        {
          "config_id": "bs2048_w4_s2",
          "config": {
            "BLOCK_SIZE": 2048,
            "num_warps": 4,
            "num_stages": 2
          },
          "tflops": 865.02,
          "ms": 0.0194,
          "correct": true,
          "run_id": "bs2048_w4_s2",
          "hardware": "NVIDIA A100-SXM4-80GB",
          "operator": "layernorm"
        },
        {
          "config_id": "bs256_w1_s1",
          "config": {
            "BLOCK_SIZE": 256,
            "num_warps": 1,
            "num_stages": 1
          },
          "tflops": 893.09,
          "ms": 0.0188,
          "correct": true,
          "run_id": "bs256_w1_s1",
          "hardware": "NVIDIA A100-SXM4-80GB",
          "operator": "layernorm"
        },
        {
          "config_id": "bs4096_w8_s2",
          "config": {
            "BLOCK_SIZE": 4096,
            "num_warps": 8,
            "num_stages": 2
          },
          "tflops": 669.23,
          "ms": 0.0251,
          "correct": true,
          "run_id": "bs4096_w8_s2",
          "hardware": "NVIDIA A100-SXM4-80GB",
          "operator": "layernorm"
        },
        {
          "config_id": "bs128_w1_s1",
          "config": {
            "BLOCK_SIZE": 128,
            "num_warps": 1,
            "num_stages": 1
          },
          "tflops": 861.57,
          "ms": 0.0195,
          "correct": true,
          "run_id": "bs128_w1_s1",
          "hardware": "NVIDIA A100-SXM4-80GB",
          "operator": "layernorm"
        },
        {
          "config_id": "bs128_w1_s2",
          "config": {
            "BLOCK_SIZE": 128,
            "num_warps": 1,
            "num_stages": 2
          },
          "tflops": 865.28,
          "ms": 0.0194,
          "correct": true,
          "run_id": "bs128_w1_s2",
          "hardware": "NVIDIA A100-SXM4-80GB",
          "operator": "layernorm"
        },
        {
          "config_id": "bs128_w2_s1",
          "config": {
            "BLOCK_SIZE": 128,
            "num_warps": 2,
            "num_stages": 1
          },
          "tflops": 859.4,
          "ms": 0.0195,
          "correct": true,
          "run_id": "bs128_w2_s1",
          "hardware": "NVIDIA A100-SXM4-80GB",
          "operator": "layernorm"
        },
        {
          "config_id": "bs128_w2_s2",
          "config": {
            "BLOCK_SIZE": 128,
            "num_warps": 2,
            "num_stages": 2
          },
          "tflops": 862.45,
          "ms": 0.0195,
          "correct": true,
          "run_id": "bs128_w2_s2",
          "hardware": "NVIDIA A100-SXM4-80GB",
          "operator": "layernorm"
        },
        {
          "config_id": "bs128_w4_s1",
          "config": {
            "BLOCK_SIZE": 128,
            "num_warps": 4,
            "num_stages": 1
          },
          "tflops": 849.61,
          "ms": 0.0198,
          "correct": true,
          "run_id": "bs128_w4_s1",
          "hardware": "NVIDIA A100-SXM4-80GB",
          "operator": "layernorm"
        },
        {
          "config_id": "bs128_w4_s2",
          "config": {
            "BLOCK_SIZE": 128,
            "num_warps": 4,
            "num_stages": 2
          },
          "tflops": 876.21,
          "ms": 0.0192,
          "correct": true,
          "run_id": "bs128_w4_s2",
          "hardware": "NVIDIA A100-SXM4-80GB",
          "operator": "layernorm"
        },
        {
          "config_id": "bs128_w8_s1",
          "config": {
            "BLOCK_SIZE": 128,
            "num_warps": 8,
            "num_stages": 1
          },
          "tflops": 849.71,
          "ms": 0.0197,
          "correct": true,
          "run_id": "bs128_w8_s1",
          "hardware": "NVIDIA A100-SXM4-80GB",
          "operator": "layernorm"
        },
        {
          "config_id": "bs128_w8_s2",
          "config": {
            "BLOCK_SIZE": 128,
            "num_warps": 8,
            "num_stages": 2
          },
          "tflops": 824.64,
          "ms": 0.0203,
          "correct": true,
          "run_id": "bs128_w8_s2",
          "hardware": "NVIDIA A100-SXM4-80GB",
          "operator": "layernorm"
        }
      ]
    },
    "layernorm:gpt_xl:NVIDIA A100-SXM4-80GB": {
      "shape_key": "layernorm:gpt_xl:NVIDIA A100-SXM4-80GB",
      "shape": {
        "n_rows": 4096,
        "hidden_dim": 1600,
        "bucket": "gpt_xl"
      },
      "best_config_id": "bs128_w4_s1",
      "best_tflops": 1029.1,
      "results": [
        {
          "config_id": "bs1024_w4_s1",
          "config": {
            "BLOCK_SIZE": 1024,
            "num_warps": 4,
            "num_stages": 1
          },
          "tflops": 1001.95,
          "ms": 0.0262,
          "correct": true,
          "run_id": "bs1024_w4_s1",
          "hardware": "NVIDIA A100-SXM4-80GB",
          "operator": "layernorm"
        },
        {
          "config_id": "bs2048_w8_s1",
          "config": {
            "BLOCK_SIZE": 2048,
            "num_warps": 8,
            "num_stages": 1
          },
          "tflops": 1023.32,
          "ms": 0.0256,
          "correct": true,
          "run_id": "bs2048_w8_s1",
          "hardware": "NVIDIA A100-SXM4-80GB",
          "operator": "layernorm"
        },
        {
          "config_id": "bs4096_w16_s1",
          "config": {
            "BLOCK_SIZE": 4096,
            "num_warps": 16,
            "num_stages": 1
          },
          "tflops": 776.34,
          "ms": 0.0338,
          "correct": true,
          "run_id": "bs4096_w16_s1",
          "hardware": "NVIDIA A100-SXM4-80GB",
          "operator": "layernorm"
        },
        {
          "config_id": "bs512_w2_s2",
          "config": {
            "BLOCK_SIZE": 512,
            "num_warps": 2,
            "num_stages": 2
          },
          "tflops": 1012.28,
          "ms": 0.0259,
          "correct": true,
          "run_id": "bs512_w2_s2",
          "hardware": "NVIDIA A100-SXM4-80GB",
          "operator": "layernorm"
        },
        {
          "config_id": "bs1024_w8_s2",
          "config": {
            "BLOCK_SIZE": 1024,
            "num_warps": 8,
            "num_stages": 2
          },
          "tflops": 1020.99,
          "ms": 0.0257,
          "correct": true,
          "run_id": "bs1024_w8_s2",
          "hardware": "NVIDIA A100-SXM4-80GB",
          "operator": "layernorm"
        },
        {
          "config_id": "bs2048_w4_s2",
          "config": {
            "BLOCK_SIZE": 2048,
            "num_warps": 4,
            "num_stages": 2
          },
          "tflops": 1026.24,
          "ms": 0.0256,
          "correct": true,
          "run_id": "bs2048_w4_s2",
          "hardware": "NVIDIA A100-SXM4-80GB",
          "operator": "layernorm"
        },
        {
          "config_id": "bs256_w1_s1",
          "config": {
            "BLOCK_SIZE": 256,
            "num_warps": 1,
            "num_stages": 1
          },
          "tflops": 1027.89,
          "ms": 0.0255,
          "correct": true,
          "run_id": "bs256_w1_s1",
          "hardware": "NVIDIA A100-SXM4-80GB",
          "operator": "layernorm"
        },
        {
          "config_id": "bs4096_w8_s2",
          "config": {
            "BLOCK_SIZE": 4096,
            "num_warps": 8,
            "num_stages": 2
          },
          "tflops": 952.22,
          "ms": 0.0275,
          "correct": true,
          "run_id": "bs4096_w8_s2",
          "hardware": "NVIDIA A100-SXM4-80GB",
          "operator": "layernorm"
        },
        {
          "config_id": "bs128_w1_s1",
          "config": {
            "BLOCK_SIZE": 128,
            "num_warps": 1,
            "num_stages": 1
          },
          "tflops": 1026.18,
          "ms": 0.0256,
          "correct": true,
          "run_id": "bs128_w1_s1",
          "hardware": "NVIDIA A100-SXM4-80GB",
          "operator": "layernorm"
        },
        {
          "config_id": "bs128_w1_s2",
          "config": {
            "BLOCK_SIZE": 128,
            "num_warps": 1,
            "num_stages": 2
          },
          "tflops": 1007.03,
          "ms": 0.026,
          "correct": true,
          "run_id": "bs128_w1_s2",
          "hardware": "NVIDIA A100-SXM4-80GB",
          "operator": "layernorm"
        },
        {
          "config_id": "bs128_w2_s1",
          "config": {
            "BLOCK_SIZE": 128,
            "num_warps": 2,
            "num_stages": 1
          },
          "tflops": 1010.73,
          "ms": 0.0259,
          "correct": true,
          "run_id": "bs128_w2_s1",
          "hardware": "NVIDIA A100-SXM4-80GB",
          "operator": "layernorm"
        },
        {
          "config_id": "bs128_w2_s2",
          "config": {
            "BLOCK_SIZE": 128,
            "num_warps": 2,
            "num_stages": 2
          },
          "tflops": 988.5,
          "ms": 0.0265,
          "correct": true,
          "run_id": "bs128_w2_s2",
          "hardware": "NVIDIA A100-SXM4-80GB",
          "operator": "layernorm"
        },
        {
          "config_id": "bs128_w4_s1",
          "config": {
            "BLOCK_SIZE": 128,
            "num_warps": 4,
            "num_stages": 1
          },
          "tflops": 1029.1,
          "ms": 0.0255,
          "correct": true,
          "run_id": "bs128_w4_s1",
          "hardware": "NVIDIA A100-SXM4-80GB",
          "operator": "layernorm"
        },
        {
          "config_id": "bs128_w4_s2",
          "config": {
            "BLOCK_SIZE": 128,
            "num_warps": 4,
            "num_stages": 2
          },
          "tflops": 1025.06,
          "ms": 0.0256,
          "correct": true,
          "run_id": "bs128_w4_s2",
          "hardware": "NVIDIA A100-SXM4-80GB",
          "operator": "layernorm"
        },
        {
          "config_id": "bs128_w8_s1",
          "config": {
            "BLOCK_SIZE": 128,
            "num_warps": 8,
            "num_stages": 1
          },
          "tflops": 1019.19,
          "ms": 0.0257,
          "correct": true,
          "run_id": "bs128_w8_s1",
          "hardware": "NVIDIA A100-SXM4-80GB",
          "operator": "layernorm"
        },
        {
          "config_id": "bs128_w8_s2",
          "config": {
            "BLOCK_SIZE": 128,
            "num_warps": 8,
            "num_stages": 2
          },
          "tflops": 1023.64,
          "ms": 0.0256,
          "correct": true,
          "run_id": "bs128_w8_s2",
          "hardware": "NVIDIA A100-SXM4-80GB",
          "operator": "layernorm"
        }
      ]
    },
    "layernorm:gpt_neox:NVIDIA A100-SXM4-80GB": {
      "shape_key": "layernorm:gpt_neox:NVIDIA A100-SXM4-80GB",
      "shape": {
        "n_rows": 4096,
        "hidden_dim": 4096,
        "bucket": "gpt_neox"
      },
      "best_config_id": "bs1024_w4_s1",
      "best_tflops": 1341.0,
      "results": [
        {
          "config_id": "bs1024_w4_s1",
          "config": {
            "BLOCK_SIZE": 1024,
            "num_warps": 4,
            "num_stages": 1
          },
          "tflops": 1341.0,
          "ms": 0.0501,
          "correct": true,
          "run_id": "bs1024_w4_s1",
          "hardware": "NVIDIA A100-SXM4-80GB",
          "operator": "layernorm"
        },
        {
          "config_id": "bs2048_w8_s1",
          "config": {
            "BLOCK_SIZE": 2048,
            "num_warps": 8,
            "num_stages": 1
          },
          "tflops": 1322.79,
          "ms": 0.0507,
          "correct": true,
          "run_id": "bs2048_w8_s1",
          "hardware": "NVIDIA A100-SXM4-80GB",
          "operator": "layernorm"
        },
        {
          "config_id": "bs4096_w16_s1",
          "config": {
            "BLOCK_SIZE": 4096,
            "num_warps": 16,
            "num_stages": 1
          },
          "tflops": 1308.47,
          "ms": 0.0513,
          "correct": true,
          "run_id": "bs4096_w16_s1",
          "hardware": "NVIDIA A100-SXM4-80GB",
          "operator": "layernorm"
        },
        {
          "config_id": "bs512_w2_s2",
          "config": {
            "BLOCK_SIZE": 512,
            "num_warps": 2,
            "num_stages": 2
          },
          "tflops": 1303.43,
          "ms": 0.0515,
          "correct": true,
          "run_id": "bs512_w2_s2",
          "hardware": "NVIDIA A100-SXM4-80GB",
          "operator": "layernorm"
        },
        {
          "config_id": "bs1024_w8_s2",
          "config": {
            "BLOCK_SIZE": 1024,
            "num_warps": 8,
            "num_stages": 2
          },
          "tflops": 1322.47,
          "ms": 0.0508,
          "correct": true,
          "run_id": "bs1024_w8_s2",
          "hardware": "NVIDIA A100-SXM4-80GB",
          "operator": "layernorm"
        },
        {
          "config_id": "bs2048_w4_s2",
          "config": {
            "BLOCK_SIZE": 2048,
            "num_warps": 4,
            "num_stages": 2
          },
          "tflops": 1325.13,
          "ms": 0.0507,
          "correct": true,
          "run_id": "bs2048_w4_s2",
          "hardware": "NVIDIA A100-SXM4-80GB",
          "operator": "layernorm"
        },
        {
          "config_id": "bs256_w1_s1",
          "config": {
            "BLOCK_SIZE": 256,
            "num_warps": 1,
            "num_stages": 1
          },
          "tflops": 1293.9,
          "ms": 0.0519,
          "correct": true,
          "run_id": "bs256_w1_s1",
          "hardware": "NVIDIA A100-SXM4-80GB",
          "operator": "layernorm"
        },
        {
          "config_id": "bs4096_w8_s2",
          "config": {
            "BLOCK_SIZE": 4096,
            "num_warps": 8,
            "num_stages": 2
          },
          "tflops": 1320.52,
          "ms": 0.0508,
          "correct": true,
          "run_id": "bs4096_w8_s2",
          "hardware": "NVIDIA A100-SXM4-80GB",
          "operator": "layernorm"
        },
        {
          "config_id": "bs128_w1_s1",
          "config": {
            "BLOCK_SIZE": 128,
            "num_warps": 1,
            "num_stages": 1
          },
          "tflops": 1293.89,
          "ms": 0.0519,
          "correct": true,
          "run_id": "bs128_w1_s1",
          "hardware": "NVIDIA A100-SXM4-80GB",
          "operator": "layernorm"
        },
        {
          "config_id": "bs128_w1_s2",
          "config": {
            "BLOCK_SIZE": 128,
            "num_warps": 1,
            "num_stages": 2
          },
          "tflops": 1281.15,
          "ms": 0.0524,
          "correct": true,
          "run_id": "bs128_w1_s2",
          "hardware": "NVIDIA A100-SXM4-80GB",
          "operator": "layernorm"
        },
        {
          "config_id": "bs128_w2_s1",
          "config": {
            "BLOCK_SIZE": 128,
            "num_warps": 2,
            "num_stages": 1
          },
          "tflops": 1303.17,
          "ms": 0.0515,
          "correct": true,
          "run_id": "bs128_w2_s1",
          "hardware": "NVIDIA A100-SXM4-80GB",
          "operator": "layernorm"
        },
        {
          "config_id": "bs128_w2_s2",
          "config": {
            "BLOCK_SIZE": 128,
            "num_warps": 2,
            "num_stages": 2
          },
          "tflops": 1306.4,
          "ms": 0.0514,
          "correct": true,
          "run_id": "bs128_w2_s2",
          "hardware": "NVIDIA A100-SXM4-80GB",
          "operator": "layernorm"
        },
        {
          "config_id": "bs128_w4_s1",
          "config": {
            "BLOCK_SIZE": 128,
            "num_warps": 4,
            "num_stages": 1
          },
          "tflops": 1322.72,
          "ms": 0.0507,
          "correct": true,
          "run_id": "bs128_w4_s1",
          "hardware": "NVIDIA A100-SXM4-80GB",
          "operator": "layernorm"
        },
        {
          "config_id": "bs128_w4_s2",
          "config": {
            "BLOCK_SIZE": 128,
            "num_warps": 4,
            "num_stages": 2
          },
          "tflops": 1322.03,
          "ms": 0.0508,
          "correct": true,
          "run_id": "bs128_w4_s2",
          "hardware": "NVIDIA A100-SXM4-80GB",
          "operator": "layernorm"
        },
        {
          "config_id": "bs128_w8_s1",
          "config": {
            "BLOCK_SIZE": 128,
            "num_warps": 8,
            "num_stages": 1
          },
          "tflops": 1321.98,
          "ms": 0.0508,
          "correct": true,
          "run_id": "bs128_w8_s1",
          "hardware": "NVIDIA A100-SXM4-80GB",
          "operator": "layernorm"
        },
        {
          "config_id": "bs128_w8_s2",
          "config": {
            "BLOCK_SIZE": 128,
            "num_warps": 8,
            "num_stages": 2
          },
          "tflops": 1338.06,
          "ms": 0.0502,
          "correct": true,
          "run_id": "bs128_w8_s2",
          "hardware": "NVIDIA A100-SXM4-80GB",
          "operator": "layernorm"
        }
      ]
    },
    "cross_entropy:gpt2_small:NVIDIA A100-SXM4-80GB": {
      "shape_key": "cross_entropy:gpt2_small:NVIDIA A100-SXM4-80GB",
      "shape": {
        "n_rows": 1024,
        "n_cols": 50257,
        "bucket": "gpt2_small"
      },
      "best_config_id": "bs8192_w16_s1",
      "best_tflops": 738.68,
      "results": [
        {
          "config_id": "bs4096_w8_s1",
          "config": {
            "BLOCK_SIZE": 4096,
            "num_warps": 8,
            "num_stages": 1
          },
          "tflops": 628.74,
          "ms": 0.1637,
          "correct": true,
          "run_id": "bs4096_w8_s1",
          "hardware": "NVIDIA A100-SXM4-80GB",
          "operator": "cross_entropy"
        },
        {
          "config_id": "bs8192_w16_s1",
          "config": {
            "BLOCK_SIZE": 8192,
            "num_warps": 16,
            "num_stages": 1
          },
          "tflops": 738.68,
          "ms": 0.1394,
          "correct": true,
          "run_id": "bs8192_w16_s1",
          "hardware": "NVIDIA A100-SXM4-80GB",
          "operator": "cross_entropy"
        },
        {
          "config_id": "bs16384_w16_s1",
          "config": {
            "BLOCK_SIZE": 16384,
            "num_warps": 16,
            "num_stages": 1
          },
          "tflops": 734.21,
          "ms": 0.1402,
          "correct": true,
          "run_id": "bs16384_w16_s1",
          "hardware": "NVIDIA A100-SXM4-80GB",
          "operator": "cross_entropy"
        },
        {
          "config_id": "bs32768_w16_s1",
          "config": {
            "BLOCK_SIZE": 32768,
            "num_warps": 16,
            "num_stages": 1
          },
          "tflops": 734.8,
          "ms": 0.1401,
          "correct": true,
          "run_id": "bs32768_w16_s1",
          "hardware": "NVIDIA A100-SXM4-80GB",
          "operator": "cross_entropy"
        },
        {
          "config_id": "bs2048_w4_s2",
          "config": {
            "BLOCK_SIZE": 2048,
            "num_warps": 4,
            "num_stages": 2
          },
          "tflops": 71.28,
          "ms": 1.4442,
          "correct": true,
          "run_id": "bs2048_w4_s2",
          "hardware": "NVIDIA A100-SXM4-80GB",
          "operator": "cross_entropy"
        },
        {
          "config_id": "bs4096_w16_s1",
          "config": {
            "BLOCK_SIZE": 4096,
            "num_warps": 16,
            "num_stages": 1
          },
          "tflops": 734.24,
          "ms": 0.1402,
          "correct": true,
          "run_id": "bs4096_w16_s1",
          "hardware": "NVIDIA A100-SXM4-80GB",
          "operator": "cross_entropy"
        },
        {
          "config_id": "bs1024_w2_s2",
          "config": {
            "BLOCK_SIZE": 1024,
            "num_warps": 2,
            "num_stages": 2
          },
          "tflops": 68.51,
          "ms": 1.5025,
          "correct": true,
          "run_id": "bs1024_w2_s2",
          "hardware": "NVIDIA A100-SXM4-80GB",
          "operator": "cross_entropy"
        },
        {
          "config_id": "bs256_w1_s1",
          "config": {
            "BLOCK_SIZE": 256,
            "num_warps": 1,
            "num_stages": 1
          },
          "tflops": 66.2,
          "ms": 1.5549,
          "correct": true,
          "run_id": "bs256_w1_s1",
          "hardware": "NVIDIA A100-SXM4-80GB",
          "operator": "cross_entropy"
        },
        {
          "config_id": "bs256_w1_s2",
          "config": {
            "BLOCK_SIZE": 256,
            "num_warps": 1,
            "num_stages": 2
          },
          "tflops": 66.99,
          "ms": 1.5366,
          "correct": true,
          "run_id": "bs256_w1_s2",
          "hardware": "NVIDIA A100-SXM4-80GB",
          "operator": "cross_entropy"
        },
        {
          "config_id": "bs256_w2_s1",
          "config": {
            "BLOCK_SIZE": 256,
            "num_warps": 2,
            "num_stages": 1
          },
          "tflops": 68.86,
          "ms": 1.4948,
          "correct": true,
          "run_id": "bs256_w2_s1",
          "hardware": "NVIDIA A100-SXM4-80GB",
          "operator": "cross_entropy"
        },
        {
          "config_id": "bs256_w2_s2",
          "config": {
            "BLOCK_SIZE": 256,
            "num_warps": 2,
            "num_stages": 2
          },
          "tflops": 72.78,
          "ms": 1.4143,
          "correct": true,
          "run_id": "bs256_w2_s2",
          "hardware": "NVIDIA A100-SXM4-80GB",
          "operator": "cross_entropy"
        },
        {
          "config_id": "bs256_w4_s1",
          "config": {
            "BLOCK_SIZE": 256,
            "num_warps": 4,
            "num_stages": 1
          },
          "tflops": 71.21,
          "ms": 1.4456,
          "correct": true,
          "run_id": "bs256_w4_s1",
          "hardware": "NVIDIA A100-SXM4-80GB",
          "operator": "cross_entropy"
        },
        {
          "config_id": "bs256_w4_s2",
          "config": {
            "BLOCK_SIZE": 256,
            "num_warps": 4,
            "num_stages": 2
          },
          "tflops": 73.97,
          "ms": 1.3915,
          "correct": true,
          "run_id": "bs256_w4_s2",
          "hardware": "NVIDIA A100-SXM4-80GB",
          "operator": "cross_entropy"
        },
        {
          "config_id": "bs256_w8_s1",
          "config": {
            "BLOCK_SIZE": 256,
            "num_warps": 8,
            "num_stages": 1
          },
          "tflops": 716.71,
          "ms": 0.1436,
          "correct": true,
          "run_id": "bs256_w8_s1",
          "hardware": "NVIDIA A100-SXM4-80GB",
          "operator": "cross_entropy"
        },
        {
          "config_id": "bs256_w8_s2",
          "config": {
            "BLOCK_SIZE": 256,
            "num_warps": 8,
            "num_stages": 2
          },
          "tflops": 716.91,
          "ms": 0.1436,
          "correct": true,
          "run_id": "bs256_w8_s2",
          "hardware": "NVIDIA A100-SXM4-80GB",
          "operator": "cross_entropy"
        },
        {
          "config_id": "bs256_w16_s1",
          "config": {
            "BLOCK_SIZE": 256,
            "num_warps": 16,
            "num_stages": 1
          },
          "tflops": 738.63,
          "ms": 0.1394,
          "correct": true,
          "run_id": "bs256_w16_s1",
          "hardware": "NVIDIA A100-SXM4-80GB",
          "operator": "cross_entropy"
        }
      ]
    },
    "cross_entropy:gpt2_med:NVIDIA A100-SXM4-80GB": {
      "shape_key": "cross_entropy:gpt2_med:NVIDIA A100-SXM4-80GB",
      "shape": {
        "n_rows": 2048,
        "n_cols": 50257,
        "bucket": "gpt2_med"
      },
      "best_config_id": "bs32768_w16_s1",
      "best_tflops": 828.07,
      "results": [
        {
          "config_id": "bs4096_w8_s1",
          "config": {
            "BLOCK_SIZE": 4096,
            "num_warps": 8,
            "num_stages": 1
          },
          "tflops": 725.83,
          "ms": 0.2836,
          "correct": true,
          "run_id": "bs4096_w8_s1",
          "hardware": "NVIDIA A100-SXM4-80GB",
          "operator": "cross_entropy"
        },
        {
          "config_id": "bs8192_w16_s1",
          "config": {
            "BLOCK_SIZE": 8192,
            "num_warps": 16,
            "num_stages": 1
          },
          "tflops": 826.32,
          "ms": 0.2491,
          "correct": true,
          "run_id": "bs8192_w16_s1",
          "hardware": "NVIDIA A100-SXM4-80GB",
          "operator": "cross_entropy"
        },
        {
          "config_id": "bs16384_w16_s1",
          "config": {
            "BLOCK_SIZE": 16384,
            "num_warps": 16,
            "num_stages": 1
          },
          "tflops": 828.04,
          "ms": 0.2486,
          "correct": true,
          "run_id": "bs16384_w16_s1",
          "hardware": "NVIDIA A100-SXM4-80GB",
          "operator": "cross_entropy"
        },
        {
          "config_id": "bs32768_w16_s1",
          "config": {
            "BLOCK_SIZE": 32768,
            "num_warps": 16,
            "num_stages": 1
          },
          "tflops": 828.07,
          "ms": 0.2486,
          "correct": true,
          "run_id": "bs32768_w16_s1",
          "hardware": "NVIDIA A100-SXM4-80GB",
          "operator": "cross_entropy"
        },
        {
          "config_id": "bs2048_w4_s2",
          "config": {
            "BLOCK_SIZE": 2048,
            "num_warps": 4,
            "num_stages": 2
          },
          "tflops": 73.0,
          "ms": 2.8202,
          "correct": true,
          "run_id": "bs2048_w4_s2",
          "hardware": "NVIDIA A100-SXM4-80GB",
          "operator": "cross_entropy"
        },
        {
          "config_id": "bs4096_w16_s1",
          "config": {
            "BLOCK_SIZE": 4096,
            "num_warps": 16,
            "num_stages": 1
          },
          "tflops": 828.04,
          "ms": 0.2486,
          "correct": true,
          "run_id": "bs4096_w16_s1",
          "hardware": "NVIDIA A100-SXM4-80GB",
          "operator": "cross_entropy"
        },
        {
          "config_id": "bs1024_w2_s2",
          "config": {
            "BLOCK_SIZE": 1024,
            "num_warps": 2,
            "num_stages": 2
          },
          "tflops": 74.59,
          "ms": 2.7602,
          "correct": true,
          "run_id": "bs1024_w2_s2",
          "hardware": "NVIDIA A100-SXM4-80GB",
          "operator": "cross_entropy"
        },
        {
          "config_id": "bs256_w1_s1",
          "config": {
            "BLOCK_SIZE": 256,
            "num_warps": 1,
            "num_stages": 1
          },
          "tflops": 69.03,
          "ms": 2.9824,
          "correct": true,
          "run_id": "bs256_w1_s1",
          "hardware": "NVIDIA A100-SXM4-80GB",
          "operator": "cross_entropy"
        },
        {
          "config_id": "bs256_w1_s2",
          "config": {
            "BLOCK_SIZE": 256,
            "num_warps": 1,
            "num_stages": 2
          },
          "tflops": 67.57,
          "ms": 3.0466,
          "correct": true,
          "run_id": "bs256_w1_s2",
          "hardware": "NVIDIA A100-SXM4-80GB",
          "operator": "cross_entropy"
        },
        {
          "config_id": "bs256_w2_s1",
          "config": {
            "BLOCK_SIZE": 256,
            "num_warps": 2,
            "num_stages": 1
          },
          "tflops": 74.91,
          "ms": 2.7483,
          "correct": true,
          "run_id": "bs256_w2_s1",
          "hardware": "NVIDIA A100-SXM4-80GB",
          "operator": "cross_entropy"
        },
        {
          "config_id": "bs256_w2_s2",
          "config": {
            "BLOCK_SIZE": 256,
            "num_warps": 2,
            "num_stages": 2
          },
          "tflops": 75.56,
          "ms": 2.7247,
          "correct": true,
          "run_id": "bs256_w2_s2",
          "hardware": "NVIDIA A100-SXM4-80GB",
          "operator": "cross_entropy"
        },
        {
          "config_id": "bs256_w4_s1",
          "config": {
            "BLOCK_SIZE": 256,
            "num_warps": 4,
            "num_stages": 1
          },
          "tflops": 73.16,
          "ms": 2.814,
          "correct": true,
          "run_id": "bs256_w4_s1",
          "hardware": "NVIDIA A100-SXM4-80GB",
          "operator": "cross_entropy"
        },
        {
          "config_id": "bs256_w4_s2",
          "config": {
            "BLOCK_SIZE": 256,
            "num_warps": 4,
            "num_stages": 2
          },
          "tflops": 75.01,
          "ms": 2.7445,
          "correct": true,
          "run_id": "bs256_w4_s2",
          "hardware": "NVIDIA A100-SXM4-80GB",
          "operator": "cross_entropy"
        },
        {
          "config_id": "bs256_w8_s1",
          "config": {
            "BLOCK_SIZE": 256,
            "num_warps": 8,
            "num_stages": 1
          },
          "tflops": 799.23,
          "ms": 0.2576,
          "correct": true,
          "run_id": "bs256_w8_s1",
          "hardware": "NVIDIA A100-SXM4-80GB",
          "operator": "cross_entropy"
        },
        {
          "config_id": "bs256_w8_s2",
          "config": {
            "BLOCK_SIZE": 256,
            "num_warps": 8,
            "num_stages": 2
          },
          "tflops": 799.16,
          "ms": 0.2576,
          "correct": true,
          "run_id": "bs256_w8_s2",
          "hardware": "NVIDIA A100-SXM4-80GB",
          "operator": "cross_entropy"
        },
        {
          "config_id": "bs256_w16_s1",
          "config": {
            "BLOCK_SIZE": 256,
            "num_warps": 16,
            "num_stages": 1
          },
          "tflops": 826.22,
          "ms": 0.2492,
          "correct": true,
          "run_id": "bs256_w16_s1",
          "hardware": "NVIDIA A100-SXM4-80GB",
          "operator": "cross_entropy"
        }
      ]
    },
    "cross_entropy:llama_32k_long:NVIDIA A100-SXM4-80GB": {
      "shape_key": "cross_entropy:llama_32k_long:NVIDIA A100-SXM4-80GB",
      "shape": {
        "n_rows": 2048,
        "n_cols": 32000,
        "bucket": "llama_32k_long"
      },
      "best_config_id": "bs16384_w16_s1",
      "best_tflops": 1179.72,
      "results": [
        {
          "config_id": "bs4096_w8_s1",
          "config": {
            "BLOCK_SIZE": 4096,
            "num_warps": 8,
            "num_stages": 1
          },
          "tflops": 1085.28,
          "ms": 0.1208,
          "correct": true,
          "run_id": "bs4096_w8_s1",
          "hardware": "NVIDIA A100-SXM4-80GB",
          "operator": "cross_entropy"
        },
        {
          "config_id": "bs8192_w16_s1",
          "config": {
            "BLOCK_SIZE": 8192,
            "num_warps": 16,
            "num_stages": 1
          },
          "tflops": 1179.37,
          "ms": 0.1112,
          "correct": true,
          "run_id": "bs8192_w16_s1",
          "hardware": "NVIDIA A100-SXM4-80GB",
          "operator": "cross_entropy"
        },
        {
          "config_id": "bs16384_w16_s1",
          "config": {
            "BLOCK_SIZE": 16384,
            "num_warps": 16,
            "num_stages": 1
          },
          "tflops": 1179.72,
          "ms": 0.1111,
          "correct": true,
          "run_id": "bs16384_w16_s1",
          "hardware": "NVIDIA A100-SXM4-80GB",
          "operator": "cross_entropy"
        },
        {
          "config_id": "bs32768_w16_s1",
          "config": {
            "BLOCK_SIZE": 32768,
            "num_warps": 16,
            "num_stages": 1
          },
          "tflops": 1169.74,
          "ms": 0.1121,
          "correct": true,
          "run_id": "bs32768_w16_s1",
          "hardware": "NVIDIA A100-SXM4-80GB",
          "operator": "cross_entropy"
        },
        {
          "config_id": "bs2048_w4_s2",
          "config": {
            "BLOCK_SIZE": 2048,
            "num_warps": 4,
            "num_stages": 2
          },
          "tflops": 1170.92,
          "ms": 0.112,
          "correct": true,
          "run_id": "bs2048_w4_s2",
          "hardware": "NVIDIA A100-SXM4-80GB",
          "operator": "cross_entropy"
        },
        {
          "config_id": "bs4096_w16_s1",
          "config": {
            "BLOCK_SIZE": 4096,
            "num_warps": 16,
            "num_stages": 1
          },
          "tflops": 1172.53,
          "ms": 0.1118,
          "correct": true,
          "run_id": "bs4096_w16_s1",
          "hardware": "NVIDIA A100-SXM4-80GB",
          "operator": "cross_entropy"
        },
        {
          "config_id": "bs1024_w2_s2",
          "config": {
            "BLOCK_SIZE": 1024,
            "num_warps": 2,
            "num_stages": 2
          },
          "tflops": 362.83,
          "ms": 0.3613,
          "correct": true,
          "run_id": "bs1024_w2_s2",
          "hardware": "NVIDIA A100-SXM4-80GB",
          "operator": "cross_entropy"
        },
        {
          "config_id": "bs256_w1_s1",
          "config": {
            "BLOCK_SIZE": 256,
            "num_warps": 1,
            "num_stages": 1
          },
          "tflops": 287.89,
          "ms": 0.4554,
          "correct": true,
          "run_id": "bs256_w1_s1",
          "hardware": "NVIDIA A100-SXM4-80GB",
          "operator": "cross_entropy"
        },
        {
          "config_id": "bs256_w1_s2",
          "config": {
            "BLOCK_SIZE": 256,
            "num_warps": 1,
            "num_stages": 2
          },
          "tflops": 290.09,
          "ms": 0.4519,
          "correct": true,
          "run_id": "bs256_w1_s2",
          "hardware": "NVIDIA A100-SXM4-80GB",
          "operator": "cross_entropy"
        },
        {
          "config_id": "bs256_w2_s1",
          "config": {
            "BLOCK_SIZE": 256,
            "num_warps": 2,
            "num_stages": 1
          },
          "tflops": 362.32,
          "ms": 0.3618,
          "correct": true,
          "run_id": "bs256_w2_s1",
          "hardware": "NVIDIA A100-SXM4-80GB",
          "operator": "cross_entropy"
        },
        {
          "config_id": "bs256_w2_s2",
          "config": {
            "BLOCK_SIZE": 256,
            "num_warps": 2,
            "num_stages": 2
          },
          "tflops": 361.79,
          "ms": 0.3623,
          "correct": true,
          "run_id": "bs256_w2_s2",
          "hardware": "NVIDIA A100-SXM4-80GB",
          "operator": "cross_entropy"
        },
        {
          "config_id": "bs256_w4_s1",
          "config": {
            "BLOCK_SIZE": 256,
            "num_warps": 4,
            "num_stages": 1
          },
          "tflops": 1170.67,
          "ms": 0.112,
          "correct": true,
          "run_id": "bs256_w4_s1",
          "hardware": "NVIDIA A100-SXM4-80GB",
          "operator": "cross_entropy"
        },
        {
          "config_id": "bs256_w4_s2",
          "config": {
            "BLOCK_SIZE": 256,
            "num_warps": 4,
            "num_stages": 2
          },
          "tflops": 1162.08,
          "ms": 0.1128,
          "correct": true,
          "run_id": "bs256_w4_s2",
          "hardware": "NVIDIA A100-SXM4-80GB",
          "operator": "cross_entropy"
        },
        {
          "config_id": "bs256_w8_s1",
          "config": {
            "BLOCK_SIZE": 256,
            "num_warps": 8,
            "num_stages": 1
          },
          "tflops": 1083.66,
          "ms": 0.121,
          "correct": true,
          "run_id": "bs256_w8_s1",
          "hardware": "NVIDIA A100-SXM4-80GB",
          "operator": "cross_entropy"
        },
        {
          "config_id": "bs256_w8_s2",
          "config": {
            "BLOCK_SIZE": 256,
            "num_warps": 8,
            "num_stages": 2
          },
          "tflops": 1090.04,
          "ms": 0.1203,
          "correct": true,
          "run_id": "bs256_w8_s2",
          "hardware": "NVIDIA A100-SXM4-80GB",
          "operator": "cross_entropy"
        },
        {
          "config_id": "bs256_w16_s1",
          "config": {
            "BLOCK_SIZE": 256,
            "num_warps": 16,
            "num_stages": 1
          },
          "tflops": 1171.58,
          "ms": 0.1119,
          "correct": true,
          "run_id": "bs256_w16_s1",
          "hardware": "NVIDIA A100-SXM4-80GB",
          "operator": "cross_entropy"
        }
      ]
    },
    "cross_entropy:mistral:NVIDIA A100-SXM4-80GB": {
      "shape_key": "cross_entropy:mistral:NVIDIA A100-SXM4-80GB",
      "shape": {
        "n_rows": 4096,
        "n_cols": 32000,
        "bucket": "mistral"
      },
      "best_config_id": "bs2048_w4_s2",
      "best_tflops": 1372.48,
      "results": [
        {
          "config_id": "bs4096_w8_s1",
          "config": {
            "BLOCK_SIZE": 4096,
            "num_warps": 8,
            "num_stages": 1
          },
          "tflops": 1166.01,
          "ms": 0.2249,
          "correct": true,
          "run_id": "bs4096_w8_s1",
          "hardware": "NVIDIA A100-SXM4-80GB",
          "operator": "cross_entropy"
        },
        {
          "config_id": "bs4096_w8_s1",
          "config": {
            "BLOCK_SIZE": 4096,
            "num_warps": 8,
            "num_stages": 1
          },
          "tflops": 1164.36,
          "ms": 0.2252,
          "correct": true,
          "run_id": "bs4096_w8_s1",
          "hardware": "NVIDIA A100-SXM4-80GB",
          "operator": "cross_entropy"
        },
        {
          "config_id": "bs8192_w16_s1",
          "config": {
            "BLOCK_SIZE": 8192,
            "num_warps": 16,
            "num_stages": 1
          },
          "tflops": 1314.12,
          "ms": 0.1995,
          "correct": true,
          "run_id": "bs8192_w16_s1",
          "hardware": "NVIDIA A100-SXM4-80GB",
          "operator": "cross_entropy"
        },
        {
          "config_id": "bs8192_w16_s1",
          "config": {
            "BLOCK_SIZE": 8192,
            "num_warps": 16,
            "num_stages": 1
          },
          "tflops": 1317.37,
          "ms": 0.199,
          "correct": true,
          "run_id": "bs8192_w16_s1",
          "hardware": "NVIDIA A100-SXM4-80GB",
          "operator": "cross_entropy"
        },
        {
          "config_id": "bs16384_w16_s1",
          "config": {
            "BLOCK_SIZE": 16384,
            "num_warps": 16,
            "num_stages": 1
          },
          "tflops": 1314.1,
          "ms": 0.1995,
          "correct": true,
          "run_id": "bs16384_w16_s1",
          "hardware": "NVIDIA A100-SXM4-80GB",
          "operator": "cross_entropy"
        },
        {
          "config_id": "bs16384_w16_s1",
          "config": {
            "BLOCK_SIZE": 16384,
            "num_warps": 16,
            "num_stages": 1
          },
          "tflops": 1318.08,
          "ms": 0.1989,
          "correct": true,
          "run_id": "bs16384_w16_s1",
          "hardware": "NVIDIA A100-SXM4-80GB",
          "operator": "cross_entropy"
        },
        {
          "config_id": "bs32768_w16_s1",
          "config": {
            "BLOCK_SIZE": 32768,
            "num_warps": 16,
            "num_stages": 1
          },
          "tflops": 1317.04,
          "ms": 0.1991,
          "correct": true,
          "run_id": "bs32768_w16_s1",
          "hardware": "NVIDIA A100-SXM4-80GB",
          "operator": "cross_entropy"
        },
        {
          "config_id": "bs32768_w16_s1",
          "config": {
            "BLOCK_SIZE": 32768,
            "num_warps": 16,
            "num_stages": 1
          },
          "tflops": 1313.88,
          "ms": 0.1996,
          "correct": true,
          "run_id": "bs32768_w16_s1",
          "hardware": "NVIDIA A100-SXM4-80GB",
          "operator": "cross_entropy"
        },
        {
          "config_id": "bs2048_w4_s2",
          "config": {
            "BLOCK_SIZE": 2048,
            "num_warps": 4,
            "num_stages": 2
          },
          "tflops": 1372.48,
          "ms": 0.191,
          "correct": true,
          "run_id": "bs2048_w4_s2",
          "hardware": "NVIDIA A100-SXM4-80GB",
          "operator": "cross_entropy"
        },
        {
          "config_id": "bs2048_w4_s2",
          "config": {
            "BLOCK_SIZE": 2048,
            "num_warps": 4,
            "num_stages": 2
          },
          "tflops": 1367.07,
          "ms": 0.1918,
          "correct": true,
          "run_id": "bs2048_w4_s2",
          "hardware": "NVIDIA A100-SXM4-80GB",
          "operator": "cross_entropy"
        },
        {
          "config_id": "bs4096_w16_s1",
          "config": {
            "BLOCK_SIZE": 4096,
            "num_warps": 16,
            "num_stages": 1
          },
          "tflops": 1314.53,
          "ms": 0.1995,
          "correct": true,
          "run_id": "bs4096_w16_s1",
          "hardware": "NVIDIA A100-SXM4-80GB",
          "operator": "cross_entropy"
        },
        {
          "config_id": "bs4096_w16_s1",
          "config": {
            "BLOCK_SIZE": 4096,
            "num_warps": 16,
            "num_stages": 1
          },
          "tflops": 1313.25,
          "ms": 0.1996,
          "correct": true,
          "run_id": "bs4096_w16_s1",
          "hardware": "NVIDIA A100-SXM4-80GB",
          "operator": "cross_entropy"
        },
        {
          "config_id": "bs1024_w2_s2",
          "config": {
            "BLOCK_SIZE": 1024,
            "num_warps": 2,
            "num_stages": 2
          },
          "tflops": 384.85,
          "ms": 0.6813,
          "correct": true,
          "run_id": "bs1024_w2_s2",
          "hardware": "NVIDIA A100-SXM4-80GB",
          "operator": "cross_entropy"
        },
        {
          "config_id": "bs1024_w2_s2",
          "config": {
            "BLOCK_SIZE": 1024,
            "num_warps": 2,
            "num_stages": 2
          },
          "tflops": 384.67,
          "ms": 0.6816,
          "correct": true,
          "run_id": "bs1024_w2_s2",
          "hardware": "NVIDIA A100-SXM4-80GB",
          "operator": "cross_entropy"
        },
        {
          "config_id": "bs256_w1_s1",
          "config": {
            "BLOCK_SIZE": 256,
            "num_warps": 1,
            "num_stages": 1
          },
          "tflops": 297.1,
          "ms": 0.8825,
          "correct": true,
          "run_id": "bs256_w1_s1",
          "hardware": "NVIDIA A100-SXM4-80GB",
          "operator": "cross_entropy"
        },
        {
          "config_id": "bs256_w1_s1",
          "config": {
            "BLOCK_SIZE": 256,
            "num_warps": 1,
            "num_stages": 1
          },
          "tflops": 304.97,
          "ms": 0.8597,
          "correct": true,
          "run_id": "bs256_w1_s1",
          "hardware": "NVIDIA A100-SXM4-80GB",
          "operator": "cross_entropy"
        },
        {
          "config_id": "bs256_w1_s2",
          "config": {
            "BLOCK_SIZE": 256,
            "num_warps": 1,
            "num_stages": 2
          },
          "tflops": 303.06,
          "ms": 0.8651,
          "correct": true,
          "run_id": "bs256_w1_s2",
          "hardware": "NVIDIA A100-SXM4-80GB",
          "operator": "cross_entropy"
        },
        {
          "config_id": "bs256_w1_s2",
          "config": {
            "BLOCK_SIZE": 256,
            "num_warps": 1,
            "num_stages": 2
          },
          "tflops": 302.89,
          "ms": 0.8656,
          "correct": true,
          "run_id": "bs256_w1_s2",
          "hardware": "NVIDIA A100-SXM4-80GB",
          "operator": "cross_entropy"
        },
        {
          "config_id": "bs256_w2_s1",
          "config": {
            "BLOCK_SIZE": 256,
            "num_warps": 2,
            "num_stages": 1
          },
          "tflops": 383.35,
          "ms": 0.6839,
          "correct": true,
          "run_id": "bs256_w2_s1",
          "hardware": "NVIDIA A100-SXM4-80GB",
          "operator": "cross_entropy"
        },
        {
          "config_id": "bs256_w2_s1",
          "config": {
            "BLOCK_SIZE": 256,
            "num_warps": 2,
            "num_stages": 1
          },
          "tflops": 368.89,
          "ms": 0.7107,
          "correct": true,
          "run_id": "bs256_w2_s1",
          "hardware": "NVIDIA A100-SXM4-80GB",
          "operator": "cross_entropy"
        },
        {
          "config_id": "bs256_w2_s2",
          "config": {
            "BLOCK_SIZE": 256,
            "num_warps": 2,
            "num_stages": 2
          },
          "tflops": 382.77,
          "ms": 0.685,
          "correct": true,
          "run_id": "bs256_w2_s2",
          "hardware": "NVIDIA A100-SXM4-80GB",
          "operator": "cross_entropy"
        },
        {
          "config_id": "bs256_w2_s2",
          "config": {
            "BLOCK_SIZE": 256,
            "num_warps": 2,
            "num_stages": 2
          },
          "tflops": 382.72,
          "ms": 0.6851,
          "correct": true,
          "run_id": "bs256_w2_s2",
          "hardware": "NVIDIA A100-SXM4-80GB",
          "operator": "cross_entropy"
        },
        {
          "config_id": "bs256_w4_s1",
          "config": {
            "BLOCK_SIZE": 256,
            "num_warps": 4,
            "num_stages": 1
          },
          "tflops": 1365.85,
          "ms": 0.192,
          "correct": true,
          "run_id": "bs256_w4_s1",
          "hardware": "NVIDIA A100-SXM4-80GB",
          "operator": "cross_entropy"
        },
        {
          "config_id": "bs256_w4_s1",
          "config": {
            "BLOCK_SIZE": 256,
            "num_warps": 4,
            "num_stages": 1
          },
          "tflops": 1361.2,
          "ms": 0.1926,
          "correct": true,
          "run_id": "bs256_w4_s1",
          "hardware": "NVIDIA A100-SXM4-80GB",
          "operator": "cross_entropy"
        },
        {
          "config_id": "bs256_w4_s2",
          "config": {
            "BLOCK_SIZE": 256,
            "num_warps": 4,
            "num_stages": 2
          },
          "tflops": 1359.51,
          "ms": 0.1929,
          "correct": true,
          "run_id": "bs256_w4_s2",
          "hardware": "NVIDIA A100-SXM4-80GB",
          "operator": "cross_entropy"
        },
        {
          "config_id": "bs256_w4_s2",
          "config": {
            "BLOCK_SIZE": 256,
            "num_warps": 4,
            "num_stages": 2
          },
          "tflops": 1364.96,
          "ms": 0.1921,
          "correct": true,
          "run_id": "bs256_w4_s2",
          "hardware": "NVIDIA A100-SXM4-80GB",
          "operator": "cross_entropy"
        },
        {
          "config_id": "bs256_w8_s1",
          "config": {
            "BLOCK_SIZE": 256,
            "num_warps": 8,
            "num_stages": 1
          },
          "tflops": 1159.22,
          "ms": 0.2262,
          "correct": true,
          "run_id": "bs256_w8_s1",
          "hardware": "NVIDIA A100-SXM4-80GB",
          "operator": "cross_entropy"
        },
        {
          "config_id": "bs256_w8_s1",
          "config": {
            "BLOCK_SIZE": 256,
            "num_warps": 8,
            "num_stages": 1
          },
          "tflops": 1161.85,
          "ms": 0.2257,
          "correct": true,
          "run_id": "bs256_w8_s1",
          "hardware": "NVIDIA A100-SXM4-80GB",
          "operator": "cross_entropy"
        },
        {
          "config_id": "bs256_w8_s2",
          "config": {
            "BLOCK_SIZE": 256,
            "num_warps": 8,
            "num_stages": 2
          },
          "tflops": 1168.52,
          "ms": 0.2244,
          "correct": true,
          "run_id": "bs256_w8_s2",
          "hardware": "NVIDIA A100-SXM4-80GB",
          "operator": "cross_entropy"
        },
        {
          "config_id": "bs256_w8_s2",
          "config": {
            "BLOCK_SIZE": 256,
            "num_warps": 8,
            "num_stages": 2
          },
          "tflops": 1161.8,
          "ms": 0.2257,
          "correct": true,
          "run_id": "bs256_w8_s2",
          "hardware": "NVIDIA A100-SXM4-80GB",
          "operator": "cross_entropy"
        },
        {
          "config_id": "bs256_w16_s1",
          "config": {
            "BLOCK_SIZE": 256,
            "num_warps": 16,
            "num_stages": 1
          },
          "tflops": 1317.71,
          "ms": 0.199,
          "correct": true,
          "run_id": "bs256_w16_s1",
          "hardware": "NVIDIA A100-SXM4-80GB",
          "operator": "cross_entropy"
        },
        {
          "config_id": "bs256_w16_s1",
          "config": {
            "BLOCK_SIZE": 256,
            "num_warps": 16,
            "num_stages": 1
          },
          "tflops": 1314.07,
          "ms": 0.1995,
          "correct": true,
          "run_id": "bs256_w16_s1",
          "hardware": "NVIDIA A100-SXM4-80GB",
          "operator": "cross_entropy"
        }
      ]
    },
    "cross_entropy:llama3_128k:NVIDIA A100-SXM4-80GB": {
      "shape_key": "cross_entropy:llama3_128k:NVIDIA A100-SXM4-80GB",
      "shape": {
        "n_rows": 2048,
        "n_cols": 128256,
        "bucket": "llama3_128k"
      },
      "best_config_id": "bs256_w8_s1",
      "best_tflops": 314.41,
      "results": [
        {
          "config_id": "bs4096_w8_s1",
          "config": {
            "BLOCK_SIZE": 4096,
            "num_warps": 8,
            "num_stages": 1
          },
          "tflops": 313.03,
          "ms": 1.6783,
          "correct": true,
          "run_id": "bs4096_w8_s1",
          "hardware": "NVIDIA A100-SXM4-80GB",
          "operator": "cross_entropy"
        },
        {
          "config_id": "bs8192_w16_s1",
          "config": {
            "BLOCK_SIZE": 8192,
            "num_warps": 16,
            "num_stages": 1
          },
          "tflops": 290.59,
          "ms": 1.8079,
          "correct": true,
          "run_id": "bs8192_w16_s1",
          "hardware": "NVIDIA A100-SXM4-80GB",
          "operator": "cross_entropy"
        },
        {
          "config_id": "bs16384_w16_s1",
          "config": {
            "BLOCK_SIZE": 16384,
            "num_warps": 16,
            "num_stages": 1
          },
          "tflops": 290.63,
          "ms": 1.8076,
          "correct": true,
          "run_id": "bs16384_w16_s1",
          "hardware": "NVIDIA A100-SXM4-80GB",
          "operator": "cross_entropy"
        },
        {
          "config_id": "bs32768_w16_s1",
          "config": {
            "BLOCK_SIZE": 32768,
            "num_warps": 16,
            "num_stages": 1
          },
          "tflops": 290.65,
          "ms": 1.8075,
          "correct": true,
          "run_id": "bs32768_w16_s1",
          "hardware": "NVIDIA A100-SXM4-80GB",
          "operator": "cross_entropy"
        },
        {
          "config_id": "bs2048_w4_s2",
          "config": {
            "BLOCK_SIZE": 2048,
            "num_warps": 4,
            "num_stages": 2
          },
          "tflops": 145.8,
          "ms": 3.6033,
          "correct": true,
          "run_id": "bs2048_w4_s2",
          "hardware": "NVIDIA A100-SXM4-80GB",
          "operator": "cross_entropy"
        },
        {
          "config_id": "bs4096_w16_s1",
          "config": {
            "BLOCK_SIZE": 4096,
            "num_warps": 16,
            "num_stages": 1
          },
          "tflops": 291.54,
          "ms": 1.802,
          "correct": true,
          "run_id": "bs4096_w16_s1",
          "hardware": "NVIDIA A100-SXM4-80GB",
          "operator": "cross_entropy"
        },
        {
          "config_id": "bs1024_w2_s2",
          "config": {
            "BLOCK_SIZE": 1024,
            "num_warps": 2,
            "num_stages": 2
          },
          "tflops": 142.68,
          "ms": 3.6822,
          "correct": true,
          "run_id": "bs1024_w2_s2",
          "hardware": "NVIDIA A100-SXM4-80GB",
          "operator": "cross_entropy"
        },
        {
          "config_id": "bs256_w1_s1",
          "config": {
            "BLOCK_SIZE": 256,
            "num_warps": 1,
            "num_stages": 1
          },
          "tflops": 260.49,
          "ms": 2.0168,
          "correct": true,
          "run_id": "bs256_w1_s1",
          "hardware": "NVIDIA A100-SXM4-80GB",
          "operator": "cross_entropy"
        },
        {
          "config_id": "bs256_w1_s2",
          "config": {
            "BLOCK_SIZE": 256,
            "num_warps": 1,
            "num_stages": 2
          },
          "tflops": 266.01,
          "ms": 1.975,
          "correct": true,
          "run_id": "bs256_w1_s2",
          "hardware": "NVIDIA A100-SXM4-80GB",
          "operator": "cross_entropy"
        },
        {
          "config_id": "bs256_w2_s1",
          "config": {
            "BLOCK_SIZE": 256,
            "num_warps": 2,
            "num_stages": 1
          },
          "tflops": 141.73,
          "ms": 3.7067,
          "correct": true,
          "run_id": "bs256_w2_s1",
          "hardware": "NVIDIA A100-SXM4-80GB",
          "operator": "cross_entropy"
        },
        {
          "config_id": "bs256_w2_s2",
          "config": {
            "BLOCK_SIZE": 256,
            "num_warps": 2,
            "num_stages": 2
          },
          "tflops": 145.95,
          "ms": 3.5997,
          "correct": true,
          "run_id": "bs256_w2_s2",
          "hardware": "NVIDIA A100-SXM4-80GB",
          "operator": "cross_entropy"
        },
        {
          "config_id": "bs256_w4_s1",
          "config": {
            "BLOCK_SIZE": 256,
            "num_warps": 4,
            "num_stages": 1
          },
          "tflops": 146.66,
          "ms": 3.5822,
          "correct": true,
          "run_id": "bs256_w4_s1",
          "hardware": "NVIDIA A100-SXM4-80GB",
          "operator": "cross_entropy"
        },
        {
          "config_id": "bs256_w4_s2",
          "config": {
            "BLOCK_SIZE": 256,
            "num_warps": 4,
            "num_stages": 2
          },
          "tflops": 149.29,
          "ms": 3.519,
          "correct": true,
          "run_id": "bs256_w4_s2",
          "hardware": "NVIDIA A100-SXM4-80GB",
          "operator": "cross_entropy"
        },
        {
          "config_id": "bs256_w8_s1",
          "config": {
            "BLOCK_SIZE": 256,
            "num_warps": 8,
            "num_stages": 1
          },
          "tflops": 314.41,
          "ms": 1.6709,
          "correct": true,
          "run_id": "bs256_w8_s1",
          "hardware": "NVIDIA A100-SXM4-80GB",
          "operator": "cross_entropy"
        },
        {
          "config_id": "bs256_w8_s2",
          "config": {
            "BLOCK_SIZE": 256,
            "num_warps": 8,
            "num_stages": 2
          },
          "tflops": 313.96,
          "ms": 1.6733,
          "correct": true,
          "run_id": "bs256_w8_s2",
          "hardware": "NVIDIA A100-SXM4-80GB",
          "operator": "cross_entropy"
        },
        {
          "config_id": "bs256_w16_s1",
          "config": {
            "BLOCK_SIZE": 256,
            "num_warps": 16,
            "num_stages": 1
          },
          "tflops": 291.43,
          "ms": 1.8027,
          "correct": true,
          "run_id": "bs256_w16_s1",
          "hardware": "NVIDIA A100-SXM4-80GB",
          "operator": "cross_entropy"
        }
      ]
    },
    "matmul:small:NVIDIA A100-SXM4-80GB": {
      "shape_key": "matmul:small:NVIDIA A100-SXM4-80GB",
      "shape": {
        "M": 128,
        "N": 128,
        "K": 128,
        "bucket": "small"
      },
      "best_config_id": "bm64_bn32_bk32_gm8_w2_s5",
      "best_tflops": 0.51,
      "results": [
        {
          "config_id": "bm128_bn256_bk64_gm8_w8_s3",
          "config": {
            "BLOCK_SIZE_M": 128,
            "BLOCK_SIZE_N": 256,
            "BLOCK_SIZE_K": 64,
            "GROUP_SIZE_M": 8,
            "num_warps": 8,
            "num_stages": 3
          },
          "tflops": 0.25,
          "ms": 0.0167,
          "correct": true,
          "run_id": "bm128_bn256_bk64_gm8_w8_s3",
          "hardware": "NVIDIA A100-SXM4-80GB",
          "operator": "matmul"
        },
        {
          "config_id": "bm64_bn256_bk32_gm8_w4_s4",
          "config": {
            "BLOCK_SIZE_M": 64,
            "BLOCK_SIZE_N": 256,
            "BLOCK_SIZE_K": 32,
            "GROUP_SIZE_M": 8,
            "num_warps": 4,
            "num_stages": 4
          },
          "tflops": 0.36,
          "ms": 0.0115,
          "correct": true,
          "run_id": "bm64_bn256_bk32_gm8_w4_s4",
          "hardware": "NVIDIA A100-SXM4-80GB",
          "operator": "matmul"
        },
        {
          "config_id": "bm128_bn128_bk32_gm8_w4_s4",
          "config": {
            "BLOCK_SIZE_M": 128,
            "BLOCK_SIZE_N": 128,
            "BLOCK_SIZE_K": 32,
            "GROUP_SIZE_M": 8,
            "num_warps": 4,
            "num_stages": 4
          },
          "tflops": 0.39,
          "ms": 0.0107,
          "correct": true,
          "run_id": "bm128_bn128_bk32_gm8_w4_s4",
          "hardware": "NVIDIA A100-SXM4-80GB",
          "operator": "matmul"
        },
        {
          "config_id": "bm128_bn64_bk32_gm8_w4_s4",
          "config": {
            "BLOCK_SIZE_M": 128,
            "BLOCK_SIZE_N": 64,
            "BLOCK_SIZE_K": 32,
            "GROUP_SIZE_M": 8,
            "num_warps": 4,
            "num_stages": 4
          },
          "tflops": 0.44,
          "ms": 0.0094,
          "correct": true,
          "run_id": "bm128_bn64_bk32_gm8_w4_s4",
          "hardware": "NVIDIA A100-SXM4-80GB",
          "operator": "matmul"
        },
        {
          "config_id": "bm64_bn128_bk32_gm8_w4_s4",
          "config": {
            "BLOCK_SIZE_M": 64,
            "BLOCK_SIZE_N": 128,
            "BLOCK_SIZE_K": 32,
            "GROUP_SIZE_M": 8,
            "num_warps": 4,
            "num_stages": 4
          },
          "tflops": 0.45,
          "ms": 0.0094,
          "correct": true,
          "run_id": "bm64_bn128_bk32_gm8_w4_s4",
          "hardware": "NVIDIA A100-SXM4-80GB",
          "operator": "matmul"
        },
        {
          "config_id": "bm128_bn32_bk32_gm8_w4_s4",
          "config": {
            "BLOCK_SIZE_M": 128,
            "BLOCK_SIZE_N": 32,
            "BLOCK_SIZE_K": 32,
            "GROUP_SIZE_M": 8,
            "num_warps": 4,
            "num_stages": 4
          },
          "tflops": 0.44,
          "ms": 0.0096,
          "correct": true,
          "run_id": "bm128_bn32_bk32_gm8_w4_s4",
          "hardware": "NVIDIA A100-SXM4-80GB",
          "operator": "matmul"
        },
        {
          "config_id": "bm64_bn32_bk32_gm8_w2_s5",
          "config": {
            "BLOCK_SIZE_M": 64,
            "BLOCK_SIZE_N": 32,
            "BLOCK_SIZE_K": 32,
            "GROUP_SIZE_M": 8,
            "num_warps": 2,
            "num_stages": 5
          },
          "tflops": 0.51,
          "ms": 0.0083,
          "correct": true,
          "run_id": "bm64_bn32_bk32_gm8_w2_s5",
          "hardware": "NVIDIA A100-SXM4-80GB",
          "operator": "matmul"
        },
        {
          "config_id": "bm32_bn64_bk32_gm8_w2_s5",
          "config": {
            "BLOCK_SIZE_M": 32,
            "BLOCK_SIZE_N": 64,
            "BLOCK_SIZE_K": 32,
            "GROUP_SIZE_M": 8,
            "num_warps": 2,
            "num_stages": 5
          },
          "tflops": 0.51,
          "ms": 0.0083,
          "correct": true,
          "run_id": "bm32_bn64_bk32_gm8_w2_s5",
          "hardware": "NVIDIA A100-SXM4-80GB",
          "operator": "matmul"
        },
        {
          "config_id": "bm256_bn128_bk64_gm8_w8_s3",
          "config": {
            "BLOCK_SIZE_M": 256,
            "BLOCK_SIZE_N": 128,
            "BLOCK_SIZE_K": 64,
            "GROUP_SIZE_M": 8,
            "num_warps": 8,
            "num_stages": 3
          },
          "tflops": 0.32,
          "ms": 0.0132,
          "correct": true,
          "run_id": "bm256_bn128_bk64_gm8_w8_s3",
          "hardware": "NVIDIA A100-SXM4-80GB",
          "operator": "matmul"
        },
        {
          "config_id": "bm256_bn256_bk32_gm8_w8_s3",
          "config": {
            "BLOCK_SIZE_M": 256,
            "BLOCK_SIZE_N": 256,
            "BLOCK_SIZE_K": 32,
            "GROUP_SIZE_M": 8,
            "num_warps": 8,
            "num_stages": 3
          },
          "tflops": 0.09,
          "ms": 0.047,
          "correct": true,
          "run_id": "bm256_bn256_bk32_gm8_w8_s3",
          "hardware": "NVIDIA A100-SXM4-80GB",
          "operator": "matmul"
        }
      ]
    },
    "matmul:medium:NVIDIA A100-SXM4-80GB": {
      "shape_key": "matmul:medium:NVIDIA A100-SXM4-80GB",
      "shape": {
        "M": 512,
        "N": 512,
        "K": 512,
        "bucket": "medium"
      },
      "best_config_id": "bm128_bn32_bk32_gm8_w4_s4",
      "best_tflops": 20.21,
      "results": [
        {
          "config_id": "bm128_bn256_bk64_gm8_w8_s3",
          "config": {
            "BLOCK_SIZE_M": 128,
            "BLOCK_SIZE_N": 256,
            "BLOCK_SIZE_K": 64,
            "GROUP_SIZE_M": 8,
            "num_warps": 8,
            "num_stages": 3
          },
          "tflops": 8.83,
          "ms": 0.0304,
          "correct": true,
          "run_id": "bm128_bn256_bk64_gm8_w8_s3",
          "hardware": "NVIDIA A100-SXM4-80GB",
          "operator": "matmul"
        },
        {
          "config_id": "bm64_bn256_bk32_gm8_w4_s4",
          "config": {
            "BLOCK_SIZE_M": 64,
            "BLOCK_SIZE_N": 256,
            "BLOCK_SIZE_K": 32,
            "GROUP_SIZE_M": 8,
            "num_warps": 4,
            "num_stages": 4
          },
          "tflops": 14.99,
          "ms": 0.0179,
          "correct": true,
          "run_id": "bm64_bn256_bk32_gm8_w4_s4",
          "hardware": "NVIDIA A100-SXM4-80GB",
          "operator": "matmul"
        },
        {
          "config_id": "bm128_bn128_bk32_gm8_w4_s4",
          "config": {
            "BLOCK_SIZE_M": 128,
            "BLOCK_SIZE_N": 128,
            "BLOCK_SIZE_K": 32,
            "GROUP_SIZE_M": 8,
            "num_warps": 4,
            "num_stages": 4
          },
          "tflops": 15.35,
          "ms": 0.0175,
          "correct": true,
          "run_id": "bm128_bn128_bk32_gm8_w4_s4",
          "hardware": "NVIDIA A100-SXM4-80GB",
          "operator": "matmul"
        },
        {
          "config_id": "bm128_bn64_bk32_gm8_w4_s4",
          "config": {
            "BLOCK_SIZE_M": 128,
            "BLOCK_SIZE_N": 64,
            "BLOCK_SIZE_K": 32,
            "GROUP_SIZE_M": 8,
            "num_warps": 4,
            "num_stages": 4
          },
          "tflops": 18.05,
          "ms": 0.0149,
          "correct": true,
          "run_id": "bm128_bn64_bk32_gm8_w4_s4",
          "hardware": "NVIDIA A100-SXM4-80GB",
          "operator": "matmul"
        },
        {
          "config_id": "bm64_bn128_bk32_gm8_w4_s4",
          "config": {
            "BLOCK_SIZE_M": 64,
            "BLOCK_SIZE_N": 128,
            "BLOCK_SIZE_K": 32,
            "GROUP_SIZE_M": 8,
            "num_warps": 4,
            "num_stages": 4
          },
          "tflops": 18.54,
          "ms": 0.0145,
          "correct": true,
          "run_id": "bm64_bn128_bk32_gm8_w4_s4",
          "hardware": "NVIDIA A100-SXM4-80GB",
          "operator": "matmul"
        },
        {
          "config_id": "bm128_bn32_bk32_gm8_w4_s4",
          "config": {
            "BLOCK_SIZE_M": 128,
            "BLOCK_SIZE_N": 32,
            "BLOCK_SIZE_K": 32,
            "GROUP_SIZE_M": 8,
            "num_warps": 4,
            "num_stages": 4
          },
          "tflops": 20.21,
          "ms": 0.0133,
          "correct": true,
          "run_id": "bm128_bn32_bk32_gm8_w4_s4",
          "hardware": "NVIDIA A100-SXM4-80GB",
          "operator": "matmul"
        },
        {
          "config_id": "bm64_bn32_bk32_gm8_w2_s5",
          "config": {
            "BLOCK_SIZE_M": 64,
            "BLOCK_SIZE_N": 32,
            "BLOCK_SIZE_K": 32,
            "GROUP_SIZE_M": 8,
            "num_warps": 2,
            "num_stages": 5
          },
          "tflops": 19.51,
          "ms": 0.0138,
          "correct": true,
          "run_id": "bm64_bn32_bk32_gm8_w2_s5",
          "hardware": "NVIDIA A100-SXM4-80GB",
          "operator": "matmul"
        },
        {
          "config_id": "bm32_bn64_bk32_gm8_w2_s5",
          "config": {
            "BLOCK_SIZE_M": 32,
            "BLOCK_SIZE_N": 64,
            "BLOCK_SIZE_K": 32,
            "GROUP_SIZE_M": 8,
            "num_warps": 2,
            "num_stages": 5
          },
          "tflops": 19.54,
          "ms": 0.0137,
          "correct": true,
          "run_id": "bm32_bn64_bk32_gm8_w2_s5",
          "hardware": "NVIDIA A100-SXM4-80GB",
          "operator": "matmul"
        },
        {
          "config_id": "bm256_bn128_bk64_gm8_w8_s3",
          "config": {
            "BLOCK_SIZE_M": 256,
            "BLOCK_SIZE_N": 128,
            "BLOCK_SIZE_K": 64,
            "GROUP_SIZE_M": 8,
            "num_warps": 8,
            "num_stages": 3
          },
          "tflops": 10.9,
          "ms": 0.0246,
          "correct": true,
          "run_id": "bm256_bn128_bk64_gm8_w8_s3",
          "hardware": "NVIDIA A100-SXM4-80GB",
          "operator": "matmul"
        },
        {
          "config_id": "bm256_bn256_bk32_gm8_w8_s3",
          "config": {
            "BLOCK_SIZE_M": 256,
            "BLOCK_SIZE_N": 256,
            "BLOCK_SIZE_K": 32,
            "GROUP_SIZE_M": 8,
            "num_warps": 8,
            "num_stages": 3
          },
          "tflops": 1.89,
          "ms": 0.1424,
          "correct": true,
          "run_id": "bm256_bn256_bk32_gm8_w8_s3",
          "hardware": "NVIDIA A100-SXM4-80GB",
          "operator": "matmul"
        }
      ]
    },
    "matmul:large:NVIDIA A100-SXM4-80GB": {
      "shape_key": "matmul:large:NVIDIA A100-SXM4-80GB",
      "shape": {
        "M": 2048,
        "N": 2048,
        "K": 2048,
        "bucket": "large"
      },
      "best_config_id": "bm64_bn128_bk32_gm8_w4_s4",
      "best_tflops": 183.3,
      "results": [
        {
          "config_id": "bm128_bn256_bk64_gm8_w8_s3",
          "config": {
            "BLOCK_SIZE_M": 128,
            "BLOCK_SIZE_N": 256,
            "BLOCK_SIZE_K": 64,
            "GROUP_SIZE_M": 8,
            "num_warps": 8,
            "num_stages": 3
          },
          "tflops": 105.77,
          "ms": 0.1624,
          "correct": true,
          "run_id": "bm128_bn256_bk64_gm8_w8_s3",
          "hardware": "NVIDIA A100-SXM4-80GB",
          "operator": "matmul"
        },
        {
          "config_id": "bm64_bn256_bk32_gm8_w4_s4",
          "config": {
            "BLOCK_SIZE_M": 64,
            "BLOCK_SIZE_N": 256,
            "BLOCK_SIZE_K": 32,
            "GROUP_SIZE_M": 8,
            "num_warps": 4,
            "num_stages": 4
          },
          "tflops": 166.9,
          "ms": 0.1029,
          "correct": true,
          "run_id": "bm64_bn256_bk32_gm8_w4_s4",
          "hardware": "NVIDIA A100-SXM4-80GB",
          "operator": "matmul"
        },
        {
          "config_id": "bm128_bn128_bk32_gm8_w4_s4",
          "config": {
            "BLOCK_SIZE_M": 128,
            "BLOCK_SIZE_N": 128,
            "BLOCK_SIZE_K": 32,
            "GROUP_SIZE_M": 8,
            "num_warps": 4,
            "num_stages": 4
          },
          "tflops": 165.78,
          "ms": 0.1036,
          "correct": true,
          "run_id": "bm128_bn128_bk32_gm8_w4_s4",
          "hardware": "NVIDIA A100-SXM4-80GB",
          "operator": "matmul"
        },
        {
          "config_id": "bm128_bn64_bk32_gm8_w4_s4",
          "config": {
            "BLOCK_SIZE_M": 128,
            "BLOCK_SIZE_N": 64,
            "BLOCK_SIZE_K": 32,
            "GROUP_SIZE_M": 8,
            "num_warps": 4,
            "num_stages": 4
          },
          "tflops": 169.54,
          "ms": 0.1013,
          "correct": true,
          "run_id": "bm128_bn64_bk32_gm8_w4_s4",
          "hardware": "NVIDIA A100-SXM4-80GB",
          "operator": "matmul"
        },
        {
          "config_id": "bm64_bn128_bk32_gm8_w4_s4",
          "config": {
            "BLOCK_SIZE_M": 64,
            "BLOCK_SIZE_N": 128,
            "BLOCK_SIZE_K": 32,
            "GROUP_SIZE_M": 8,
            "num_warps": 4,
            "num_stages": 4
          },
          "tflops": 183.3,
          "ms": 0.0937,
          "correct": true,
          "run_id": "bm64_bn128_bk32_gm8_w4_s4",
          "hardware": "NVIDIA A100-SXM4-80GB",
          "operator": "matmul"
        },
        {
          "config_id": "bm128_bn32_bk32_gm8_w4_s4",
          "config": {
            "BLOCK_SIZE_M": 128,
            "BLOCK_SIZE_N": 32,
            "BLOCK_SIZE_K": 32,
            "GROUP_SIZE_M": 8,
            "num_warps": 4,
            "num_stages": 4
          },
          "tflops": 121.66,
          "ms": 0.1412,
          "correct": true,
          "run_id": "bm128_bn32_bk32_gm8_w4_s4",
          "hardware": "NVIDIA A100-SXM4-80GB",
          "operator": "matmul"
        },
        {
          "config_id": "bm64_bn32_bk32_gm8_w2_s5",
          "config": {
            "BLOCK_SIZE_M": 64,
            "BLOCK_SIZE_N": 32,
            "BLOCK_SIZE_K": 32,
            "GROUP_SIZE_M": 8,
            "num_warps": 2,
            "num_stages": 5
          },
          "tflops": 105.65,
          "ms": 0.1626,
          "correct": true,
          "run_id": "bm64_bn32_bk32_gm8_w2_s5",
          "hardware": "NVIDIA A100-SXM4-80GB",
          "operator": "matmul"
        },
        {
          "config_id": "bm32_bn64_bk32_gm8_w2_s5",
          "config": {
            "BLOCK_SIZE_M": 32,
            "BLOCK_SIZE_N": 64,
            "BLOCK_SIZE_K": 32,
            "GROUP_SIZE_M": 8,
            "num_warps": 2,
            "num_stages": 5
          },
          "tflops": 105.04,
          "ms": 0.1636,
          "correct": true,
          "run_id": "bm32_bn64_bk32_gm8_w2_s5",
          "hardware": "NVIDIA A100-SXM4-80GB",
          "operator": "matmul"
        },
        {
          "config_id": "bm256_bn128_bk64_gm8_w8_s3",
          "config": {
            "BLOCK_SIZE_M": 256,
            "BLOCK_SIZE_N": 128,
            "BLOCK_SIZE_K": 64,
            "GROUP_SIZE_M": 8,
            "num_warps": 8,
            "num_stages": 3
          },
          "tflops": 133.56,
          "ms": 0.1286,
          "correct": true,
          "run_id": "bm256_bn128_bk64_gm8_w8_s3",
          "hardware": "NVIDIA A100-SXM4-80GB",
          "operator": "matmul"
        },
        {
          "config_id": "bm256_bn256_bk32_gm8_w8_s3",
          "config": {
            "BLOCK_SIZE_M": 256,
            "BLOCK_SIZE_N": 256,
            "BLOCK_SIZE_K": 32,
            "GROUP_SIZE_M": 8,
            "num_warps": 8,
            "num_stages": 3
          },
          "tflops": 34.18,
          "ms": 0.5026,
          "correct": true,
          "run_id": "bm256_bn256_bk32_gm8_w8_s3",
          "hardware": "NVIDIA A100-SXM4-80GB",
          "operator": "matmul"
        }
      ]
    },
    "matmul:xlarge:NVIDIA A100-SXM4-80GB": {
      "shape_key": "matmul:xlarge:NVIDIA A100-SXM4-80GB",
      "shape": {
        "M": 4096,
        "N": 4096,
        "K": 4096,
        "bucket": "xlarge"
      },
      "best_config_id": "bm256_bn128_bk64_gm8_w8_s3",
      "best_tflops": 232.11,
      "results": [
        {
          "config_id": "bm128_bn256_bk64_gm8_w8_s3",
          "config": {
            "BLOCK_SIZE_M": 128,
            "BLOCK_SIZE_N": 256,
            "BLOCK_SIZE_K": 64,
            "GROUP_SIZE_M": 8,
            "num_warps": 8,
            "num_stages": 3
          },
          "tflops": 221.95,
          "ms": 0.6192,
          "correct": true,
          "run_id": "bm128_bn256_bk64_gm8_w8_s3",
          "hardware": "NVIDIA A100-SXM4-80GB",
          "operator": "matmul"
        },
        {
          "config_id": "bm128_bn256_bk64_gm8_w8_s3",
          "config": {
            "BLOCK_SIZE_M": 128,
            "BLOCK_SIZE_N": 256,
            "BLOCK_SIZE_K": 64,
            "GROUP_SIZE_M": 8,
            "num_warps": 8,
            "num_stages": 3
          },
          "tflops": 228.93,
          "ms": 4.8029,
          "correct": true,
          "run_id": "bm128_bn256_bk64_gm8_w8_s3",
          "hardware": "NVIDIA A100-SXM4-80GB",
          "operator": "matmul"
        },
        {
          "config_id": "bm64_bn256_bk32_gm8_w4_s4",
          "config": {
            "BLOCK_SIZE_M": 64,
            "BLOCK_SIZE_N": 256,
            "BLOCK_SIZE_K": 32,
            "GROUP_SIZE_M": 8,
            "num_warps": 4,
            "num_stages": 4
          },
          "tflops": 225.68,
          "ms": 0.609,
          "correct": true,
          "run_id": "bm64_bn256_bk32_gm8_w4_s4",
          "hardware": "NVIDIA A100-SXM4-80GB",
          "operator": "matmul"
        },
        {
          "config_id": "bm64_bn256_bk32_gm8_w4_s4",
          "config": {
            "BLOCK_SIZE_M": 64,
            "BLOCK_SIZE_N": 256,
            "BLOCK_SIZE_K": 32,
            "GROUP_SIZE_M": 8,
            "num_warps": 4,
            "num_stages": 4
          },
          "tflops": 216.68,
          "ms": 5.0744,
          "correct": true,
          "run_id": "bm64_bn256_bk32_gm8_w4_s4",
          "hardware": "NVIDIA A100-SXM4-80GB",
          "operator": "matmul"
        },
        {
          "config_id": "bm128_bn128_bk32_gm8_w4_s4",
          "config": {
            "BLOCK_SIZE_M": 128,
            "BLOCK_SIZE_N": 128,
            "BLOCK_SIZE_K": 32,
            "GROUP_SIZE_M": 8,
            "num_warps": 4,
            "num_stages": 4
          },
          "tflops": 225.65,
          "ms": 0.6091,
          "correct": true,
          "run_id": "bm128_bn128_bk32_gm8_w4_s4",
          "hardware": "NVIDIA A100-SXM4-80GB",
          "operator": "matmul"
        },
        {
          "config_id": "bm128_bn128_bk32_gm8_w4_s4",
          "config": {
            "BLOCK_SIZE_M": 128,
            "BLOCK_SIZE_N": 128,
            "BLOCK_SIZE_K": 32,
            "GROUP_SIZE_M": 8,
            "num_warps": 4,
            "num_stages": 4
          },
          "tflops": 228.97,
          "ms": 4.8021,
          "correct": true,
          "run_id": "bm128_bn128_bk32_gm8_w4_s4",
          "hardware": "NVIDIA A100-SXM4-80GB",
          "operator": "matmul"
        },
        {
          "config_id": "bm128_bn64_bk32_gm8_w4_s4",
          "config": {
            "BLOCK_SIZE_M": 128,
            "BLOCK_SIZE_N": 64,
            "BLOCK_SIZE_K": 32,
            "GROUP_SIZE_M": 8,
            "num_warps": 4,
            "num_stages": 4
          },
          "tflops": 187.77,
          "ms": 0.7319,
          "correct": true,
          "run_id": "bm128_bn64_bk32_gm8_w4_s4",
          "hardware": "NVIDIA A100-SXM4-80GB",
          "operator": "matmul"
        },
        {
          "config_id": "bm128_bn64_bk32_gm8_w4_s4",
          "config": {
            "BLOCK_SIZE_M": 128,
            "BLOCK_SIZE_N": 64,
            "BLOCK_SIZE_K": 32,
            "GROUP_SIZE_M": 8,
            "num_warps": 4,
            "num_stages": 4
          },
          "tflops": 184.1,
          "ms": 5.9722,
          "correct": true,
          "run_id": "bm128_bn64_bk32_gm8_w4_s4",
          "hardware": "NVIDIA A100-SXM4-80GB",
          "operator": "matmul"
        },
        {
          "config_id": "bm64_bn128_bk32_gm8_w4_s4",
          "config": {
            "BLOCK_SIZE_M": 64,
            "BLOCK_SIZE_N": 128,
            "BLOCK_SIZE_K": 32,
            "GROUP_SIZE_M": 8,
            "num_warps": 4,
            "num_stages": 4
          },
          "tflops": 196.35,
          "ms": 0.7,
          "correct": true,
          "run_id": "bm64_bn128_bk32_gm8_w4_s4",
          "hardware": "NVIDIA A100-SXM4-80GB",
          "operator": "matmul"
        },
        {
          "config_id": "bm64_bn128_bk32_gm8_w4_s4",
          "config": {
            "BLOCK_SIZE_M": 64,
            "BLOCK_SIZE_N": 128,
            "BLOCK_SIZE_K": 32,
            "GROUP_SIZE_M": 8,
            "num_warps": 4,
            "num_stages": 4
          },
          "tflops": 188.42,
          "ms": 5.8355,
          "correct": true,
          "run_id": "bm64_bn128_bk32_gm8_w4_s4",
          "hardware": "NVIDIA A100-SXM4-80GB",
          "operator": "matmul"
        },
        {
          "config_id": "bm128_bn32_bk32_gm8_w4_s4",
          "config": {
            "BLOCK_SIZE_M": 128,
            "BLOCK_SIZE_N": 32,
            "BLOCK_SIZE_K": 32,
            "GROUP_SIZE_M": 8,
            "num_warps": 4,
            "num_stages": 4
          },
          "tflops": 131.68,
          "ms": 1.0437,
          "correct": true,
          "run_id": "bm128_bn32_bk32_gm8_w4_s4",
          "hardware": "NVIDIA A100-SXM4-80GB",
          "operator": "matmul"
        },
        {
          "config_id": "bm128_bn32_bk32_gm8_w4_s4",
          "config": {
            "BLOCK_SIZE_M": 128,
            "BLOCK_SIZE_N": 32,
            "BLOCK_SIZE_K": 32,
            "GROUP_SIZE_M": 8,
            "num_warps": 4,
            "num_stages": 4
          },
          "tflops": 125.46,
          "ms": 8.7637,
          "correct": true,
          "run_id": "bm128_bn32_bk32_gm8_w4_s4",
          "hardware": "NVIDIA A100-SXM4-80GB",
          "operator": "matmul"
        },
        {
          "config_id": "bm64_bn32_bk32_gm8_w2_s5",
          "config": {
            "BLOCK_SIZE_M": 64,
            "BLOCK_SIZE_N": 32,
            "BLOCK_SIZE_K": 32,
            "GROUP_SIZE_M": 8,
            "num_warps": 2,
            "num_stages": 5
          },
          "tflops": 112.04,
          "ms": 1.2267,
          "correct": true,
          "run_id": "bm64_bn32_bk32_gm8_w2_s5",
          "hardware": "NVIDIA A100-SXM4-80GB",
          "operator": "matmul"
        },
        {
          "config_id": "bm64_bn32_bk32_gm8_w2_s5",
          "config": {
            "BLOCK_SIZE_M": 64,
            "BLOCK_SIZE_N": 32,
            "BLOCK_SIZE_K": 32,
            "GROUP_SIZE_M": 8,
            "num_warps": 2,
            "num_stages": 5
          },
          "tflops": 109.51,
          "ms": 10.0407,
          "correct": true,
          "run_id": "bm64_bn32_bk32_gm8_w2_s5",
          "hardware": "NVIDIA A100-SXM4-80GB",
          "operator": "matmul"
        },
        {
          "config_id": "bm32_bn64_bk32_gm8_w2_s5",
          "config": {
            "BLOCK_SIZE_M": 32,
            "BLOCK_SIZE_N": 64,
            "BLOCK_SIZE_K": 32,
            "GROUP_SIZE_M": 8,
            "num_warps": 2,
            "num_stages": 5
          },
          "tflops": 111.05,
          "ms": 1.2376,
          "correct": true,
          "run_id": "bm32_bn64_bk32_gm8_w2_s5",
          "hardware": "NVIDIA A100-SXM4-80GB",
          "operator": "matmul"
        },
        {
          "config_id": "bm32_bn64_bk32_gm8_w2_s5",
          "config": {
            "BLOCK_SIZE_M": 32,
            "BLOCK_SIZE_N": 64,
            "BLOCK_SIZE_K": 32,
            "GROUP_SIZE_M": 8,
            "num_warps": 2,
            "num_stages": 5
          },
          "tflops": 106.87,
          "ms": 10.2887,
          "correct": true,
          "run_id": "bm32_bn64_bk32_gm8_w2_s5",
          "hardware": "NVIDIA A100-SXM4-80GB",
          "operator": "matmul"
        },
        {
          "config_id": "bm256_bn128_bk64_gm8_w8_s3",
          "config": {
            "BLOCK_SIZE_M": 256,
            "BLOCK_SIZE_N": 128,
            "BLOCK_SIZE_K": 64,
            "GROUP_SIZE_M": 8,
            "num_warps": 8,
            "num_stages": 3
          },
          "tflops": 227.68,
          "ms": 0.6036,
          "correct": true,
          "run_id": "bm256_bn128_bk64_gm8_w8_s3",
          "hardware": "NVIDIA A100-SXM4-80GB",
          "operator": "matmul"
        },
        {
          "config_id": "bm256_bn128_bk64_gm8_w8_s3",
          "config": {
            "BLOCK_SIZE_M": 256,
            "BLOCK_SIZE_N": 128,
            "BLOCK_SIZE_K": 64,
            "GROUP_SIZE_M": 8,
            "num_warps": 8,
            "num_stages": 3
          },
          "tflops": 232.11,
          "ms": 4.737,
          "correct": true,
          "run_id": "bm256_bn128_bk64_gm8_w8_s3",
          "hardware": "NVIDIA A100-SXM4-80GB",
          "operator": "matmul"
        },
        {
          "config_id": "bm256_bn256_bk32_gm8_w8_s3",
          "config": {
            "BLOCK_SIZE_M": 256,
            "BLOCK_SIZE_N": 256,
            "BLOCK_SIZE_K": 32,
            "GROUP_SIZE_M": 8,
            "num_warps": 8,
            "num_stages": 3
          },
          "tflops": 42.25,
          "ms": 3.2532,
          "correct": true,
          "run_id": "bm256_bn256_bk32_gm8_w8_s3",
          "hardware": "NVIDIA A100-SXM4-80GB",
          "operator": "matmul"
        },
        {
          "config_id": "bm256_bn256_bk32_gm8_w8_s3",
          "config": {
            "BLOCK_SIZE_M": 256,
            "BLOCK_SIZE_N": 256,
            "BLOCK_SIZE_K": 32,
            "GROUP_SIZE_M": 8,
            "num_warps": 8,
            "num_stages": 3
          },
          "tflops": 51.06,
          "ms": 21.534,
          "correct": true,
          "run_id": "bm256_bn256_bk32_gm8_w8_s3",
          "hardware": "NVIDIA A100-SXM4-80GB",
          "operator": "matmul"
        }
      ]
    },
    "matmul:tall_skinny:NVIDIA A100-SXM4-80GB": {
      "shape_key": "matmul:tall_skinny:NVIDIA A100-SXM4-80GB",
      "shape": {
        "M": 8192,
        "N": 1024,
        "K": 1024,
        "bucket": "tall_skinny"
      },
      "best_config_id": "bm128_bn128_bk32_gm8_w4_s4",
      "best_tflops": 183.64,
      "results": [
        {
          "config_id": "bm128_bn256_bk64_gm8_w8_s3",
          "config": {
            "BLOCK_SIZE_M": 128,
            "BLOCK_SIZE_N": 256,
            "BLOCK_SIZE_K": 64,
            "GROUP_SIZE_M": 8,
            "num_warps": 8,
            "num_stages": 3
          },
          "tflops": 153.5,
          "ms": 0.1119,
          "correct": true,
          "run_id": "bm128_bn256_bk64_gm8_w8_s3",
          "hardware": "NVIDIA A100-SXM4-80GB",
          "operator": "matmul"
        },
        {
          "config_id": "bm64_bn256_bk32_gm8_w4_s4",
          "config": {
            "BLOCK_SIZE_M": 64,
            "BLOCK_SIZE_N": 256,
            "BLOCK_SIZE_K": 32,
            "GROUP_SIZE_M": 8,
            "num_warps": 4,
            "num_stages": 4
          },
          "tflops": 180.94,
          "ms": 0.0949,
          "correct": true,
          "run_id": "bm64_bn256_bk32_gm8_w4_s4",
          "hardware": "NVIDIA A100-SXM4-80GB",
          "operator": "matmul"
        },
        {
          "config_id": "bm128_bn128_bk32_gm8_w4_s4",
          "config": {
            "BLOCK_SIZE_M": 128,
            "BLOCK_SIZE_N": 128,
            "BLOCK_SIZE_K": 32,
            "GROUP_SIZE_M": 8,
            "num_warps": 4,
            "num_stages": 4
          },
          "tflops": 183.64,
          "ms": 0.0936,
          "correct": true,
          "run_id": "bm128_bn128_bk32_gm8_w4_s4",
          "hardware": "NVIDIA A100-SXM4-80GB",
          "operator": "matmul"
        },
        {
          "config_id": "bm128_bn64_bk32_gm8_w4_s4",
          "config": {
            "BLOCK_SIZE_M": 128,
            "BLOCK_SIZE_N": 64,
            "BLOCK_SIZE_K": 32,
            "GROUP_SIZE_M": 8,
            "num_warps": 4,
            "num_stages": 4
          },
          "tflops": 157.89,
          "ms": 0.1088,
          "correct": true,
          "run_id": "bm128_bn64_bk32_gm8_w4_s4",
          "hardware": "NVIDIA A100-SXM4-80GB",
          "operator": "matmul"
        },
        {
          "config_id": "bm64_bn128_bk32_gm8_w4_s4",
          "config": {
            "BLOCK_SIZE_M": 64,
            "BLOCK_SIZE_N": 128,
            "BLOCK_SIZE_K": 32,
            "GROUP_SIZE_M": 8,
            "num_warps": 4,
            "num_stages": 4
          },
          "tflops": 167.3,
          "ms": 0.1027,
          "correct": true,
          "run_id": "bm64_bn128_bk32_gm8_w4_s4",
          "hardware": "NVIDIA A100-SXM4-80GB",
          "operator": "matmul"
        },
        {
          "config_id": "bm128_bn32_bk32_gm8_w4_s4",
          "config": {
            "BLOCK_SIZE_M": 128,
            "BLOCK_SIZE_N": 32,
            "BLOCK_SIZE_K": 32,
            "GROUP_SIZE_M": 8,
            "num_warps": 4,
            "num_stages": 4
          },
          "tflops": 122.17,
          "ms": 0.1406,
          "correct": true,
          "run_id": "bm128_bn32_bk32_gm8_w4_s4",
          "hardware": "NVIDIA A100-SXM4-80GB",
          "operator": "matmul"
        },
        {
          "config_id": "bm64_bn32_bk32_gm8_w2_s5",
          "config": {
            "BLOCK_SIZE_M": 64,
            "BLOCK_SIZE_N": 32,
            "BLOCK_SIZE_K": 32,
            "GROUP_SIZE_M": 8,
            "num_warps": 2,
            "num_stages": 5
          },
          "tflops": 106.98,
          "ms": 0.1606,
          "correct": true,
          "run_id": "bm64_bn32_bk32_gm8_w2_s5",
          "hardware": "NVIDIA A100-SXM4-80GB",
          "operator": "matmul"
        },
        {
          "config_id": "bm32_bn64_bk32_gm8_w2_s5",
          "config": {
            "BLOCK_SIZE_M": 32,
            "BLOCK_SIZE_N": 64,
            "BLOCK_SIZE_K": 32,
            "GROUP_SIZE_M": 8,
            "num_warps": 2,
            "num_stages": 5
          },
          "tflops": 106.22,
          "ms": 0.1617,
          "correct": true,
          "run_id": "bm32_bn64_bk32_gm8_w2_s5",
          "hardware": "NVIDIA A100-SXM4-80GB",
          "operator": "matmul"
        },
        {
          "config_id": "bm256_bn128_bk64_gm8_w8_s3",
          "config": {
            "BLOCK_SIZE_M": 256,
            "BLOCK_SIZE_N": 128,
            "BLOCK_SIZE_K": 64,
            "GROUP_SIZE_M": 8,
            "num_warps": 8,
            "num_stages": 3
          },
          "tflops": 156.99,
          "ms": 0.1094,
          "correct": true,
          "run_id": "bm256_bn128_bk64_gm8_w8_s3",
          "hardware": "NVIDIA A100-SXM4-80GB",
          "operator": "matmul"
        },
        {
          "config_id": "bm256_bn256_bk32_gm8_w8_s3",
          "config": {
            "BLOCK_SIZE_M": 256,
            "BLOCK_SIZE_N": 256,
            "BLOCK_SIZE_K": 32,
            "GROUP_SIZE_M": 8,
            "num_warps": 8,
            "num_stages": 3
          },
          "tflops": 32.25,
          "ms": 0.5327,
          "correct": true,
          "run_id": "bm256_bn256_bk32_gm8_w8_s3",
          "hardware": "NVIDIA A100-SXM4-80GB",
          "operator": "matmul"
        }
      ]
    },
    "attention:short_64:NVIDIA A100-SXM4-80GB": {
      "shape_key": "attention:short_64:NVIDIA A100-SXM4-80GB",
      "shape": {
        "batch": 4,
        "heads": 32,
        "seq_len": 512,
        "head_dim": 64,
        "bucket": "short_64"
      },
      "best_config_id": "m64_n128_w4_s3",
      "best_tflops": 112.15,
      "results": [
        {
          "config_id": "m64_n64_w4_s3",
          "config": {
            "BLOCK_M": 64,
            "BLOCK_N": 64,
            "num_warps": 4,
            "num_stages": 3
          },
          "tflops": 78.58,
          "ms": 0.1093,
          "correct": true,
          "run_id": "m64_n64_w4_s3",
          "hardware": "NVIDIA A100-SXM4-80GB",
          "operator": "attention"
        },
        {
          "config_id": "m128_n64_w8_s3",
          "config": {
            "BLOCK_M": 128,
            "BLOCK_N": 64,
            "num_warps": 8,
            "num_stages": 3
          },
          "tflops": 93.0,
          "ms": 0.0924,
          "correct": true,
          "run_id": "m128_n64_w8_s3",
          "hardware": "NVIDIA A100-SXM4-80GB",
          "operator": "attention"
        },
        {
          "config_id": "m128_n32_w4_s3",
          "config": {
            "BLOCK_M": 128,
            "BLOCK_N": 32,
            "num_warps": 4,
            "num_stages": 3
          },
          "tflops": 87.33,
          "ms": 0.0984,
          "correct": true,
          "run_id": "m128_n32_w4_s3",
          "hardware": "NVIDIA A100-SXM4-80GB",
          "operator": "attention"
        },
        {
          "config_id": "m64_n128_w4_s3",
          "config": {
            "BLOCK_M": 64,
            "BLOCK_N": 128,
            "num_warps": 4,
            "num_stages": 3
          },
          "tflops": 112.15,
          "ms": 0.0766,
          "correct": true,
          "run_id": "m64_n128_w4_s3",
          "hardware": "NVIDIA A100-SXM4-80GB",
          "operator": "attention"
        },
        {
          "config_id": "m128_n128_w8_s2",
          "config": {
            "BLOCK_M": 128,
            "BLOCK_N": 128,
            "num_warps": 8,
            "num_stages": 2
          },
          "tflops": 91.64,
          "ms": 0.0937,
          "correct": true,
          "run_id": "m128_n128_w8_s2",
          "hardware": "NVIDIA A100-SXM4-80GB",
          "operator": "attention"
        },
        {
          "config_id": "m64_n32_w2_s4",
          "config": {
            "BLOCK_M": 64,
            "BLOCK_N": 32,
            "num_warps": 2,
            "num_stages": 4
          },
          "tflops": 111.23,
          "ms": 0.0772,
          "correct": true,
          "run_id": "m64_n32_w2_s4",
          "hardware": "NVIDIA A100-SXM4-80GB",
          "operator": "attention"
        },
        {
          "config_id": "m32_n64_w2_s4",
          "config": {
            "BLOCK_M": 32,
            "BLOCK_N": 64,
            "num_warps": 2,
            "num_stages": 4
          },
          "tflops": 53.53,
          "ms": 0.1605,
          "correct": true,
          "run_id": "m32_n64_w2_s4",
          "hardware": "NVIDIA A100-SXM4-80GB",
          "operator": "attention"
        },
        {
          "config_id": "m64_n64_w4_s2",
          "config": {
            "BLOCK_M": 64,
            "BLOCK_N": 64,
            "num_warps": 4,
            "num_stages": 2
          },
          "tflops": 109.14,
          "ms": 0.0787,
          "correct": true,
          "run_id": "m64_n64_w4_s2",
          "hardware": "NVIDIA A100-SXM4-80GB",
          "operator": "attention"
        },
        {
          "config_id": "m32_n32_w2_s2",
          "config": {
            "BLOCK_M": 32,
            "BLOCK_N": 32,
            "num_warps": 2,
            "num_stages": 2
          },
          "tflops": 73.78,
          "ms": 0.1164,
          "correct": true,
          "run_id": "m32_n32_w2_s2",
          "hardware": "NVIDIA A100-SXM4-80GB",
          "operator": "attention"
        },
        {
          "config_id": "m32_n32_w2_s3",
          "config": {
            "BLOCK_M": 32,
            "BLOCK_N": 32,
            "num_warps": 2,
            "num_stages": 3
          },
          "tflops": 77.74,
          "ms": 0.1105,
          "correct": true,
          "run_id": "m32_n32_w2_s3",
          "hardware": "NVIDIA A100-SXM4-80GB",
          "operator": "attention"
        },
        {
          "config_id": "m32_n32_w4_s2",
          "config": {
            "BLOCK_M": 32,
            "BLOCK_N": 32,
            "num_warps": 4,
            "num_stages": 2
          },
          "tflops": 54.98,
          "ms": 0.1563,
          "correct": true,
          "run_id": "m32_n32_w4_s2",
          "hardware": "NVIDIA A100-SXM4-80GB",
          "operator": "attention"
        },
        {
          "config_id": "m32_n32_w4_s3",
          "config": {
            "BLOCK_M": 32,
            "BLOCK_N": 32,
            "num_warps": 4,
            "num_stages": 3
          },
          "tflops": 57.31,
          "ms": 0.1499,
          "correct": true,
          "run_id": "m32_n32_w4_s3",
          "hardware": "NVIDIA A100-SXM4-80GB",
          "operator": "attention"
        }
      ]
    },
    "attention:short_128:NVIDIA A100-SXM4-80GB": {
      "shape_key": "attention:short_128:NVIDIA A100-SXM4-80GB",
      "shape": {
        "batch": 2,
        "heads": 16,
        "seq_len": 1024,
        "head_dim": 128,
        "bucket": "short_128"
      },
      "best_config_id": "m128_n128_w8_s2",
      "best_tflops": 117.28,
      "results": [
        {
          "config_id": "m64_n64_w4_s3",
          "config": {
            "BLOCK_M": 64,
            "BLOCK_N": 64,
            "num_warps": 4,
            "num_stages": 3
          },
          "tflops": 64.92,
          "ms": 0.2646,
          "correct": true,
          "run_id": "m64_n64_w4_s3",
          "hardware": "NVIDIA A100-SXM4-80GB",
          "operator": "attention"
        },
        {
          "config_id": "m128_n64_w8_s3",
          "config": {
            "BLOCK_M": 128,
            "BLOCK_N": 64,
            "num_warps": 8,
            "num_stages": 3
          },
          "tflops": 116.65,
          "ms": 0.1473,
          "correct": true,
          "run_id": "m128_n64_w8_s3",
          "hardware": "NVIDIA A100-SXM4-80GB",
          "operator": "attention"
        },
        {
          "config_id": "m128_n32_w4_s3",
          "config": {
            "BLOCK_M": 128,
            "BLOCK_N": 32,
            "num_warps": 4,
            "num_stages": 3
          },
          "tflops": 86.05,
          "ms": 0.1997,
          "correct": true,
          "run_id": "m128_n32_w4_s3",
          "hardware": "NVIDIA A100-SXM4-80GB",
          "operator": "attention"
        },
        {
          "config_id": "m64_n128_w4_s3",
          "config": {
            "BLOCK_M": 64,
            "BLOCK_N": 128,
            "num_warps": 4,
            "num_stages": 3
          },
          "tflops": 96.2,
          "ms": 0.1786,
          "correct": true,
          "run_id": "m64_n128_w4_s3",
          "hardware": "NVIDIA A100-SXM4-80GB",
          "operator": "attention"
        },
        {
          "config_id": "m128_n128_w8_s2",
          "config": {
            "BLOCK_M": 128,
            "BLOCK_N": 128,
            "num_warps": 8,
            "num_stages": 2
          },
          "tflops": 117.28,
          "ms": 0.1465,
          "correct": true,
          "run_id": "m128_n128_w8_s2",
          "hardware": "NVIDIA A100-SXM4-80GB",
          "operator": "attention"
        },
        {
          "config_id": "m64_n32_w2_s4",
          "config": {
            "BLOCK_M": 64,
            "BLOCK_N": 32,
            "num_warps": 2,
            "num_stages": 4
          },
          "tflops": 74.24,
          "ms": 0.2314,
          "correct": true,
          "run_id": "m64_n32_w2_s4",
          "hardware": "NVIDIA A100-SXM4-80GB",
          "operator": "attention"
        },
        {
          "config_id": "m32_n64_w2_s4",
          "config": {
            "BLOCK_M": 32,
            "BLOCK_N": 64,
            "num_warps": 2,
            "num_stages": 4
          },
          "tflops": 50.73,
          "ms": 0.3386,
          "correct": true,
          "run_id": "m32_n64_w2_s4",
          "hardware": "NVIDIA A100-SXM4-80GB",
          "operator": "attention"
        },
        {
          "config_id": "m64_n64_w4_s2",
          "config": {
            "BLOCK_M": 64,
            "BLOCK_N": 64,
            "num_warps": 4,
            "num_stages": 2
          },
          "tflops": 98.16,
          "ms": 0.175,
          "correct": true,
          "run_id": "m64_n64_w4_s2",
          "hardware": "NVIDIA A100-SXM4-80GB",
          "operator": "attention"
        },
        {
          "config_id": "m32_n32_w2_s2",
          "config": {
            "BLOCK_M": 32,
            "BLOCK_N": 32,
            "num_warps": 2,
            "num_stages": 2
          },
          "tflops": 77.37,
          "ms": 0.2221,
          "correct": true,
          "run_id": "m32_n32_w2_s2",
          "hardware": "NVIDIA A100-SXM4-80GB",
          "operator": "attention"
        },
        {
          "config_id": "m32_n32_w2_s3",
          "config": {
            "BLOCK_M": 32,
            "BLOCK_N": 32,
            "num_warps": 2,
            "num_stages": 3
          },
          "tflops": 74.98,
          "ms": 0.2291,
          "correct": true,
          "run_id": "m32_n32_w2_s3",
          "hardware": "NVIDIA A100-SXM4-80GB",
          "operator": "attention"
        },
        {
          "config_id": "m32_n32_w4_s2",
          "config": {
            "BLOCK_M": 32,
            "BLOCK_N": 32,
            "num_warps": 4,
            "num_stages": 2
          },
          "tflops": 71.87,
          "ms": 0.2391,
          "correct": true,
          "run_id": "m32_n32_w4_s2",
          "hardware": "NVIDIA A100-SXM4-80GB",
          "operator": "attention"
        },
        {
          "config_id": "m32_n32_w4_s3",
          "config": {
            "BLOCK_M": 32,
            "BLOCK_N": 32,
            "num_warps": 4,
            "num_stages": 3
          },
          "tflops": 70.74,
          "ms": 0.2429,
          "correct": true,
          "run_id": "m32_n32_w4_s3",
          "hardware": "NVIDIA A100-SXM4-80GB",
          "operator": "attention"
        }
      ]
    },
    "attention:med_128:NVIDIA A100-SXM4-80GB": {
      "shape_key": "attention:med_128:NVIDIA A100-SXM4-80GB",
      "shape": {
        "batch": 2,
        "heads": 16,
        "seq_len": 2048,
        "head_dim": 128,
        "bucket": "med_128"
      },
      "best_config_id": "m128_n128_w8_s2",
      "best_tflops": 156.24,
      "results": [
        {
          "config_id": "m64_n64_w4_s3",
          "config": {
            "BLOCK_M": 64,
            "BLOCK_N": 64,
            "num_warps": 4,
            "num_stages": 3
          },
          "tflops": 70.16,
          "ms": 0.9795,
          "correct": true,
          "run_id": "m64_n64_w4_s3",
          "hardware": "NVIDIA A100-SXM4-80GB",
          "operator": "attention"
        },
        {
          "config_id": "m128_n64_w8_s3",
          "config": {
            "BLOCK_M": 128,
            "BLOCK_N": 64,
            "num_warps": 8,
            "num_stages": 3
          },
          "tflops": 154.57,
          "ms": 0.4446,
          "correct": true,
          "run_id": "m128_n64_w8_s3",
          "hardware": "NVIDIA A100-SXM4-80GB",
          "operator": "attention"
        },
        {
          "config_id": "m128_n32_w4_s3",
          "config": {
            "BLOCK_M": 128,
            "BLOCK_N": 32,
            "num_warps": 4,
            "num_stages": 3
          },
          "tflops": 122.96,
          "ms": 0.5589,
          "correct": true,
          "run_id": "m128_n32_w4_s3",
          "hardware": "NVIDIA A100-SXM4-80GB",
          "operator": "attention"
        },
        {
          "config_id": "m64_n128_w4_s3",
          "config": {
            "BLOCK_M": 64,
            "BLOCK_N": 128,
            "num_warps": 4,
            "num_stages": 3
          },
          "tflops": 108.99,
          "ms": 0.6305,
          "correct": true,
          "run_id": "m64_n128_w4_s3",
          "hardware": "NVIDIA A100-SXM4-80GB",
          "operator": "attention"
        },
        {
          "config_id": "m128_n128_w8_s2",
          "config": {
            "BLOCK_M": 128,
            "BLOCK_N": 128,
            "num_warps": 8,
            "num_stages": 2
          },
          "tflops": 156.24,
          "ms": 0.4398,
          "correct": true,
          "run_id": "m128_n128_w8_s2",
          "hardware": "NVIDIA A100-SXM4-80GB",
          "operator": "attention"
        },
        {
          "config_id": "m64_n32_w2_s4",
          "config": {
            "BLOCK_M": 64,
            "BLOCK_N": 32,
            "num_warps": 2,
            "num_stages": 4
          },
          "tflops": 79.59,
          "ms": 0.8635,
          "correct": true,
          "run_id": "m64_n32_w2_s4",
          "hardware": "NVIDIA A100-SXM4-80GB",
          "operator": "attention"
        },
        {
          "config_id": "m32_n64_w2_s4",
          "config": {
            "BLOCK_M": 32,
            "BLOCK_N": 64,
            "num_warps": 2,
            "num_stages": 4
          },
          "tflops": 56.38,
          "ms": 1.2189,
          "correct": true,
          "run_id": "m32_n64_w2_s4",
          "hardware": "NVIDIA A100-SXM4-80GB",
          "operator": "attention"
        },
        {
          "config_id": "m64_n64_w4_s2",
          "config": {
            "BLOCK_M": 64,
            "BLOCK_N": 64,
            "num_warps": 4,
            "num_stages": 2
          },
          "tflops": 116.03,
          "ms": 0.5923,
          "correct": true,
          "run_id": "m64_n64_w4_s2",
          "hardware": "NVIDIA A100-SXM4-80GB",
          "operator": "attention"
        },
        {
          "config_id": "m32_n32_w2_s2",
          "config": {
            "BLOCK_M": 32,
            "BLOCK_N": 32,
            "num_warps": 2,
            "num_stages": 2
          },
          "tflops": 94.5,
          "ms": 0.7272,
          "correct": true,
          "run_id": "m32_n32_w2_s2",
          "hardware": "NVIDIA A100-SXM4-80GB",
          "operator": "attention"
        },
        {
          "config_id": "m32_n32_w2_s3",
          "config": {
            "BLOCK_M": 32,
            "BLOCK_N": 32,
            "num_warps": 2,
            "num_stages": 3
          },
          "tflops": 87.37,
          "ms": 0.7865,
          "correct": true,
          "run_id": "m32_n32_w2_s3",
          "hardware": "NVIDIA A100-SXM4-80GB",
          "operator": "attention"
        },
        {
          "config_id": "m32_n32_w4_s2",
          "config": {
            "BLOCK_M": 32,
            "BLOCK_N": 32,
            "num_warps": 4,
            "num_stages": 2
          },
          "tflops": 84.35,
          "ms": 0.8147,
          "correct": true,
          "run_id": "m32_n32_w4_s2",
          "hardware": "NVIDIA A100-SXM4-80GB",
          "operator": "attention"
        },
        {
          "config_id": "m32_n32_w4_s3",
          "config": {
            "BLOCK_M": 32,
            "BLOCK_N": 32,
            "num_warps": 4,
            "num_stages": 3
          },
          "tflops": 80.5,
          "ms": 0.8536,
          "correct": true,
          "run_id": "m32_n32_w4_s3",
          "hardware": "NVIDIA A100-SXM4-80GB",
          "operator": "attention"
        }
      ]
    },
    "attention:long_64:NVIDIA A100-SXM4-80GB": {
      "shape_key": "attention:long_64:NVIDIA A100-SXM4-80GB",
      "shape": {
        "batch": 1,
        "heads": 16,
        "seq_len": 4096,
        "head_dim": 64,
        "bucket": "long_64"
      },
      "best_config_id": "m64_n128_w4_s3",
      "best_tflops": 148.8,
      "results": [
        {
          "config_id": "m64_n64_w4_s3",
          "config": {
            "BLOCK_M": 64,
            "BLOCK_N": 64,
            "num_warps": 4,
            "num_stages": 3
          },
          "tflops": 145.14,
          "ms": 0.4735,
          "correct": true,
          "run_id": "m64_n64_w4_s3",
          "hardware": "NVIDIA A100-SXM4-80GB",
          "operator": "attention"
        },
        {
          "config_id": "m128_n64_w8_s3",
          "config": {
            "BLOCK_M": 128,
            "BLOCK_N": 64,
            "num_warps": 8,
            "num_stages": 3
          },
          "tflops": 123.72,
          "ms": 0.5554,
          "correct": true,
          "run_id": "m128_n64_w8_s3",
          "hardware": "NVIDIA A100-SXM4-80GB",
          "operator": "attention"
        },
        {
          "config_id": "m128_n32_w4_s3",
          "config": {
            "BLOCK_M": 128,
            "BLOCK_N": 32,
            "num_warps": 4,
            "num_stages": 3
          },
          "tflops": 117.42,
          "ms": 0.5852,
          "correct": true,
          "run_id": "m128_n32_w4_s3",
          "hardware": "NVIDIA A100-SXM4-80GB",
          "operator": "attention"
        },
        {
          "config_id": "m64_n128_w4_s3",
          "config": {
            "BLOCK_M": 64,
            "BLOCK_N": 128,
            "num_warps": 4,
            "num_stages": 3
          },
          "tflops": 148.8,
          "ms": 0.4618,
          "correct": true,
          "run_id": "m64_n128_w4_s3",
          "hardware": "NVIDIA A100-SXM4-80GB",
          "operator": "attention"
        },
        {
          "config_id": "m128_n128_w8_s2",
          "config": {
            "BLOCK_M": 128,
            "BLOCK_N": 128,
            "num_warps": 8,
            "num_stages": 2
          },
          "tflops": 103.01,
          "ms": 0.6671,
          "correct": true,
          "run_id": "m128_n128_w8_s2",
          "hardware": "NVIDIA A100-SXM4-80GB",
          "operator": "attention"
        },
        {
          "config_id": "m64_n32_w2_s4",
          "config": {
            "BLOCK_M": 64,
            "BLOCK_N": 32,
            "num_warps": 2,
            "num_stages": 4
          },
          "tflops": 139.58,
          "ms": 0.4923,
          "correct": true,
          "run_id": "m64_n32_w2_s4",
          "hardware": "NVIDIA A100-SXM4-80GB",
          "operator": "attention"
        },
        {
          "config_id": "m32_n64_w2_s4",
          "config": {
            "BLOCK_M": 32,
            "BLOCK_N": 64,
            "num_warps": 2,
            "num_stages": 4
          },
          "tflops": 64.54,
          "ms": 1.0648,
          "correct": true,
          "run_id": "m32_n64_w2_s4",
          "hardware": "NVIDIA A100-SXM4-80GB",
          "operator": "attention"
        },
        {
          "config_id": "m64_n64_w4_s2",
          "config": {
            "BLOCK_M": 64,
            "BLOCK_N": 64,
            "num_warps": 4,
            "num_stages": 2
          },
          "tflops": 143.83,
          "ms": 0.4778,
          "correct": true,
          "run_id": "m64_n64_w4_s2",
          "hardware": "NVIDIA A100-SXM4-80GB",
          "operator": "attention"
        },
        {
          "config_id": "m32_n32_w2_s2",
          "config": {
            "BLOCK_M": 32,
            "BLOCK_N": 32,
            "num_warps": 2,
            "num_stages": 2
          },
          "tflops": 86.66,
          "ms": 0.7929,
          "correct": true,
          "run_id": "m32_n32_w2_s2",
          "hardware": "NVIDIA A100-SXM4-80GB",
          "operator": "attention"
        },
        {
          "config_id": "m32_n32_w2_s3",
          "config": {
            "BLOCK_M": 32,
            "BLOCK_N": 32,
            "num_warps": 2,
            "num_stages": 3
          },
          "tflops": 90.37,
          "ms": 0.7605,
          "correct": true,
          "run_id": "m32_n32_w2_s3",
          "hardware": "NVIDIA A100-SXM4-80GB",
          "operator": "attention"
        },
        {
          "config_id": "m32_n32_w4_s2",
          "config": {
            "BLOCK_M": 32,
            "BLOCK_N": 32,
            "num_warps": 4,
            "num_stages": 2
          },
          "tflops": 62.25,
          "ms": 1.1039,
          "correct": true,
          "run_id": "m32_n32_w4_s2",
          "hardware": "NVIDIA A100-SXM4-80GB",
          "operator": "attention"
        },
        {
          "config_id": "m32_n32_w4_s3",
          "config": {
            "BLOCK_M": 32,
            "BLOCK_N": 32,
            "num_warps": 4,
            "num_stages": 3
          },
          "tflops": 64.23,
          "ms": 1.07,
          "correct": true,
          "run_id": "m32_n32_w4_s3",
          "hardware": "NVIDIA A100-SXM4-80GB",
          "operator": "attention"
        }
      ]
    },
    "attention:long_128:NVIDIA A100-SXM4-80GB": {
      "shape_key": "attention:long_128:NVIDIA A100-SXM4-80GB",
      "shape": {
        "batch": 1,
        "heads": 16,
        "seq_len": 4096,
        "head_dim": 128,
        "bucket": "long_128"
      },
      "best_config_id": "m128_n64_w8_s3",
      "best_tflops": 161.08,
      "results": [
        {
          "config_id": "m64_n64_w4_s3",
          "config": {
            "BLOCK_M": 64,
            "BLOCK_N": 64,
            "num_warps": 4,
            "num_stages": 3
          },
          "tflops": 71.94,
          "ms": 1.9104,
          "correct": true,
          "run_id": "m64_n64_w4_s3",
          "hardware": "NVIDIA A100-SXM4-80GB",
          "operator": "attention"
        },
        {
          "config_id": "m128_n64_w8_s3",
          "config": {
            "BLOCK_M": 128,
            "BLOCK_N": 64,
            "num_warps": 8,
            "num_stages": 3
          },
          "tflops": 161.08,
          "ms": 0.8533,
          "correct": true,
          "run_id": "m128_n64_w8_s3",
          "hardware": "NVIDIA A100-SXM4-80GB",
          "operator": "attention"
        },
        {
          "config_id": "m128_n32_w4_s3",
          "config": {
            "BLOCK_M": 128,
            "BLOCK_N": 32,
            "num_warps": 4,
            "num_stages": 3
          },
          "tflops": 132.22,
          "ms": 1.0394,
          "correct": true,
          "run_id": "m128_n32_w4_s3",
          "hardware": "NVIDIA A100-SXM4-80GB",
          "operator": "attention"
        },
        {
          "config_id": "m64_n128_w4_s3",
          "config": {
            "BLOCK_M": 64,
            "BLOCK_N": 128,
            "num_warps": 4,
            "num_stages": 3
          },
          "tflops": 113.58,
          "ms": 1.2101,
          "correct": true,
          "run_id": "m64_n128_w4_s3",
          "hardware": "NVIDIA A100-SXM4-80GB",
          "operator": "attention"
        },
        {
          "config_id": "m128_n128_w8_s2",
          "config": {
            "BLOCK_M": 128,
            "BLOCK_N": 128,
            "num_warps": 8,
            "num_stages": 2
          },
          "tflops": 132.68,
          "ms": 1.0359,
          "correct": true,
          "run_id": "m128_n128_w8_s2",
          "hardware": "NVIDIA A100-SXM4-80GB",
          "operator": "attention"
        },
        {
          "config_id": "m64_n32_w2_s4",
          "config": {
            "BLOCK_M": 64,
            "BLOCK_N": 32,
            "num_warps": 2,
            "num_stages": 4
          },
          "tflops": 81.0,
          "ms": 1.6967,
          "correct": true,
          "run_id": "m64_n32_w2_s4",
          "hardware": "NVIDIA A100-SXM4-80GB",
          "operator": "attention"
        },
        {
          "config_id": "m32_n64_w2_s4",
          "config": {
            "BLOCK_M": 32,
            "BLOCK_N": 64,
            "num_warps": 2,
            "num_stages": 4
          },
          "tflops": 57.83,
          "ms": 2.3767,
          "correct": true,
          "run_id": "m32_n64_w2_s4",
          "hardware": "NVIDIA A100-SXM4-80GB",
          "operator": "attention"
        },
        {
          "config_id": "m64_n64_w4_s2",
          "config": {
            "BLOCK_M": 64,
            "BLOCK_N": 64,
            "num_warps": 4,
            "num_stages": 2
          },
          "tflops": 119.64,
          "ms": 1.1488,
          "correct": true,
          "run_id": "m64_n64_w4_s2",
          "hardware": "NVIDIA A100-SXM4-80GB",
          "operator": "attention"
        },
        {
          "config_id": "m32_n32_w2_s2",
          "config": {
            "BLOCK_M": 32,
            "BLOCK_N": 32,
            "num_warps": 2,
            "num_stages": 2
          },
          "tflops": 96.57,
          "ms": 1.4233,
          "correct": true,
          "run_id": "m32_n32_w2_s2",
          "hardware": "NVIDIA A100-SXM4-80GB",
          "operator": "attention"
        },
        {
          "config_id": "m32_n32_w2_s3",
          "config": {
            "BLOCK_M": 32,
            "BLOCK_N": 32,
            "num_warps": 2,
            "num_stages": 3
          },
          "tflops": 72.4,
          "ms": 1.8982,
          "correct": true,
          "run_id": "m32_n32_w2_s3",
          "hardware": "NVIDIA A100-SXM4-80GB",
          "operator": "attention"
        },
        {
          "config_id": "m32_n32_w4_s2",
          "config": {
            "BLOCK_M": 32,
            "BLOCK_N": 32,
            "num_warps": 4,
            "num_stages": 2
          },
          "tflops": 85.75,
          "ms": 1.6029,
          "correct": true,
          "run_id": "m32_n32_w4_s2",
          "hardware": "NVIDIA A100-SXM4-80GB",
          "operator": "attention"
        },
        {
          "config_id": "m32_n32_w4_s3",
          "config": {
            "BLOCK_M": 32,
            "BLOCK_N": 32,
            "num_warps": 4,
            "num_stages": 3
          },
          "tflops": 81.8,
          "ms": 1.6802,
          "correct": true,
          "run_id": "m32_n32_w4_s3",
          "hardware": "NVIDIA A100-SXM4-80GB",
          "operator": "attention"
        }
      ]
    },
    "attention:llama7b:NVIDIA A100-SXM4-80GB": {
      "shape_key": "attention:llama7b:NVIDIA A100-SXM4-80GB",
      "shape": {
        "batch": 1,
        "heads": 32,
        "seq_len": 4096,
        "head_dim": 128,
        "bucket": "llama7b"
      },
      "best_config_id": "m128_n64_w8_s3",
      "best_tflops": 162.55,
      "results": [
        {
          "config_id": "m64_n64_w4_s3",
          "config": {
            "BLOCK_M": 64,
            "BLOCK_N": 64,
            "num_warps": 4,
            "num_stages": 3
          },
          "tflops": 75.75,
          "ms": 3.6287,
          "correct": true,
          "run_id": "m64_n64_w4_s3",
          "hardware": "NVIDIA A100-SXM4-80GB",
          "operator": "attention"
        },
        {
          "config_id": "m128_n64_w8_s3",
          "config": {
            "BLOCK_M": 128,
            "BLOCK_N": 64,
            "num_warps": 8,
            "num_stages": 3
          },
          "tflops": 162.55,
          "ms": 1.6911,
          "correct": true,
          "run_id": "m128_n64_w8_s3",
          "hardware": "NVIDIA A100-SXM4-80GB",
          "operator": "attention"
        },
        {
          "config_id": "m128_n32_w4_s3",
          "config": {
            "BLOCK_M": 128,
            "BLOCK_N": 32,
            "num_warps": 4,
            "num_stages": 3
          },
          "tflops": 138.72,
          "ms": 1.9816,
          "correct": true,
          "run_id": "m128_n32_w4_s3",
          "hardware": "NVIDIA A100-SXM4-80GB",
          "operator": "attention"
        },
        {
          "config_id": "m64_n128_w4_s3",
          "config": {
            "BLOCK_M": 64,
            "BLOCK_N": 128,
            "num_warps": 4,
            "num_stages": 3
          },
          "tflops": 119.19,
          "ms": 2.3062,
          "correct": true,
          "run_id": "m64_n128_w4_s3",
          "hardware": "NVIDIA A100-SXM4-80GB",
          "operator": "attention"
        },
        {
          "config_id": "m128_n128_w8_s2",
          "config": {
            "BLOCK_M": 128,
            "BLOCK_N": 128,
            "num_warps": 8,
            "num_stages": 2
          },
          "tflops": 135.14,
          "ms": 2.034,
          "correct": true,
          "run_id": "m128_n128_w8_s2",
          "hardware": "NVIDIA A100-SXM4-80GB",
          "operator": "attention"
        },
        {
          "config_id": "m64_n32_w2_s4",
          "config": {
            "BLOCK_M": 64,
            "BLOCK_N": 32,
            "num_warps": 2,
            "num_stages": 4
          },
          "tflops": 86.47,
          "ms": 3.1787,
          "correct": true,
          "run_id": "m64_n32_w2_s4",
          "hardware": "NVIDIA A100-SXM4-80GB",
          "operator": "attention"
        },
        {
          "config_id": "m32_n64_w2_s4",
          "config": {
            "BLOCK_M": 32,
            "BLOCK_N": 64,
            "num_warps": 2,
            "num_stages": 4
          },
          "tflops": 58.06,
          "ms": 4.7348,
          "correct": true,
          "run_id": "m32_n64_w2_s4",
          "hardware": "NVIDIA A100-SXM4-80GB",
          "operator": "attention"
        },
        {
          "config_id": "m64_n64_w4_s2",
          "config": {
            "BLOCK_M": 64,
            "BLOCK_N": 64,
            "num_warps": 4,
            "num_stages": 2
          },
          "tflops": 125.39,
          "ms": 2.1922,
          "correct": true,
          "run_id": "m64_n64_w4_s2",
          "hardware": "NVIDIA A100-SXM4-80GB",
          "operator": "attention"
        },
        {
          "config_id": "m32_n32_w2_s2",
          "config": {
            "BLOCK_M": 32,
            "BLOCK_N": 32,
            "num_warps": 2,
            "num_stages": 2
          },
          "tflops": 98.75,
          "ms": 2.7837,
          "correct": true,
          "run_id": "m32_n32_w2_s2",
          "hardware": "NVIDIA A100-SXM4-80GB",
          "operator": "attention"
        },
        {
          "config_id": "m32_n32_w2_s3",
          "config": {
            "BLOCK_M": 32,
            "BLOCK_N": 32,
            "num_warps": 2,
            "num_stages": 3
          },
          "tflops": 73.87,
          "ms": 3.7213,
          "correct": true,
          "run_id": "m32_n32_w2_s3",
          "hardware": "NVIDIA A100-SXM4-80GB",
          "operator": "attention"
        },
        {
          "config_id": "m32_n32_w4_s2",
          "config": {
            "BLOCK_M": 32,
            "BLOCK_N": 32,
            "num_warps": 4,
            "num_stages": 2
          },
          "tflops": 87.24,
          "ms": 3.1508,
          "correct": true,
          "run_id": "m32_n32_w4_s2",
          "hardware": "NVIDIA A100-SXM4-80GB",
          "operator": "attention"
        },
        {
          "config_id": "m32_n32_w4_s3",
          "config": {
            "BLOCK_M": 32,
            "BLOCK_N": 32,
            "num_warps": 4,
            "num_stages": 3
          },
          "tflops": 83.6,
          "ms": 3.2878,
          "correct": true,
          "run_id": "m32_n32_w4_s3",
          "hardware": "NVIDIA A100-SXM4-80GB",
          "operator": "attention"
        }
      ]
    }
  }
}
